CALL mtr.add_suppression(
"PRESERVE: rolled back prepared transaction without snapshot during recovery");
CREATE TABLE xfer2_w01_accounts(
id INT PRIMARY KEY,
balance INT NOT NULL,
version INT NOT NULL DEFAULT 0,
pad VARCHAR(64) NOT NULL
) ENGINE=InnoDB;
CREATE TABLE xfer2_w01_audit(
id BIGINT AUTO_INCREMENT PRIMARY KEY,
account_id INT NOT NULL,
delta INT NOT NULL,
KEY(account_id)
) ENGINE=InnoDB;
INSERT INTO xfer2_w01_accounts
WITH RECURSIVE seq(n) AS (
SELECT 1 UNION ALL SELECT n+1 FROM seq WHERE n<32
)
SELECT n, 1000, 0, CONCAT('account-', n) FROM seq;
SET GLOBAL rds_preserve_trx_drain_phase1_timeout_ms=120000;
SET GLOBAL rds_preserve_trx_drain_phase2_timeout_ms=120000;
SET GLOBAL rds_preserve_trx_token_retention_timeout_ms=120000;
SET SESSION TRANSACTION ISOLATION LEVEL REPEATABLE READ;
START TRANSACTION;
SELECT balance=1001 AND version=1 AS small_owner_rr_background_visible
FROM xfer2_w01_accounts WHERE id=32;
small_owner_rr_background_visible
1
UPDATE xfer2_w01_accounts
SET balance=balance-19,version=version+1 WHERE id=1;
UPDATE xfer2_w01_accounts
SET balance=balance+19,version=version+1 WHERE id=2;
INSERT INTO xfer2_w01_audit(account_id,delta) VALUES(1,-19),(2,19);
SELECT COUNT(*)=2 AND SUM(balance)=2000 AND SUM(version)=2
AS small_w04_balance_conserved
FROM xfer2_w01_accounts WHERE id IN (1,2);
small_w04_balance_conserved
1
SELECT COUNT(*)=2 AND SUM(delta)=0
AND SUM(account_id=1 AND delta=-19)=1
AND SUM(account_id=2 AND delta=19)=1
AS small_w04_ledger_exact
FROM xfer2_w01_audit;
small_w04_ledger_exact
1
SET SESSION TRANSACTION ISOLATION LEVEL REPEATABLE READ;
SET @x1204_context=REPEAT('many-table-index-context-',65536);
START TRANSACTION;
SELECT id=64 AND score=640 AND version=0 AS large_owner_old_view_established
FROM xfer2_x1204_t1 FORCE INDEX(PRIMARY) WHERE id=64;
large_owner_old_view_established
1
UPDATE xfer2_x1204_t1
SET score=score+50,version=version+1 WHERE id=64;
SELECT ROW_COUNT()=1 AS outsider_many_table_commit_applied;
outsider_many_table_commit_applied
1
SELECT id=64 AND score=640 AND version=0 AS large_owner_retains_old_view
FROM xfer2_x1204_t1 FORCE INDEX(PRIMARY) WHERE id=64;
large_owner_retains_old_view
1
UPDATE xfer2_x1204_t1
SET business_key='t1-new-0008',bucket=80,score=score+8,version=version+1
WHERE id=8;
UPDATE xfer2_x1204_t2
SET business_key='t2-new-0016',bucket=81,score=score+16,version=version+1
WHERE id=16;
UPDATE xfer2_x1204_t3
SET business_key='t3-new-0024',bucket=82,score=score+24,version=version+1
WHERE id=24;
UPDATE xfer2_x1204_t4
SET business_key='t4-new-0032',bucket=83,score=score+32,version=version+1
WHERE id=32;
UPDATE xfer2_x1204_t5
SET business_key='t5-new-0040',bucket=84,score=score+40,version=version+1
WHERE id=40;
UPDATE xfer2_x1204_t6
SET business_key='t6-new-0048',bucket=85,score=score+48,version=version+1
WHERE id=48;
INSERT INTO xfer2_x1204_t3
VALUES(129,'t3-new-0129',86,1290,1,REPEAT('Z',400));
DELETE FROM xfer2_x1204_t4 WHERE id=7;
SELECT COUNT(*)=384 AND SUM(score)=126188 AND SUM(version)=7
AS large_w03_view_and_writes_exact
FROM (
SELECT score,version FROM xfer2_x1204_t1
UNION ALL SELECT score,version FROM xfer2_x1204_t2
UNION ALL SELECT score,version FROM xfer2_x1204_t3
UNION ALL SELECT score,version FROM xfer2_x1204_t4
UNION ALL SELECT score,version FROM xfer2_x1204_t5
UNION ALL SELECT score,version FROM xfer2_x1204_t6
) AS all_rows;
large_w03_view_and_writes_exact
1
SELECT COUNT(*)=7 AS large_w03_secondary_keys_exact
FROM (
SELECT id FROM xfer2_x1204_t1 FORCE INDEX(idx_bucket) WHERE bucket>=80
UNION ALL SELECT id FROM xfer2_x1204_t2 FORCE INDEX(idx_bucket) WHERE bucket>=80
UNION ALL SELECT id FROM xfer2_x1204_t3 FORCE INDEX(idx_bucket) WHERE bucket>=80
UNION ALL SELECT id FROM xfer2_x1204_t4 FORCE INDEX(idx_bucket) WHERE bucket>=80
UNION ALL SELECT id FROM xfer2_x1204_t5 FORCE INDEX(idx_bucket) WHERE bucket>=80
UNION ALL SELECT id FROM xfer2_x1204_t6 FORCE INDEX(idx_bucket) WHERE bucket>=80
) AS new_secondary;
large_w03_secondary_keys_exact
1
SELECT OCTET_LENGTH(@x1204_context)>1500000 AS large_context_is_nontrivial;
large_context_is_nontrivial
1
SELECT COUNT(*)=384 AND SUM(score)=124850 AND SUM(version)=1
AS outsider_sees_only_committed_many_table_state
FROM (
SELECT score,version FROM xfer2_x1204_t1
UNION ALL SELECT score,version FROM xfer2_x1204_t2
UNION ALL SELECT score,version FROM xfer2_x1204_t3
UNION ALL SELECT score,version FROM xfer2_x1204_t4
UNION ALL SELECT score,version FROM xfer2_x1204_t5
UNION ALL SELECT score,version FROM xfer2_x1204_t6
) AS all_rows;
outsider_sees_only_committed_many_table_state
1
SELECT COUNT(*)=0 AS large_owner_new_keys_hidden
FROM (
SELECT business_key FROM xfer2_x1204_t1 WHERE business_key LIKE 't1-new-%'
    UNION ALL SELECT business_key FROM xfer2_x1204_t2 WHERE business_key LIKE 't2-new-%'
    UNION ALL SELECT business_key FROM xfer2_x1204_t3 WHERE business_key LIKE 't3-new-%'
    UNION ALL SELECT business_key FROM xfer2_x1204_t4 WHERE business_key LIKE 't4-new-%'
    UNION ALL SELECT business_key FROM xfer2_x1204_t5 WHERE business_key LIKE 't5-new-%'
    UNION ALL SELECT business_key FROM xfer2_x1204_t6 WHERE business_key LIKE 't6-new-%'
  ) AS new_keys;
large_owner_new_keys_hidden
1
SELECT COUNT(*)=32 AND SUM(balance)=32001 AND SUM(version)=1
AS small_owner_updates_hidden
FROM xfer2_w01_accounts;
small_owner_updates_hidden
1
SELECT COUNT(*)=0 AS small_owner_ledger_hidden FROM xfer2_w01_audit;
small_owner_ledger_hidden
1
SET @x1204_old_memory_budget=@@GLOBAL.rds_preserve_trx_memory_budget_bytes;
SET @x1204_old_prewarm_paused=@@GLOBAL.rds_preserve_trx_transfer_prewarm_paused;
SET GLOBAL rds_preserve_trx_transfer_prewarm_paused=ON;
SET GLOBAL rds_preserve_trx_token_retention_timeout_ms=120000;
DROP TABLE IF EXISTS xfer2_x1204_receiver_native,xfer2_x1204_t6,
xfer2_x1204_t5,xfer2_x1204_t4,xfer2_x1204_t3,
xfer2_x1204_t2,xfer2_x1204_t1,
xfer2_w01_audit,xfer2_w01_accounts;
CREATE TABLE xfer2_w01_accounts(
id INT PRIMARY KEY,
balance INT NOT NULL,
version INT NOT NULL DEFAULT 0,
pad VARCHAR(64) NOT NULL
) ENGINE=InnoDB;
CREATE TABLE xfer2_w01_audit(
id BIGINT AUTO_INCREMENT PRIMARY KEY,
account_id INT NOT NULL,
delta INT NOT NULL,
KEY(account_id)
) ENGINE=InnoDB;
CREATE TABLE xfer2_x1204_t1(
id INT PRIMARY KEY,
business_key VARCHAR(40) NOT NULL,
bucket INT NOT NULL,
score INT NOT NULL,
version INT NOT NULL DEFAULT 0,
pad VARCHAR(512) NOT NULL,
UNIQUE KEY uk_business(business_key),
KEY idx_bucket(bucket,id)
) ENGINE=InnoDB;
CREATE TABLE xfer2_x1204_t2 LIKE xfer2_x1204_t1;
CREATE TABLE xfer2_x1204_t3 LIKE xfer2_x1204_t1;
CREATE TABLE xfer2_x1204_t4 LIKE xfer2_x1204_t1;
CREATE TABLE xfer2_x1204_t5 LIKE xfer2_x1204_t1;
CREATE TABLE xfer2_x1204_t6 LIKE xfer2_x1204_t1;
SELECT @x1204_receiver_dict_identity_matches=1
AS receiver_physical_dictionary_identity_matches;
receiver_physical_dictionary_identity_matches
1
CREATE TABLE xfer2_x1204_receiver_native(
id INT PRIMARY KEY,
v INT NOT NULL,
KEY(v)
) ENGINE=InnoDB;
INSERT INTO xfer2_x1204_receiver_native VALUES(1,10),(2,20);
SET @x1204_online_before=(SELECT VARIABLE_VALUE+0 FROM performance_schema.global_status
WHERE VARIABLE_NAME='Preserve_trx_transfer_receiver_online_epochs');
SET @x1204_active_before=(SELECT VARIABLE_VALUE+0 FROM performance_schema.global_status
WHERE VARIABLE_NAME='Preserve_trx_transfer_receiver_active_epochs');
SET @x1204_terminal_before=(SELECT VARIABLE_VALUE+0 FROM performance_schema.global_status
WHERE VARIABLE_NAME='Preserve_trx_transfer_receiver_terminal_cas_wins');
SET @x1204_tombstones_before=(SELECT VARIABLE_VALUE+0 FROM performance_schema.global_status
WHERE VARIABLE_NAME='Preserve_trx_transfer_receiver_terminal_status_tombstones');
SET @x1204_classified_before=(SELECT VARIABLE_VALUE+0 FROM performance_schema.global_status
WHERE VARIABLE_NAME='Preserve_trx_transfer_receiver_auto_prewarm_tokens');
SET @x1204_ready_before=(SELECT VARIABLE_VALUE+0 FROM performance_schema.global_status
WHERE VARIABLE_NAME='Preserve_trx_transfer_receiver_auto_prewarm_ready_tokens');
SET @x1204_not_ready_before=(SELECT VARIABLE_VALUE+0 FROM performance_schema.global_status
WHERE VARIABLE_NAME='Preserve_trx_transfer_receiver_auto_prewarm_not_ready_tokens');
SET @x1204_failed_before=(SELECT VARIABLE_VALUE+0 FROM performance_schema.global_status
WHERE VARIABLE_NAME='Preserve_trx_transfer_receiver_failed_tokens');
SET @x1204_saved_before=(SELECT VARIABLE_VALUE+0 FROM performance_schema.global_status
WHERE VARIABLE_NAME='Preserve_trx_transfer_receiver_saved_online_tokens');
SET @x1204_seal_before=(SELECT VARIABLE_VALUE+0 FROM performance_schema.global_status
WHERE VARIABLE_NAME='Preserve_trx_transfer_receiver_seal_prewarm_tokens');
SET @x1204_seal_success_before=(SELECT VARIABLE_VALUE+0 FROM performance_schema.global_status
WHERE VARIABLE_NAME='Preserve_trx_transfer_receiver_seal_prewarm_success_tokens');
SET @x1204_seal_not_ready_before=(SELECT VARIABLE_VALUE+0 FROM performance_schema.global_status
WHERE VARIABLE_NAME='Preserve_trx_transfer_receiver_seal_prewarm_not_ready_tokens');
SET @x1204_inflight_tokens_before=(SELECT VARIABLE_VALUE+0 FROM performance_schema.global_status
WHERE VARIABLE_NAME='Preserve_trx_transfer_receiver_inflight_tokens');
SET @x1204_inflight_bytes_before=(SELECT VARIABLE_VALUE+0 FROM performance_schema.global_status
WHERE VARIABLE_NAME='Preserve_trx_transfer_receiver_inflight_bytes');
SET @x1204_staged_before=(SELECT VARIABLE_VALUE+0 FROM performance_schema.global_status
WHERE VARIABLE_NAME='Preserve_trx_transfer_receiver_staged_memory_bytes');
SET @x1204_debt_tokens_before=(SELECT VARIABLE_VALUE+0 FROM performance_schema.global_status
WHERE VARIABLE_NAME='Preserve_trx_transfer_receiver_cleanup_debt_tokens');
SET @x1204_debt_bytes_before=(SELECT VARIABLE_VALUE+0 FROM performance_schema.global_status
WHERE VARIABLE_NAME='Preserve_trx_transfer_receiver_cleanup_debt_bytes');
SET @x1204_prepared_before=(SELECT VARIABLE_VALUE+0 FROM performance_schema.global_status
WHERE VARIABLE_NAME='Preserve_trx_promotion_prepared_registered_tokens');
SET @x1204_pending_before=(SELECT VARIABLE_VALUE+0 FROM performance_schema.global_status
WHERE VARIABLE_NAME='Preserve_trx_promotion_prepared_prewarm_pending_tokens');
SET @x1204_prepared_ready_before=(SELECT VARIABLE_VALUE+0 FROM performance_schema.global_status
WHERE VARIABLE_NAME='Preserve_trx_promotion_prepared_ready_tokens');
SET @x1204_ready_cache_before=(SELECT VARIABLE_VALUE+0 FROM performance_schema.global_status
WHERE VARIABLE_NAME='Preserve_trx_promotion_ready_cache_bytes');
SET @x1204_memory_before=(SELECT VARIABLE_VALUE+0 FROM performance_schema.global_status
WHERE VARIABLE_NAME='Preserve_trx_memory_current_bytes');
SET DEBUG_SYNC=
'preserve_trx_transfer_before_commit_send_ownership_cas SIGNAL xfer2_x1204_payloads_acked WAIT_FOR xfer2_x1204_release';
DRAIN TRANSACTIONS PRESERVE WITH USER VARS;
SET DEBUG_SYNC='now WAIT_FOR xfer2_x1204_payloads_acked TIMEOUT 180';
SELECT (SELECT VARIABLE_VALUE+0 FROM performance_schema.global_status
WHERE VARIABLE_NAME='Preserve_trx_transfer_receiver_auto_prewarm_tokens')
=@x1204_classified_before AS no_premature_classification,
(SELECT VARIABLE_VALUE+0 FROM performance_schema.global_status
WHERE VARIABLE_NAME='Preserve_trx_transfer_receiver_queued_bytes')>0
AS both_tokens_reach_real_queue;
no_premature_classification	both_tokens_reach_real_queue
1	1
SET GLOBAL rds_preserve_trx_memory_budget_bytes=524288;
START TRANSACTION;
UPDATE xfer2_x1204_receiver_native SET v=v+id;
INSERT INTO xfer2_x1204_receiver_native VALUES(3,30);
COMMIT;
SELECT COUNT(*)=3 AND SUM(v)=63 AS receiver_native_commit_under_pressure
FROM xfer2_x1204_receiver_native;
receiver_native_commit_under_pressure
1
SET GLOBAL rds_preserve_trx_transfer_prewarm_paused=OFF;
SELECT (SELECT VARIABLE_VALUE+0 FROM performance_schema.global_status
WHERE VARIABLE_NAME='Preserve_trx_transfer_receiver_seal_prewarm_tokens')
=@x1204_seal_before+2 AS both_tokens_reach_strict_prewarm,
(SELECT VARIABLE_VALUE+0 FROM performance_schema.global_status
WHERE VARIABLE_NAME='Preserve_trx_transfer_receiver_seal_prewarm_success_tokens')
=@x1204_seal_success_before+1 AS only_small_token_prewarm_succeeds,
(SELECT VARIABLE_VALUE+0 FROM performance_schema.global_status
WHERE VARIABLE_NAME='Preserve_trx_transfer_receiver_seal_prewarm_not_ready_tokens')
=@x1204_seal_not_ready_before+1 AS large_token_hits_resource_limit;
both_tokens_reach_strict_prewarm	only_small_token_prewarm_succeeds	large_token_hits_resource_limit
1	1	1
SELECT (SELECT VARIABLE_VALUE+0 FROM performance_schema.global_status
WHERE VARIABLE_NAME='Preserve_trx_transfer_receiver_auto_prewarm_tokens')
=@x1204_classified_before AS no_classification_before_terminal_commit;
no_classification_before_terminal_commit
1
SET DEBUG_SYNC='now SIGNAL xfer2_x1204_release';
generation	outcome	source_connection_id	token_role	reason	closing_started_us	closing_deadline_us
GENERATION	SUCCESS	SOURCE_ID	SURVIVOR	NONE	CLOSING_STARTED_US	CLOSING_DEADLINE_US
GENERATION	SUCCESS	SOURCE_ID	SURVIVOR	NONE	CLOSING_STARTED_US	CLOSING_DEADLINE_US
SET DEBUG_SYNC='RESET';
SELECT (SELECT VARIABLE_VALUE+0 FROM performance_schema.global_status
WHERE VARIABLE_NAME='Preserve_trx_transfer_receiver_auto_prewarm_tokens')
=@x1204_classified_before+2 AS exactly_two_tokens_classified,
(SELECT VARIABLE_VALUE+0 FROM performance_schema.global_status
WHERE VARIABLE_NAME='Preserve_trx_transfer_receiver_auto_prewarm_ready_tokens')
=@x1204_ready_before+1 AS exactly_one_ready_sibling,
(SELECT VARIABLE_VALUE+0 FROM performance_schema.global_status
WHERE VARIABLE_NAME='Preserve_trx_transfer_receiver_auto_prewarm_not_ready_tokens')
=@x1204_not_ready_before+1 AS exactly_one_resource_limited_token;
exactly_two_tokens_classified	exactly_one_ready_sibling	exactly_one_resource_limited_token
1	1	1
SELECT (SELECT VARIABLE_VALUE+0 FROM performance_schema.global_status
WHERE VARIABLE_NAME='Preserve_trx_transfer_receiver_failed_tokens')
=@x1204_failed_before+2
AS pruned_non_target_plus_resource_limited_token;
pruned_non_target_plus_resource_limited_token
1
SELECT VARIABLE_VALUE='receiver_selection_failed:2'
         AS resource_limit_reason_is_exact
FROM performance_schema.global_status
WHERE VARIABLE_NAME='Preserve_trx_transfer_receiver_last_failed_reason';
resource_limit_reason_is_exact
1
SELECT (SELECT VARIABLE_VALUE+0 FROM performance_schema.global_status
WHERE VARIABLE_NAME='Preserve_trx_transfer_receiver_saved_online_tokens')
=@x1204_saved_before+1 AS only_small_token_saved,
(SELECT VARIABLE_VALUE+0 FROM performance_schema.global_status
WHERE VARIABLE_NAME='Preserve_trx_promotion_prepared_registered_tokens')
=@x1204_prepared_before+1 AS only_small_token_prepared,
(SELECT VARIABLE_VALUE+0 FROM performance_schema.global_status
WHERE VARIABLE_NAME='Preserve_trx_promotion_prepared_ready_tokens')
=@x1204_prepared_ready_before+1 AS only_small_token_prepared_ready;
only_small_token_saved	only_small_token_prepared	only_small_token_prepared_ready
1	1	1
SELECT (SELECT VARIABLE_VALUE+0 FROM performance_schema.global_status
WHERE VARIABLE_NAME='Preserve_trx_promotion_ready_cache_bytes')
>@x1204_ready_cache_before AS ready_subset_keeps_cache,
(SELECT VARIABLE_VALUE+0 FROM performance_schema.global_status
WHERE VARIABLE_NAME='Preserve_trx_memory_current_bytes')
>@x1204_memory_before AS ready_subset_keeps_owned_memory;
ready_subset_keeps_cache	ready_subset_keeps_owned_memory
1	1
SELECT (SELECT VARIABLE_VALUE+0 FROM performance_schema.global_status
WHERE VARIABLE_NAME='Preserve_trx_transfer_receiver_inflight_tokens')
=@x1204_inflight_tokens_before AS failed_token_inflight_released,
(SELECT VARIABLE_VALUE+0 FROM performance_schema.global_status
WHERE VARIABLE_NAME='Preserve_trx_transfer_receiver_inflight_bytes')
=@x1204_inflight_bytes_before AS failed_token_bytes_released,
(SELECT VARIABLE_VALUE+0 FROM performance_schema.global_status
WHERE VARIABLE_NAME='Preserve_trx_transfer_receiver_staged_memory_bytes')
=@x1204_staged_before AS failed_token_staging_released;
failed_token_inflight_released	failed_token_bytes_released	failed_token_staging_released
1	1	1
SELECT (SELECT VARIABLE_VALUE+0 FROM performance_schema.global_status
WHERE VARIABLE_NAME='Preserve_trx_transfer_receiver_cleanup_debt_tokens')
=@x1204_debt_tokens_before AS no_cleanup_debt_token,
(SELECT VARIABLE_VALUE+0 FROM performance_schema.global_status
WHERE VARIABLE_NAME='Preserve_trx_transfer_receiver_cleanup_debt_bytes')
=@x1204_debt_bytes_before AS no_cleanup_debt_bytes,
(SELECT VARIABLE_VALUE+0 FROM performance_schema.global_status
WHERE VARIABLE_NAME='Preserve_trx_transfer_receiver_worker_active')=0
AS no_active_worker,
(SELECT VARIABLE_VALUE+0 FROM performance_schema.global_status
WHERE VARIABLE_NAME='Preserve_trx_transfer_receiver_worker_idle')=0
AS worker_pool_auto_stopped;
no_cleanup_debt_token	no_cleanup_debt_bytes	no_active_worker	worker_pool_auto_stopped
1	1	1	1
SELECT COUNT(*)=3 AND SUM(v)=63 AS receiver_native_commit_still_exact
FROM xfer2_x1204_receiver_native;
receiver_native_commit_still_exact
1
SET @x1204_restore_budget_sql=CONCAT(
'SET GLOBAL rds_preserve_trx_memory_budget_bytes=',
CAST(@x1204_old_memory_budget AS UNSIGNED));
PREPARE x1204_restore_budget FROM @x1204_restore_budget_sql;
EXECUTE x1204_restore_budget;
DEALLOCATE PREPARE x1204_restore_budget;
SET @x1204_restore_pause_sql=CONCAT(
'SET GLOBAL rds_preserve_trx_transfer_prewarm_paused=',
IF(@x1204_old_prewarm_paused,'ON','OFF'));
PREPARE x1204_restore_pause FROM @x1204_restore_pause_sql;
EXECUTE x1204_restore_pause;
DEALLOCATE PREPARE x1204_restore_pause;
SELECT COUNT(*)=2 AS exactly_two_preserved_owners,
SUM(MOD_TABLES_COUNT=2)=1 AS one_small_w04_owner,
SUM(MOD_TABLES_COUNT=6)=1 AS one_six_table_w03_owner,
SUM(HAS_READ_VIEW='YES')=2 AS both_owners_keep_rr_views
FROM performance_schema.preserved_transactions;
exactly_two_preserved_owners	one_small_w04_owner	one_six_table_w03_owner	both_owners_keep_rr_views
1	1	1	1
SET GLOBAL rds_preserve_trx_drain_phase1_timeout_ms=600000;
SET GLOBAL rds_preserve_trx_drain_phase2_timeout_ms=30000;
SET GLOBAL rds_preserve_trx_token_retention_timeout_ms=30000;
SELECT 1;
ERROR HY000: Preserve drain is active; this command was not executed
SELECT 1;
ERROR HY000: Preserve drain is active; this command was not executed
source_ha_control_session
1
SELECT COUNT(*)=32 AS thirty_two_accounts,
SUM(balance)=32001 AS committed_background_balance,
SUM(version)=1 AS one_committed_background_version,
MAX(CASE WHEN id=32 THEN balance END)=1001 AS background_update_visible,
MAX(CASE WHEN id=3 THEN version END)=0 AS owner_updates_hidden
FROM xfer2_w01_accounts;
thirty_two_accounts	committed_background_balance	one_committed_background_version	background_update_visible	owner_updates_hidden
1	1	1	1	1
SELECT COUNT(*)=0 AS no_committed_audit FROM xfer2_w01_audit;
no_committed_audit
1
DROP TABLE xfer2_w01_audit;
DROP TABLE xfer2_w01_accounts;
DROP USER xfer2_w01_app@localhost;
DROP USER preserve_trx_ha_admin@localhost;
DROP USER preserve_trx_ha_admin@localhost;
SELECT (SELECT VARIABLE_VALUE+0 FROM performance_schema.global_status
WHERE VARIABLE_NAME='Preserve_trx_transfer_receiver_active_epochs')=0
AS no_receiver_epoch_after_restart,
(SELECT VARIABLE_VALUE+0 FROM performance_schema.global_status
WHERE VARIABLE_NAME='Preserve_trx_transfer_receiver_inflight_tokens')=0
AS no_inflight_token_after_restart,
(SELECT VARIABLE_VALUE+0 FROM performance_schema.global_status
WHERE VARIABLE_NAME='Preserve_trx_transfer_receiver_inflight_bytes')=0
AS no_inflight_byte_after_restart,
(SELECT VARIABLE_VALUE+0 FROM performance_schema.global_status
WHERE VARIABLE_NAME=
'Preserve_trx_transfer_receiver_staged_memory_bytes')=0
AS no_staged_memory_after_restart,
(SELECT VARIABLE_VALUE+0 FROM performance_schema.global_status
WHERE VARIABLE_NAME='Preserve_trx_promotion_prepared_registered_tokens')=0
AS no_prepared_entry_after_restart,
(SELECT VARIABLE_VALUE+0 FROM performance_schema.global_status
WHERE VARIABLE_NAME=
'Preserve_trx_promotion_prepared_prewarm_pending_tokens')=0
AS no_prewarm_pending_after_restart,
(SELECT VARIABLE_VALUE+0 FROM performance_schema.global_status
WHERE VARIABLE_NAME='Preserve_trx_promotion_prepared_ready_tokens')=0
AS no_prepared_ready_after_restart,
(SELECT VARIABLE_VALUE+0 FROM performance_schema.global_status
WHERE VARIABLE_NAME='Preserve_trx_promotion_ready_cache_bytes')=0
AS no_ready_cache_after_restart,
(SELECT VARIABLE_VALUE+0 FROM performance_schema.global_status
WHERE VARIABLE_NAME='Preserve_trx_memory_current_bytes')=0
AS no_preserve_memory_after_restart,
(SELECT VARIABLE_VALUE+0 FROM performance_schema.global_status
WHERE VARIABLE_NAME='Preserve_trx_transfer_receiver_worker_active')=0
AS no_active_worker_after_restart,
(SELECT VARIABLE_VALUE+0 FROM performance_schema.global_status
WHERE VARIABLE_NAME='Preserve_trx_transfer_receiver_queued_bytes')=0
AS no_queued_byte_after_restart;
no_receiver_epoch_after_restart	no_inflight_token_after_restart	no_inflight_byte_after_restart	no_staged_memory_after_restart	no_prepared_entry_after_restart	no_prewarm_pending_after_restart	no_prepared_ready_after_restart	no_ready_cache_after_restart	no_preserve_memory_after_restart	no_active_worker_after_restart	no_queued_byte_after_restart
1	1	1	1	1	1	1	1	1	1	1
SELECT COUNT(*)=384 AND SUM(score)=124850 AND SUM(version)=1
AS many_table_final_committed_state_exact
FROM (
SELECT score,version FROM xfer2_x1204_t1
UNION ALL SELECT score,version FROM xfer2_x1204_t2
UNION ALL SELECT score,version FROM xfer2_x1204_t3
UNION ALL SELECT score,version FROM xfer2_x1204_t4
UNION ALL SELECT score,version FROM xfer2_x1204_t5
UNION ALL SELECT score,version FROM xfer2_x1204_t6
) AS all_rows;
many_table_final_committed_state_exact
1
SELECT SUM(cnt)=48 AND SUM(score_sum)=17330 AND SUM(version_sum)=1
AS many_table_secondary_state_exact
FROM (
SELECT COUNT(*) cnt,SUM(score) score_sum,SUM(version) version_sum
FROM xfer2_x1204_t1 FORCE INDEX(idx_bucket) WHERE bucket=0
UNION ALL SELECT COUNT(*),SUM(score),SUM(version)
FROM xfer2_x1204_t2 FORCE INDEX(idx_bucket) WHERE bucket=0
UNION ALL SELECT COUNT(*),SUM(score),SUM(version)
FROM xfer2_x1204_t3 FORCE INDEX(idx_bucket) WHERE bucket=0
UNION ALL SELECT COUNT(*),SUM(score),SUM(version)
FROM xfer2_x1204_t4 FORCE INDEX(idx_bucket) WHERE bucket=0
UNION ALL SELECT COUNT(*),SUM(score),SUM(version)
FROM xfer2_x1204_t5 FORCE INDEX(idx_bucket) WHERE bucket=0
UNION ALL SELECT COUNT(*),SUM(score),SUM(version)
FROM xfer2_x1204_t6 FORCE INDEX(idx_bucket) WHERE bucket=0
) AS bucket_zero;
many_table_secondary_state_exact
1
SELECT COUNT(*)=0 AS large_owner_new_keys_rolled_back
FROM (
SELECT business_key FROM xfer2_x1204_t1 WHERE business_key LIKE 't1-new-%'
    UNION ALL SELECT business_key FROM xfer2_x1204_t2 WHERE business_key LIKE 't2-new-%'
    UNION ALL SELECT business_key FROM xfer2_x1204_t3 WHERE business_key LIKE 't3-new-%'
    UNION ALL SELECT business_key FROM xfer2_x1204_t4 WHERE business_key LIKE 't4-new-%'
    UNION ALL SELECT business_key FROM xfer2_x1204_t5 WHERE business_key LIKE 't5-new-%'
    UNION ALL SELECT business_key FROM xfer2_x1204_t6 WHERE business_key LIKE 't6-new-%'
  ) AS new_keys;
large_owner_new_keys_rolled_back
1
SELECT (SELECT COUNT(*) FROM xfer2_x1204_t4 WHERE id=7)=1
AND (SELECT COUNT(*) FROM xfer2_x1204_t3 WHERE id=129)=0
AS large_delete_and_insert_rolled_back;
large_delete_and_insert_rolled_back
1
CHECK TABLE xfer2_x1204_t1,xfer2_x1204_t2,xfer2_x1204_t3,
xfer2_x1204_t4,xfer2_x1204_t5,xfer2_x1204_t6;
Table	Op	Msg_type	Msg_text
test.xfer2_x1204_t1	check	status	OK
test.xfer2_x1204_t2	check	status	OK
test.xfer2_x1204_t3	check	status	OK
test.xfer2_x1204_t4	check	status	OK
test.xfer2_x1204_t5	check	status	OK
test.xfer2_x1204_t6	check	status	OK
DROP TABLE xfer2_x1204_t1,xfer2_x1204_t2,xfer2_x1204_t3,
xfer2_x1204_t4,xfer2_x1204_t5,xfer2_x1204_t6;
SELECT COUNT(*)=3 AND SUM(v)=63
AS receiver_native_commit_survives_restart
FROM xfer2_x1204_receiver_native;
receiver_native_commit_survives_restart
1
CHECK TABLE xfer2_x1204_receiver_native;
Table	Op	Msg_type	Msg_text
test.xfer2_x1204_receiver_native	check	status	OK
DROP TABLE xfer2_x1204_receiver_native;
SELECT (SELECT COUNT(*) FROM xfer2_w01_accounts)=0
AND (SELECT COUNT(*) FROM xfer2_w01_audit)=0
AND (SELECT COUNT(*) FROM xfer2_x1204_t1)=0
AND (SELECT COUNT(*) FROM xfer2_x1204_t2)=0
AND (SELECT COUNT(*) FROM xfer2_x1204_t3)=0
AND (SELECT COUNT(*) FROM xfer2_x1204_t4)=0
AND (SELECT COUNT(*) FROM xfer2_x1204_t5)=0
AND (SELECT COUNT(*) FROM xfer2_x1204_t6)=0
AS receiver_shadow_schema_remains_data_empty;
receiver_shadow_schema_remains_data_empty
1
CHECK TABLE xfer2_w01_accounts,xfer2_w01_audit,
xfer2_x1204_t1,xfer2_x1204_t2,xfer2_x1204_t3,
xfer2_x1204_t4,xfer2_x1204_t5,xfer2_x1204_t6;
Table	Op	Msg_type	Msg_text
test.xfer2_w01_accounts	check	status	OK
test.xfer2_w01_audit	check	status	OK
test.xfer2_x1204_t1	check	status	OK
test.xfer2_x1204_t2	check	status	OK
test.xfer2_x1204_t3	check	status	OK
test.xfer2_x1204_t4	check	status	OK
test.xfer2_x1204_t5	check	status	OK
test.xfer2_x1204_t6	check	status	OK
DROP TABLE xfer2_w01_audit,xfer2_w01_accounts,
xfer2_x1204_t1,xfer2_x1204_t2,xfer2_x1204_t3,
xfer2_x1204_t4,xfer2_x1204_t5,xfer2_x1204_t6;
SELECT @x1204_post_test_dict_identity_matches=1
AS post_test_dictionary_counters_remain_aligned;
post_test_dictionary_counters_remain_aligned
1
