CALL mtr.add_suppression(
"PRESERVE: rolled back prepared transaction without snapshot during recovery");
CREATE TABLE xfer2_w01_accounts(
id INT PRIMARY KEY,
balance INT NOT NULL,
version INT NOT NULL DEFAULT 0,
pad VARCHAR(64) NOT NULL
) ENGINE=InnoDB;
CREATE TABLE xfer2_w01_audit(
id BIGINT AUTO_INCREMENT PRIMARY KEY,
account_id INT NOT NULL,
delta INT NOT NULL,
KEY(account_id)
) ENGINE=InnoDB;
INSERT INTO xfer2_w01_accounts
WITH RECURSIVE seq(n) AS (
SELECT 1 UNION ALL SELECT n+1 FROM seq WHERE n<32
)
SELECT n, 1000, 0, CONCAT('account-', n) FROM seq;
SET GLOBAL rds_preserve_trx_drain_phase1_timeout_ms=120000;
SET GLOBAL rds_preserve_trx_drain_phase2_timeout_ms=120000;
SET GLOBAL rds_preserve_trx_token_retention_timeout_ms=120000;
SELECT @@GLOBAL.rds_preserve_trx_transfer_max_inflight_bytes=64*1024*1024
AS source_low_inflight_budget,
@@GLOBAL.rds_preserve_trx_transfer_runtime_profile='BUSINESS_FIRST'
       AS source_business_first_profile;
source_low_inflight_budget	source_business_first_profile
1	1
DROP TABLE IF EXISTS xfer2_x1202_rows;
DROP TABLE IF EXISTS xfer2_x1202_source_native;
CREATE TABLE xfer2_x1202_rows(
id INT PRIMARY KEY,
group_id INT NOT NULL,
business_key VARCHAR(24) NOT NULL,
v BIGINT NOT NULL,
payload VARBINARY(256) NOT NULL,
UNIQUE KEY uk_business(business_key),
KEY k_group_v(group_id,v)
) ENGINE=InnoDB;
CREATE TABLE xfer2_x1202_source_native(
id INT PRIMARY KEY,
v INT NOT NULL
) ENGINE=InnoDB;
INSERT INTO xfer2_x1202_source_native VALUES(1,100),(2,200);
START TRANSACTION;
UPDATE xfer2_x1202_source_native SET v=v+id;
INSERT INTO xfer2_x1202_source_native VALUES(3,300);
COMMIT;
SELECT COUNT(*)=3 AND SUM(v)=603 AS source_native_commit_before_transfer
FROM xfer2_x1202_source_native;
source_native_commit_before_transfer
1
SELECT @@GLOBAL.rds_preserve_trx_transfer_max_inflight_bytes=64*1024*1024
AS receiver_low_inflight_budget,
@@GLOBAL.rds_preserve_trx_transfer_runtime_profile='BUSINESS_FIRST'
       AS receiver_business_first_profile;
receiver_low_inflight_budget	receiver_business_first_profile
1	1
DROP TABLE IF EXISTS xfer2_x1202_receiver_native;
CREATE TABLE xfer2_x1202_receiver_native(
id INT PRIMARY KEY,
v INT NOT NULL,
KEY(v)
) ENGINE=InnoDB;
INSERT INTO xfer2_x1202_receiver_native VALUES(1,10),(2,20);
UPDATE xfer2_w01_accounts
SET balance=balance+1,version=version+1 WHERE id=32;
SET @online_before=(SELECT VARIABLE_VALUE+0
FROM performance_schema.global_status WHERE VARIABLE_NAME=
'Preserve_trx_transfer_receiver_online_epochs');
SET @active_before=(SELECT VARIABLE_VALUE+0
FROM performance_schema.global_status WHERE VARIABLE_NAME=
'Preserve_trx_transfer_receiver_active_epochs');
SET @admitted_before=(SELECT VARIABLE_VALUE+0
FROM performance_schema.global_status WHERE VARIABLE_NAME=
'Preserve_trx_transfer_receiver_admitted_frames');
SET @admitted_bytes_before=(SELECT VARIABLE_VALUE+0
FROM performance_schema.global_status WHERE VARIABLE_NAME=
'Preserve_trx_transfer_receiver_admitted_bytes');
SET @inflight_tokens_before=(SELECT VARIABLE_VALUE+0
FROM performance_schema.global_status WHERE VARIABLE_NAME=
'Preserve_trx_transfer_receiver_inflight_tokens');
SET @inflight_bytes_before=(SELECT VARIABLE_VALUE+0
FROM performance_schema.global_status WHERE VARIABLE_NAME=
'Preserve_trx_transfer_receiver_inflight_bytes');
SET @staged_before=(SELECT VARIABLE_VALUE+0
FROM performance_schema.global_status WHERE VARIABLE_NAME=
'Preserve_trx_transfer_receiver_staged_memory_bytes');
SET @last_seal_before=(SELECT VARIABLE_VALUE+0
FROM performance_schema.global_status WHERE VARIABLE_NAME=
'Preserve_trx_transfer_receiver_last_object_seal_monotonic_us');
SET @terminal_before=(SELECT VARIABLE_VALUE+0
FROM performance_schema.global_status WHERE VARIABLE_NAME=
'Preserve_trx_transfer_receiver_terminal_cas_wins');
SET @tombstones_before=(SELECT VARIABLE_VALUE+0
FROM performance_schema.global_status WHERE VARIABLE_NAME=
'Preserve_trx_transfer_receiver_terminal_status_tombstones');
SET @classified_before=(SELECT VARIABLE_VALUE+0
FROM performance_schema.global_status WHERE VARIABLE_NAME=
'Preserve_trx_transfer_receiver_auto_prewarm_tokens');
SET @ready_before=(SELECT VARIABLE_VALUE+0
FROM performance_schema.global_status WHERE VARIABLE_NAME=
'Preserve_trx_transfer_receiver_auto_prewarm_ready_tokens');
SET @not_ready_before=(SELECT VARIABLE_VALUE+0
FROM performance_schema.global_status WHERE VARIABLE_NAME=
'Preserve_trx_transfer_receiver_auto_prewarm_not_ready_tokens');
SET @saved_before=(SELECT VARIABLE_VALUE+0
FROM performance_schema.global_status WHERE VARIABLE_NAME=
'Preserve_trx_transfer_receiver_saved_online_tokens');
SET @failed_before=(SELECT VARIABLE_VALUE+0
FROM performance_schema.global_status WHERE VARIABLE_NAME=
'Preserve_trx_transfer_receiver_failed_tokens');
SET @prepared_before=(SELECT VARIABLE_VALUE+0
FROM performance_schema.global_status WHERE VARIABLE_NAME=
'Preserve_trx_promotion_prepared_registered_tokens');
SET @prepared_pending_before=(SELECT VARIABLE_VALUE+0
FROM performance_schema.global_status WHERE VARIABLE_NAME=
'Preserve_trx_promotion_prepared_prewarm_pending_tokens');
SET @prepared_ready_before=(SELECT VARIABLE_VALUE+0
FROM performance_schema.global_status WHERE VARIABLE_NAME=
'Preserve_trx_promotion_prepared_ready_tokens');
SET @ready_cache_before=(SELECT VARIABLE_VALUE+0
FROM performance_schema.global_status WHERE VARIABLE_NAME=
'Preserve_trx_promotion_ready_cache_bytes');
SET @memory_before=(SELECT VARIABLE_VALUE+0
FROM performance_schema.global_status WHERE VARIABLE_NAME=
'Preserve_trx_memory_current_bytes');
SET @debt_tokens_before=(SELECT VARIABLE_VALUE+0
FROM performance_schema.global_status WHERE VARIABLE_NAME=
'Preserve_trx_transfer_receiver_cleanup_debt_tokens');
SET @debt_bytes_before=(SELECT VARIABLE_VALUE+0
FROM performance_schema.global_status WHERE VARIABLE_NAME=
'Preserve_trx_transfer_receiver_cleanup_debt_bytes');
SET @phase1_frames_before=(SELECT VARIABLE_VALUE+0
FROM performance_schema.global_status WHERE VARIABLE_NAME=
'Preserve_trx_transfer_phase1_frame_count');
SET @phase1_sends_before=(SELECT VARIABLE_VALUE+0
FROM performance_schema.global_status WHERE VARIABLE_NAME=
'Preserve_trx_transfer_phase1_network_send_count');
SET @handoff_before=(SELECT VARIABLE_VALUE+0
FROM performance_schema.global_status WHERE VARIABLE_NAME=
'Preserve_trx_transfer_source_handoff_pending_epochs');
SET @unknown_before=(SELECT VARIABLE_VALUE+0
FROM performance_schema.global_status WHERE VARIABLE_NAME=
'Preserve_trx_transfer_source_commit_unknown_epochs');
SET SESSION TRANSACTION ISOLATION LEVEL REPEATABLE READ;
SET SESSION cte_max_recursion_depth=11000;
START TRANSACTION;
INSERT INTO xfer2_x1202_rows(id,group_id,business_key,v,payload)
WITH RECURSIVE seq(n) AS (
SELECT 1 UNION ALL SELECT n+1 FROM seq WHERE n<10000
)
SELECT n,MOD(n,17),CONCAT('bk-',LPAD(n,5,'0')),n,
REPEAT(CHAR(65+MOD(n,26)),256)
FROM seq;
SELECT ROW_COUNT()=10000 AS inserted_ten_thousand_rows;
inserted_ten_thousand_rows
1
UPDATE xfer2_x1202_rows SET v=v+100000 WHERE MOD(id,10)=0;
SELECT ROW_COUNT()=1000 AS updated_one_thousand_rows;
updated_one_thousand_rows
1
DELETE FROM xfer2_x1202_rows WHERE MOD(id,13)=0;
SELECT ROW_COUNT()=769 AS deleted_exact_stride;
deleted_exact_stride
1
SELECT COUNT(*)=9231 AS owner_surviving_rows,
SUM(id)=46156155 AS owner_surviving_id_sum,
SUM(v)=138556155 AS owner_exact_value_sum,
SUM(OCTET_LENGTH(payload))=2363136 AS owner_payload_bytes
FROM xfer2_x1202_rows;
owner_surviving_rows	owner_surviving_id_sum	owner_exact_value_sum	owner_payload_bytes
1	1	1	1
SELECT COUNT(*)=543 AS secondary_index_exact_group
FROM xfer2_x1202_rows FORCE INDEX(k_group_v) WHERE group_id=7;
secondary_index_exact_group
1
SELECT COUNT(*)=1 AND MAX(v)=100010 AS unique_key_updated_row
FROM xfer2_x1202_rows FORCE INDEX(uk_business)
WHERE business_key='bk-00010';
unique_key_updated_row
1
SELECT COUNT(*)=0 AS deleted_unique_key_absent
FROM xfer2_x1202_rows FORCE INDEX(uk_business)
WHERE business_key='bk-00013';
deleted_unique_key_absent
1
SELECT COUNT(*)=0 AS outsider_sees_no_uncommitted_rows
FROM xfer2_x1202_rows;
outsider_sees_no_uncommitted_rows
1
SELECT COUNT(*)=3 AND SUM(v)=603 AS outsider_sees_source_native_commit
FROM xfer2_x1202_source_native;
outsider_sees_source_native_commit
1
SET DEBUG_SYNC=
'preserve_trx_transfer_before_commit_send_ownership_cas SIGNAL xfer2_x1202_payloads_acked WAIT_FOR xfer2_x1202_release';
DRAIN TRANSACTIONS PRESERVE;
SET DEBUG_SYNC='now WAIT_FOR xfer2_x1202_payloads_acked TIMEOUT 180';
SELECT (SELECT VARIABLE_VALUE+0 FROM performance_schema.global_status
WHERE VARIABLE_NAME='Preserve_trx_transfer_receiver_admitted_bytes')
-@admitted_bytes_before>2*1024*1024 AS multi_mib_payload_admitted,
(SELECT VARIABLE_VALUE+0 FROM performance_schema.global_status
WHERE VARIABLE_NAME='Preserve_trx_transfer_receiver_admitted_frames')
-@admitted_before>=6 AS multiple_sequence_frames_admitted;
multi_mib_payload_admitted	multiple_sequence_frames_admitted
1	1
SELECT (SELECT VARIABLE_VALUE+0 FROM performance_schema.global_status
WHERE VARIABLE_NAME='Preserve_trx_transfer_receiver_inflight_tokens')
=@inflight_tokens_before+1 AS one_large_token_inflight,
(SELECT VARIABLE_VALUE+0 FROM performance_schema.global_status
WHERE VARIABLE_NAME='Preserve_trx_transfer_receiver_inflight_bytes')
>@inflight_bytes_before AS nonzero_reserved_bytes,
(SELECT VARIABLE_VALUE+0 FROM performance_schema.global_status
WHERE VARIABLE_NAME='Preserve_trx_transfer_receiver_inflight_bytes')
<=64*1024*1024 AS reserved_bytes_within_budget,
(SELECT VARIABLE_VALUE+0 FROM performance_schema.global_status
WHERE VARIABLE_NAME='Preserve_trx_transfer_receiver_terminal_cas_wins')
=@terminal_before AS no_terminal_cas_at_payload_boundary;
one_large_token_inflight	nonzero_reserved_bytes	reserved_bytes_within_budget	no_terminal_cas_at_payload_boundary
1	1	1	1
SELECT (SELECT VARIABLE_VALUE+0 FROM performance_schema.global_status
WHERE VARIABLE_NAME='Preserve_trx_transfer_receiver_active_epochs')
=@active_before AS no_accepted_epoch_before_cas,
(SELECT VARIABLE_VALUE+0 FROM performance_schema.global_status
WHERE VARIABLE_NAME='Preserve_trx_transfer_receiver_auto_prewarm_tokens')
=@classified_before AS no_classification_before_cas;
no_accepted_epoch_before_cas	no_classification_before_cas
1	1
START TRANSACTION;
UPDATE xfer2_x1202_receiver_native SET v=v+id;
INSERT INTO xfer2_x1202_receiver_native VALUES(3,30);
COMMIT;
SELECT COUNT(*)=3 AND SUM(v)=63 AS receiver_native_commit_during_staging
FROM xfer2_x1202_receiver_native;
receiver_native_commit_during_staging
1
SELECT COUNT(*)=0 AS no_source_sql_table_published
FROM information_schema.tables
WHERE table_schema='test' AND table_name='xfer2_x1202_rows';
no_source_sql_table_published
1
SET DEBUG_SYNC='now SIGNAL xfer2_x1202_release';
generation	outcome	source_connection_id	token_role	reason	closing_started_us	closing_deadline_us
GENERATION	SUCCESS	SOURCE_ID	SURVIVOR	NONE	CLOSING_STARTED_US	CLOSING_DEADLINE_US
SET DEBUG_SYNC='RESET';
SELECT (SELECT VARIABLE_VALUE+0 FROM performance_schema.global_status
WHERE VARIABLE_NAME='Preserve_trx_transfer_phase1_frame_count')
>@phase1_frames_before AS phase1_frames_sent,
(SELECT VARIABLE_VALUE+0 FROM performance_schema.global_status
WHERE VARIABLE_NAME='Preserve_trx_transfer_phase1_network_send_count')
>@phase1_sends_before AS phase1_network_batches_sent;
phase1_frames_sent	phase1_network_batches_sent
1	1
SELECT (SELECT VARIABLE_VALUE+0 FROM performance_schema.global_status
WHERE VARIABLE_NAME='Preserve_trx_transfer_source_handoff_pending_epochs')
=@handoff_before AS no_handoff_pending,
(SELECT VARIABLE_VALUE+0 FROM performance_schema.global_status
WHERE VARIABLE_NAME='Preserve_trx_transfer_source_commit_unknown_epochs')
=@unknown_before AS no_commit_unknown;
no_handoff_pending	no_commit_unknown
1	1
SELECT (SELECT VARIABLE_VALUE+0 FROM performance_schema.global_status
WHERE VARIABLE_NAME='Preserve_trx_transfer_receiver_active_epochs')
=@active_before+1 AS one_accepted_epoch,
(SELECT VARIABLE_VALUE+0 FROM performance_schema.global_status
WHERE VARIABLE_NAME='Preserve_trx_transfer_receiver_auto_prewarm_tokens')
=@classified_before+1 AS one_classified_token,
(SELECT VARIABLE_VALUE+0 FROM performance_schema.global_status
WHERE VARIABLE_NAME='Preserve_trx_transfer_receiver_auto_prewarm_ready_tokens')
=@ready_before AS no_ready_token,
(SELECT VARIABLE_VALUE+0 FROM performance_schema.global_status
WHERE VARIABLE_NAME='Preserve_trx_transfer_receiver_auto_prewarm_not_ready_tokens')
=@not_ready_before+1 AS one_deadline_token;
one_accepted_epoch	one_classified_token	no_ready_token	one_deadline_token
1	1	1	1
SELECT (SELECT VARIABLE_VALUE+0 FROM performance_schema.global_status
WHERE VARIABLE_NAME='Preserve_trx_transfer_receiver_saved_online_tokens')
=@saved_before AS no_saved_online_token,
(SELECT VARIABLE_VALUE+0 FROM performance_schema.global_status
WHERE VARIABLE_NAME='Preserve_trx_transfer_receiver_failed_tokens')
=@failed_before+2 AS one_not_ready_and_one_closing_record,
(SELECT VARIABLE_VALUE+0 FROM performance_schema.global_status
WHERE VARIABLE_NAME='Preserve_trx_transfer_receiver_inflight_tokens')
=@inflight_tokens_before AS inflight_token_released,
(SELECT VARIABLE_VALUE+0 FROM performance_schema.global_status
WHERE VARIABLE_NAME='Preserve_trx_transfer_receiver_inflight_bytes')
=@inflight_bytes_before AS inflight_bytes_released,
(SELECT VARIABLE_VALUE+0 FROM performance_schema.global_status
WHERE VARIABLE_NAME='Preserve_trx_transfer_receiver_staged_memory_bytes')
=@staged_before AS staged_memory_released;
no_saved_online_token	one_not_ready_and_one_closing_record	inflight_token_released	inflight_bytes_released	staged_memory_released
1	1	1	1	1
SELECT (SELECT VARIABLE_VALUE+0 FROM performance_schema.global_status
WHERE VARIABLE_NAME='Preserve_trx_promotion_prepared_registered_tokens')
=@prepared_before AS no_prepared_token,
(SELECT VARIABLE_VALUE+0 FROM performance_schema.global_status
WHERE VARIABLE_NAME='Preserve_trx_promotion_prepared_prewarm_pending_tokens')
=@prepared_pending_before AS no_prepared_pending_token,
(SELECT VARIABLE_VALUE+0 FROM performance_schema.global_status
WHERE VARIABLE_NAME='Preserve_trx_promotion_prepared_ready_tokens')
=@prepared_ready_before AS no_prepared_ready_token,
(SELECT VARIABLE_VALUE+0 FROM performance_schema.global_status
WHERE VARIABLE_NAME='Preserve_trx_promotion_ready_cache_bytes')
=@ready_cache_before AS no_ready_cache_residue,
(SELECT VARIABLE_VALUE+0 FROM performance_schema.global_status
WHERE VARIABLE_NAME='Preserve_trx_memory_current_bytes')
=@memory_before AS no_preserve_memory_residue,
(SELECT VARIABLE_VALUE+0 FROM performance_schema.global_status
WHERE VARIABLE_NAME='Preserve_trx_transfer_receiver_cleanup_debt_tokens')
=@debt_tokens_before AS no_cleanup_debt_token,
(SELECT VARIABLE_VALUE+0 FROM performance_schema.global_status
WHERE VARIABLE_NAME='Preserve_trx_transfer_receiver_cleanup_debt_bytes')
=@debt_bytes_before AS no_cleanup_debt_bytes;
no_prepared_token	no_prepared_pending_token	no_prepared_ready_token	no_ready_cache_residue	no_preserve_memory_residue	no_cleanup_debt_token	no_cleanup_debt_bytes
1	1	1	1	1	1	1
SELECT VARIABLE_VALUE='receiver_selection_failed:3'
       AS prewarm_deadline_is_exact_reason
FROM performance_schema.global_status
WHERE VARIABLE_NAME='Preserve_trx_transfer_receiver_last_failed_reason';
prewarm_deadline_is_exact_reason
1
SELECT COUNT(*)=3 AND SUM(v)=63 AS receiver_native_commit_still_exact
FROM xfer2_x1202_receiver_native;
receiver_native_commit_still_exact
1
SELECT COUNT(*) FROM xfer2_x1202_rows;
ERROR HY000: Preserve drain is active; this command was not executed
SET GLOBAL rds_preserve_trx_drain_phase1_timeout_ms=600000;
SET GLOBAL rds_preserve_trx_drain_phase2_timeout_ms=30000;
SET GLOBAL rds_preserve_trx_token_retention_timeout_ms=30000;
source_ha_control_session
1
SELECT COUNT(*)=32 AS thirty_two_accounts,
SUM(balance)=32001 AS committed_background_balance,
SUM(version)=1 AS one_committed_background_version,
MAX(CASE WHEN id=32 THEN balance END)=1001 AS background_update_visible,
MAX(CASE WHEN id=3 THEN version END)=0 AS owner_updates_hidden
FROM xfer2_w01_accounts;
thirty_two_accounts	committed_background_balance	one_committed_background_version	background_update_visible	owner_updates_hidden
1	1	1	1	1
SELECT COUNT(*)=0 AS no_committed_audit FROM xfer2_w01_audit;
no_committed_audit
1
DROP TABLE xfer2_w01_audit;
DROP TABLE xfer2_w01_accounts;
DROP USER xfer2_w01_app@localhost;
DROP USER preserve_trx_ha_admin@localhost;
DROP USER preserve_trx_ha_admin@localhost;
SELECT (SELECT VARIABLE_VALUE+0 FROM performance_schema.global_status
WHERE VARIABLE_NAME='Preserve_trx_transfer_receiver_active_epochs')=0
AS no_receiver_epoch_after_restart,
(SELECT VARIABLE_VALUE+0 FROM performance_schema.global_status
WHERE VARIABLE_NAME='Preserve_trx_transfer_receiver_inflight_tokens')=0
AS no_inflight_token_after_restart,
(SELECT VARIABLE_VALUE+0 FROM performance_schema.global_status
WHERE VARIABLE_NAME='Preserve_trx_transfer_receiver_inflight_bytes')=0
AS no_inflight_byte_after_restart,
(SELECT VARIABLE_VALUE+0 FROM performance_schema.global_status
WHERE VARIABLE_NAME=
'Preserve_trx_transfer_receiver_staged_memory_bytes')=0
AS no_staged_memory_after_restart,
(SELECT VARIABLE_VALUE+0 FROM performance_schema.global_status
WHERE VARIABLE_NAME='Preserve_trx_promotion_prepared_registered_tokens')=0
AS no_prepared_entry_after_restart,
(SELECT VARIABLE_VALUE+0 FROM performance_schema.global_status
WHERE VARIABLE_NAME=
'Preserve_trx_promotion_prepared_prewarm_pending_tokens')=0
AS no_prewarm_pending_after_restart,
(SELECT VARIABLE_VALUE+0 FROM performance_schema.global_status
WHERE VARIABLE_NAME='Preserve_trx_promotion_prepared_ready_tokens')=0
AS no_prepared_ready_after_restart,
(SELECT VARIABLE_VALUE+0 FROM performance_schema.global_status
WHERE VARIABLE_NAME='Preserve_trx_promotion_ready_cache_bytes')=0
AS no_ready_cache_after_restart,
(SELECT VARIABLE_VALUE+0 FROM performance_schema.global_status
WHERE VARIABLE_NAME='Preserve_trx_memory_current_bytes')=0
AS no_preserve_memory_after_restart,
(SELECT VARIABLE_VALUE+0 FROM performance_schema.global_status
WHERE VARIABLE_NAME='Preserve_trx_transfer_receiver_worker_active')=0
AS no_active_worker_after_restart,
(SELECT VARIABLE_VALUE+0 FROM performance_schema.global_status
WHERE VARIABLE_NAME='Preserve_trx_transfer_receiver_queued_bytes')=0
AS no_queued_byte_after_restart;
no_receiver_epoch_after_restart	no_inflight_token_after_restart	no_inflight_byte_after_restart	no_staged_memory_after_restart	no_prepared_entry_after_restart	no_prewarm_pending_after_restart	no_prepared_ready_after_restart	no_ready_cache_after_restart	no_preserve_memory_after_restart	no_active_worker_after_restart	no_queued_byte_after_restart
1	1	1	1	1	1	1	1	1	1	1
SELECT COUNT(*)=0 AS large_owner_rows_rolled_back
FROM xfer2_x1202_rows;
large_owner_rows_rolled_back
1
SELECT COUNT(*)=3 AND SUM(v)=603 AS source_native_commit_survives_restart
FROM xfer2_x1202_source_native;
source_native_commit_survives_restart
1
CHECK TABLE xfer2_x1202_rows,xfer2_x1202_source_native;
Table	Op	Msg_type	Msg_text
test.xfer2_x1202_rows	check	status	OK
test.xfer2_x1202_source_native	check	status	OK
SELECT COUNT(*)=3 AND SUM(v)=63 AS receiver_native_commit_survives_restart
FROM xfer2_x1202_receiver_native;
receiver_native_commit_survives_restart
1
CHECK TABLE xfer2_x1202_receiver_native;
Table	Op	Msg_type	Msg_text
test.xfer2_x1202_receiver_native	check	status	OK
DROP TABLE xfer2_x1202_receiver_native;
DROP TABLE xfer2_x1202_rows;
DROP TABLE xfer2_x1202_source_native;
