CALL mtr.add_suppression(
"PRESERVE: rolled back prepared transaction without snapshot during recovery");
CREATE TABLE xfer2_w01_accounts(
id INT PRIMARY KEY,
balance INT NOT NULL,
version INT NOT NULL DEFAULT 0,
pad VARCHAR(64) NOT NULL
) ENGINE=InnoDB;
CREATE TABLE xfer2_w01_audit(
id BIGINT AUTO_INCREMENT PRIMARY KEY,
account_id INT NOT NULL,
delta INT NOT NULL,
KEY(account_id)
) ENGINE=InnoDB;
INSERT INTO xfer2_w01_accounts
WITH RECURSIVE seq(n) AS (
SELECT 1 UNION ALL SELECT n+1 FROM seq WHERE n<32
)
SELECT n, 1000, 0, CONCAT('account-', n) FROM seq;
CALL mtr.add_suppression(
"PRESERVE: standby transfer source entered COMMIT_UNKNOWN");
CALL mtr.add_suppression(
"PRESERVE: standby transfer client send failed errno=.*");
CALL mtr.add_suppression(".*Got an error reading communication packets.*");
SELECT balance=1000 AND version=0 AS owner_rr_initial
FROM xfer2_w01_accounts WHERE id=32;
owner_rr_initial
1
SELECT balance=1000 AND version=0 AS owner_rr_stays_old
FROM xfer2_w01_accounts WHERE id=32;
owner_rr_stays_old
1
SELECT COUNT(*)=32 AS observer_row_count,
SUM(balance)=32001 AS observer_sees_outsider_commit,
SUM(version)=1 AS observer_sees_one_committed_version
FROM xfer2_w01_accounts;
observer_row_count	observer_sees_outsider_commit	observer_sees_one_committed_version
1	1	1
SELECT COUNT(*)=2 AND SUM(balance)=2000 AND SUM(version)=2
AS owner_w04_balance_conserved
FROM xfer2_w01_accounts WHERE id IN (3,7);
owner_w04_balance_conserved
1
SELECT MAX(CASE WHEN id=3 THEN balance END)=960
AND MAX(CASE WHEN id=7 THEN balance END)=1040
AS owner_w04_exact_effects
FROM xfer2_w01_accounts WHERE id IN (3,7);
owner_w04_exact_effects
1
SELECT COUNT(*)=2 AND SUM(delta)=0
AND SUM(account_id=3 AND delta=-40)=1
AND SUM(account_id=7 AND delta=40)=1
AS owner_w04_balanced_ledger
FROM xfer2_w01_audit;
owner_w04_balanced_ledger
1
SELECT COUNT(*)=32 AS observer_snapshot_row_count,
SUM(balance)=32001 AS observer_snapshot_stable,
SUM(version)=1 AS observer_hides_owner_versions,
SUM(id IN (3,7) AND version<>0)=0 AS owner_rows_not_dirty
FROM xfer2_w01_accounts;
observer_snapshot_row_count	observer_snapshot_stable	observer_hides_owner_versions	owner_rows_not_dirty
1	1	1	1
SELECT COUNT(*)=0 AS owner_ledger_not_dirty FROM xfer2_w01_audit;
owner_ledger_not_dirty
1
SELECT COUNT(*)=1 AS waiter_blocked_before_terminal_case FROM performance_schema.data_lock_waits w JOIN performance_schema.threads t ON t.THREAD_ID=w.REQUESTING_THREAD_ID WHERE t.PROCESSLIST_ID=WAITER_ID;
waiter_blocked_before_terminal_case
1
SELECT v=100 AS receiver_native_initial
FROM xfer2_terminal_receiver_native WHERE id=1;
receiver_native_initial
1
SELECT (SELECT VARIABLE_VALUE+0 FROM performance_schema.global_status
WHERE VARIABLE_NAME=
'Preserve_trx_transfer_receiver_terminal_cas_wins')
=@terminal_wins_before+1 AS precrash_terminal_cas_once,
(SELECT VARIABLE_VALUE+0 FROM performance_schema.global_status
WHERE VARIABLE_NAME=
'Preserve_trx_transfer_receiver_terminal_status_tombstones')
=@terminal_tombstones_before+1 AS precrash_committed_status_live,
(SELECT VARIABLE_VALUE+0 FROM performance_schema.global_status
WHERE VARIABLE_NAME=
'Preserve_trx_transfer_receiver_auto_prewarm_ready_tokens')
=@terminal_ready_before+1 AS precrash_ready_once,
(SELECT VARIABLE_VALUE+0 FROM performance_schema.global_status
WHERE VARIABLE_NAME=
'Preserve_trx_promotion_prepared_ready_tokens')
=@terminal_prepared_ready_before+1 AS precrash_prepared_ready_once;
precrash_terminal_cas_once	precrash_committed_status_live	precrash_ready_once	precrash_prepared_ready_once
1	1	1	1
START TRANSACTION;
UPDATE xfer2_terminal_receiver_native SET v=v+id WHERE id=1;
INSERT INTO xfer2_terminal_receiver_native VALUES(2,20);
COMMIT;
SELECT COUNT(*)=2 AND SUM(v)=121 AS receiver_native_commit_before_crash
FROM xfer2_terminal_receiver_native;
receiver_native_commit_before_crash
1
# Kill the server
# restart
SELECT (SELECT VARIABLE_VALUE+0 FROM performance_schema.global_status
WHERE VARIABLE_NAME='Preserve_trx_transfer_receiver_active_epochs')=0
AS no_receiver_epoch_after_restart,
(SELECT VARIABLE_VALUE+0 FROM performance_schema.global_status
WHERE VARIABLE_NAME='Preserve_trx_transfer_receiver_inflight_tokens')=0
AS no_inflight_token_after_restart,
(SELECT VARIABLE_VALUE+0 FROM performance_schema.global_status
WHERE VARIABLE_NAME='Preserve_trx_transfer_receiver_inflight_bytes')=0
AS no_inflight_byte_after_restart,
(SELECT VARIABLE_VALUE+0 FROM performance_schema.global_status
WHERE VARIABLE_NAME=
'Preserve_trx_transfer_receiver_staged_memory_bytes')=0
AS no_staged_memory_after_restart,
(SELECT VARIABLE_VALUE+0 FROM performance_schema.global_status
WHERE VARIABLE_NAME='Preserve_trx_promotion_prepared_registered_tokens')=0
AS no_prepared_entry_after_restart,
(SELECT VARIABLE_VALUE+0 FROM performance_schema.global_status
WHERE VARIABLE_NAME=
'Preserve_trx_promotion_prepared_prewarm_pending_tokens')=0
AS no_prewarm_pending_after_restart,
(SELECT VARIABLE_VALUE+0 FROM performance_schema.global_status
WHERE VARIABLE_NAME='Preserve_trx_promotion_prepared_ready_tokens')=0
AS no_prepared_ready_after_restart,
(SELECT VARIABLE_VALUE+0 FROM performance_schema.global_status
WHERE VARIABLE_NAME='Preserve_trx_promotion_ready_cache_bytes')=0
AS no_ready_cache_after_restart,
(SELECT VARIABLE_VALUE+0 FROM performance_schema.global_status
WHERE VARIABLE_NAME='Preserve_trx_memory_current_bytes')=0
AS no_preserve_memory_after_restart,
(SELECT VARIABLE_VALUE+0 FROM performance_schema.global_status
WHERE VARIABLE_NAME='Preserve_trx_transfer_receiver_worker_active')=0
AS no_active_worker_after_restart,
(SELECT VARIABLE_VALUE+0 FROM performance_schema.global_status
WHERE VARIABLE_NAME='Preserve_trx_transfer_receiver_queued_bytes')=0
AS no_queued_byte_after_restart;
no_receiver_epoch_after_restart	no_inflight_token_after_restart	no_inflight_byte_after_restart	no_staged_memory_after_restart	no_prepared_entry_after_restart	no_prewarm_pending_after_restart	no_prepared_ready_after_restart	no_ready_cache_after_restart	no_preserve_memory_after_restart	no_active_worker_after_restart	no_queued_byte_after_restart
1	1	1	1	1	1	1	1	1	1	1
old_generation_projected	new_generation_projected	receiver_generation_changed
1	1	1
SELECT (SELECT VARIABLE_VALUE+0 FROM performance_schema.global_status
WHERE VARIABLE_NAME='Preserve_trx_transfer_receiver_active_epochs')=0
AS no_old_terminal_epoch_after_restart,
(SELECT VARIABLE_VALUE+0 FROM performance_schema.global_status
WHERE VARIABLE_NAME=
'Preserve_trx_transfer_receiver_terminal_status_tombstones')=0
AS no_old_committed_status_after_restart,
(SELECT VARIABLE_VALUE+0 FROM performance_schema.global_status
WHERE VARIABLE_NAME=
'Preserve_trx_transfer_receiver_auto_prewarm_ready_tokens')=0
AS no_old_ready_after_restart,
(SELECT VARIABLE_VALUE+0 FROM performance_schema.global_status
WHERE VARIABLE_NAME=
'Preserve_trx_promotion_prepared_ready_tokens')=0
AS no_old_prepared_ready_after_restart;
no_old_terminal_epoch_after_restart	no_old_committed_status_after_restart	no_old_ready_after_restart	no_old_prepared_ready_after_restart
1	1	1	1
SELECT COUNT(*)=2 AND SUM(v)=121 AS receiver_native_commit_survives_crash
FROM xfer2_terminal_receiver_native;
receiver_native_commit_survives_crash
1
ERROR HY000: Resumable transactions across shutdown do not support this operation
SELECT COUNT(*)=1 AS waiter_still_blocked_after_terminal_case FROM performance_schema.data_lock_waits w JOIN performance_schema.threads t ON t.THREAD_ID=w.REQUESTING_THREAD_ID WHERE t.PROCESSLIST_ID=WAITER_ID;
waiter_still_blocked_after_terminal_case
1
SELECT (SELECT VARIABLE_VALUE+0 FROM performance_schema.global_status
WHERE VARIABLE_NAME=
'Preserve_trx_transfer_source_handoff_pending_epochs')
=@terminal_handoff_before AS no_handoff_pending_after_status_case,
(SELECT VARIABLE_VALUE+0 FROM performance_schema.global_status
WHERE VARIABLE_NAME=
'Preserve_trx_transfer_source_commit_unknown_epochs')
=@terminal_unknown_before+1 AS one_fenced_commit_unknown;
no_handoff_pending_after_status_case	one_fenced_commit_unknown
1	1
RESET DRAIN;
ERROR HY000: RESET DRAIN arrived after ownership became irreversible
SELECT (SELECT VARIABLE_VALUE+0 FROM performance_schema.global_status
WHERE VARIABLE_NAME='Preserve_trx_reset_drain_wins')
=@terminal_reset_wins_before AS restart_reset_did_not_win,
(SELECT VARIABLE_VALUE+0 FROM performance_schema.global_status
WHERE VARIABLE_NAME='Preserve_trx_reset_drain_too_late')
=@terminal_reset_too_late_before+1 AS restart_reset_too_late_once;
restart_reset_did_not_win	restart_reset_too_late_once
1	1
SELECT 1;
ERROR HY000: Preserve drain is active; this command was not executed
SELECT COUNT(*)=0 AS no_source_sql_table_published
FROM information_schema.tables
WHERE table_schema='test'
   AND table_name IN ('xfer2_w01_accounts','xfer2_w01_audit');
no_source_sql_table_published
1
START TRANSACTION;
UPDATE xfer2_terminal_receiver_native SET v=v+7 WHERE id=1;
SELECT v=108 AS receiver_native_transaction_visible_after_restart
FROM xfer2_terminal_receiver_native WHERE id=1;
receiver_native_transaction_visible_after_restart
1
ROLLBACK;
SELECT COUNT(*)=2 AND SUM(v)=121
AS receiver_native_rollback_exact_after_restart
FROM xfer2_terminal_receiver_native;
receiver_native_rollback_exact_after_restart
1
source_ha_control_session
1
SELECT COUNT(*)=32 AS thirty_two_accounts,
SUM(balance)=32001 AS committed_background_balance,
SUM(version)=1 AS one_committed_background_version,
MAX(CASE WHEN id=32 THEN balance END)=1001 AS background_update_visible,
MAX(CASE WHEN id=3 THEN version END)=0 AS owner_updates_hidden
FROM xfer2_w01_accounts;
thirty_two_accounts	committed_background_balance	one_committed_background_version	background_update_visible	owner_updates_hidden
1	1	1	1	1
SELECT COUNT(*)=0 AS no_committed_audit FROM xfer2_w01_audit;
no_committed_audit
1
DROP TABLE xfer2_w01_audit;
DROP TABLE xfer2_w01_accounts;
DROP USER xfer2_w01_app@localhost;
DROP USER preserve_trx_ha_admin@localhost;
DROP USER preserve_trx_ha_admin@localhost;
SELECT (SELECT VARIABLE_VALUE+0 FROM performance_schema.global_status
WHERE VARIABLE_NAME='Preserve_trx_transfer_receiver_active_epochs')=0
AS no_receiver_epoch_after_restart,
(SELECT VARIABLE_VALUE+0 FROM performance_schema.global_status
WHERE VARIABLE_NAME='Preserve_trx_transfer_receiver_inflight_tokens')=0
AS no_inflight_token_after_restart,
(SELECT VARIABLE_VALUE+0 FROM performance_schema.global_status
WHERE VARIABLE_NAME='Preserve_trx_transfer_receiver_inflight_bytes')=0
AS no_inflight_byte_after_restart,
(SELECT VARIABLE_VALUE+0 FROM performance_schema.global_status
WHERE VARIABLE_NAME=
'Preserve_trx_transfer_receiver_staged_memory_bytes')=0
AS no_staged_memory_after_restart,
(SELECT VARIABLE_VALUE+0 FROM performance_schema.global_status
WHERE VARIABLE_NAME='Preserve_trx_promotion_prepared_registered_tokens')=0
AS no_prepared_entry_after_restart,
(SELECT VARIABLE_VALUE+0 FROM performance_schema.global_status
WHERE VARIABLE_NAME=
'Preserve_trx_promotion_prepared_prewarm_pending_tokens')=0
AS no_prewarm_pending_after_restart,
(SELECT VARIABLE_VALUE+0 FROM performance_schema.global_status
WHERE VARIABLE_NAME='Preserve_trx_promotion_prepared_ready_tokens')=0
AS no_prepared_ready_after_restart,
(SELECT VARIABLE_VALUE+0 FROM performance_schema.global_status
WHERE VARIABLE_NAME='Preserve_trx_promotion_ready_cache_bytes')=0
AS no_ready_cache_after_restart,
(SELECT VARIABLE_VALUE+0 FROM performance_schema.global_status
WHERE VARIABLE_NAME='Preserve_trx_memory_current_bytes')=0
AS no_preserve_memory_after_restart,
(SELECT VARIABLE_VALUE+0 FROM performance_schema.global_status
WHERE VARIABLE_NAME='Preserve_trx_transfer_receiver_worker_active')=0
AS no_active_worker_after_restart,
(SELECT VARIABLE_VALUE+0 FROM performance_schema.global_status
WHERE VARIABLE_NAME='Preserve_trx_transfer_receiver_queued_bytes')=0
AS no_queued_byte_after_restart;
no_receiver_epoch_after_restart	no_inflight_token_after_restart	no_inflight_byte_after_restart	no_staged_memory_after_restart	no_prepared_entry_after_restart	no_prewarm_pending_after_restart	no_prepared_ready_after_restart	no_ready_cache_after_restart	no_preserve_memory_after_restart	no_active_worker_after_restart	no_queued_byte_after_restart
1	1	1	1	1	1	1	1	1	1	1
DROP TABLE xfer2_terminal_receiver_native;
Got one of the listed errors
