CALL mtr.add_suppression(
"PRESERVE: rolled back prepared transaction without snapshot during recovery");
CREATE TABLE xfer2_w01_accounts(
id INT PRIMARY KEY,
balance INT NOT NULL,
version INT NOT NULL DEFAULT 0,
pad VARCHAR(64) NOT NULL
) ENGINE=InnoDB;
CREATE TABLE xfer2_w01_audit(
id BIGINT AUTO_INCREMENT PRIMARY KEY,
account_id INT NOT NULL,
delta INT NOT NULL,
KEY(account_id)
) ENGINE=InnoDB;
INSERT INTO xfer2_w01_accounts
WITH RECURSIVE seq(n) AS (
SELECT 1 UNION ALL SELECT n+1 FROM seq WHERE n<32
)
SELECT n, 1000, 0, CONCAT('account-', n) FROM seq;
CALL mtr.add_suppression(
"PRESERVE: standby transfer client connect failed errno=2003");
CALL mtr.add_suppression(
"PRESERVE: standby transfer OPEN_EPOCH failed status=3");
DROP TABLE IF EXISTS xfer2_restart_receiver_native;
CREATE TABLE xfer2_restart_receiver_native(
id INT PRIMARY KEY,
v INT NOT NULL
) ENGINE=InnoDB;
INSERT INTO xfer2_restart_receiver_native VALUES(1,40),(2,60);
SET @active_before=(SELECT VARIABLE_VALUE+0
FROM performance_schema.global_status WHERE VARIABLE_NAME=
'Preserve_trx_transfer_receiver_active_epochs');
SET @admitted_before=(SELECT VARIABLE_VALUE+0
FROM performance_schema.global_status WHERE VARIABLE_NAME=
'Preserve_trx_transfer_receiver_admitted_frames');
SET @admitted_bytes_before=(SELECT VARIABLE_VALUE+0
FROM performance_schema.global_status WHERE VARIABLE_NAME=
'Preserve_trx_transfer_receiver_admitted_bytes');
SET @terminal_before=(SELECT VARIABLE_VALUE+0
FROM performance_schema.global_status WHERE VARIABLE_NAME=
'Preserve_trx_transfer_receiver_terminal_cas_wins');
SET @tombstones_before=(SELECT VARIABLE_VALUE+0
FROM performance_schema.global_status WHERE VARIABLE_NAME=
'Preserve_trx_transfer_receiver_terminal_status_tombstones');
SET @classified_before=(SELECT VARIABLE_VALUE+0
FROM performance_schema.global_status WHERE VARIABLE_NAME=
'Preserve_trx_transfer_receiver_auto_prewarm_tokens');
SET @ready_before=(SELECT VARIABLE_VALUE+0
FROM performance_schema.global_status WHERE VARIABLE_NAME=
'Preserve_trx_transfer_receiver_auto_prewarm_ready_tokens');
SET @not_ready_before=(SELECT VARIABLE_VALUE+0
FROM performance_schema.global_status WHERE VARIABLE_NAME=
'Preserve_trx_transfer_receiver_auto_prewarm_not_ready_tokens');
SET @failed_before=(SELECT VARIABLE_VALUE+0
FROM performance_schema.global_status WHERE VARIABLE_NAME=
'Preserve_trx_transfer_receiver_failed_tokens');
SET @inflight_tokens_before=(SELECT VARIABLE_VALUE+0
FROM performance_schema.global_status WHERE VARIABLE_NAME=
'Preserve_trx_transfer_receiver_inflight_tokens');
SET @inflight_bytes_before=(SELECT VARIABLE_VALUE+0
FROM performance_schema.global_status WHERE VARIABLE_NAME=
'Preserve_trx_transfer_receiver_inflight_bytes');
SET @staged_before=(SELECT VARIABLE_VALUE+0
FROM performance_schema.global_status WHERE VARIABLE_NAME=
'Preserve_trx_transfer_receiver_staged_memory_bytes');
SET @prepared_before=(SELECT VARIABLE_VALUE+0
FROM performance_schema.global_status WHERE VARIABLE_NAME=
'Preserve_trx_promotion_prepared_registered_tokens');
SET @pending_before=(SELECT VARIABLE_VALUE+0
FROM performance_schema.global_status WHERE VARIABLE_NAME=
'Preserve_trx_promotion_prepared_prewarm_pending_tokens');
SET @prepared_ready_before=(SELECT VARIABLE_VALUE+0
FROM performance_schema.global_status WHERE VARIABLE_NAME=
'Preserve_trx_promotion_prepared_ready_tokens');
SET @ready_cache_before=(SELECT VARIABLE_VALUE+0
FROM performance_schema.global_status WHERE VARIABLE_NAME=
'Preserve_trx_promotion_ready_cache_bytes');
SET @debt_tokens_before=(SELECT VARIABLE_VALUE+0
FROM performance_schema.global_status WHERE VARIABLE_NAME=
'Preserve_trx_transfer_receiver_cleanup_debt_tokens');
SET @debt_bytes_before=(SELECT VARIABLE_VALUE+0
FROM performance_schema.global_status WHERE VARIABLE_NAME=
'Preserve_trx_transfer_receiver_cleanup_debt_bytes');
SET @memory_before=(SELECT VARIABLE_VALUE+0
FROM performance_schema.global_status WHERE VARIABLE_NAME=
'Preserve_trx_memory_current_bytes');
SET SESSION TRANSACTION ISOLATION LEVEL REPEATABLE READ;
START TRANSACTION;
SELECT balance=1000 AND version=0 AS first_owner_rr_initial
FROM xfer2_w01_accounts WHERE id=32;
first_owner_rr_initial
1
SELECT balance=1000 AND version=0 AS first_owner_rr_repeatable
FROM xfer2_w01_accounts WHERE id=32;
first_owner_rr_repeatable
1
SELECT COUNT(*)=32 AS thirty_two_accounts,
SUM(balance)=32001 AS committed_background_balance,
SUM(version)=1 AS one_committed_background_version,
MAX(CASE WHEN id=32 THEN balance END)=1001 AS background_update_visible,
MAX(CASE WHEN id=3 THEN version END)=0 AS owner_updates_hidden
FROM xfer2_w01_accounts;
thirty_two_accounts	committed_background_balance	one_committed_background_version	background_update_visible	owner_updates_hidden
1	1	1	1	1
SELECT COUNT(*)=0 AS no_committed_audit FROM xfer2_w01_audit;
no_committed_audit
1
generation	outcome	source_connection_id	token_role	reason	closing_started_us	closing_deadline_us
GENERATION	SUCCESS	SOURCE_ID	SURVIVOR	NONE	CLOSING_STARTED_US	CLOSING_DEADLINE_US
SELECT (SELECT VARIABLE_VALUE+0 FROM performance_schema.global_status
WHERE VARIABLE_NAME='Preserve_trx_transfer_receiver_active_epochs')
=@active_before+1 AS first_epoch_committed_once,
(SELECT VARIABLE_VALUE+0 FROM performance_schema.global_status
WHERE VARIABLE_NAME='Preserve_trx_transfer_receiver_admitted_frames')
>@admitted_before AS first_epoch_admitted_real_frames,
(SELECT VARIABLE_VALUE+0 FROM performance_schema.global_status
WHERE VARIABLE_NAME='Preserve_trx_transfer_receiver_admitted_bytes')
>@admitted_bytes_before AS first_epoch_admitted_real_bytes;
first_epoch_committed_once	first_epoch_admitted_real_frames	first_epoch_admitted_real_bytes
1	1	1
SELECT (SELECT VARIABLE_VALUE+0 FROM performance_schema.global_status
WHERE VARIABLE_NAME='Preserve_trx_transfer_receiver_terminal_cas_wins')
=@terminal_before+1 AS first_terminal_cas_won_once,
(SELECT VARIABLE_VALUE+0 FROM performance_schema.global_status
WHERE VARIABLE_NAME=
'Preserve_trx_transfer_receiver_terminal_status_tombstones')
=@tombstones_before+1 AS first_terminal_tombstone_once;
first_terminal_cas_won_once	first_terminal_tombstone_once
1	1
SELECT (SELECT VARIABLE_VALUE+0 FROM performance_schema.global_status
WHERE VARIABLE_NAME='Preserve_trx_transfer_receiver_auto_prewarm_tokens')
=@classified_before+1 AS first_token_classified_once,
(SELECT VARIABLE_VALUE+0 FROM performance_schema.global_status
WHERE VARIABLE_NAME=
'Preserve_trx_transfer_receiver_auto_prewarm_ready_tokens')
=@ready_before+1 AS first_token_ready,
(SELECT VARIABLE_VALUE+0 FROM performance_schema.global_status
WHERE VARIABLE_NAME=
'Preserve_trx_transfer_receiver_auto_prewarm_not_ready_tokens')
=@not_ready_before AS no_not_ready_token;
first_token_classified_once	first_token_ready	no_not_ready_token
1	1	1
no_active_receiver_worker
1
no_receiver_queue
1
SELECT (SELECT VARIABLE_VALUE+0 FROM performance_schema.global_status WHERE VARIABLE_NAME='Preserve_trx_transfer_receiver_inflight_tokens')=@inflight_tokens_before AS ready_reconciles_inflight_token,
(SELECT VARIABLE_VALUE+0 FROM performance_schema.global_status WHERE VARIABLE_NAME='Preserve_trx_transfer_receiver_inflight_bytes')=@inflight_bytes_before AS ready_reconciles_inflight_bytes,
(SELECT VARIABLE_VALUE+0 FROM performance_schema.global_status WHERE VARIABLE_NAME='Preserve_trx_transfer_receiver_staged_memory_bytes')=@staged_before AS ready_reconciles_staged_memory;
ready_reconciles_inflight_token	ready_reconciles_inflight_bytes	ready_reconciles_staged_memory
1	1	1
SELECT (SELECT VARIABLE_VALUE+0 FROM performance_schema.global_status WHERE VARIABLE_NAME='Preserve_trx_promotion_prepared_registered_tokens')=@prepared_before+1 AS ready_retains_prepared_entry,
(SELECT VARIABLE_VALUE+0 FROM performance_schema.global_status WHERE VARIABLE_NAME='Preserve_trx_promotion_prepared_prewarm_pending_tokens')=@pending_before AS no_pending_after_ready,
(SELECT VARIABLE_VALUE+0 FROM performance_schema.global_status WHERE VARIABLE_NAME='Preserve_trx_promotion_prepared_ready_tokens')=@prepared_ready_before+1 AS ready_retains_prepared_ready,
(SELECT VARIABLE_VALUE+0 FROM performance_schema.global_status WHERE VARIABLE_NAME='Preserve_trx_promotion_ready_cache_bytes')>@ready_cache_before AS ready_retains_cache;
ready_retains_prepared_entry	no_pending_after_ready	ready_retains_prepared_ready	ready_retains_cache
1	1	1	1
SELECT (SELECT VARIABLE_VALUE+0 FROM performance_schema.global_status WHERE VARIABLE_NAME='Preserve_trx_transfer_receiver_cleanup_debt_tokens')=@debt_tokens_before AS no_cleanup_debt_token,
(SELECT VARIABLE_VALUE+0 FROM performance_schema.global_status WHERE VARIABLE_NAME='Preserve_trx_transfer_receiver_cleanup_debt_bytes')=@debt_bytes_before AS no_cleanup_debt_byte,
(SELECT VARIABLE_VALUE+0 FROM performance_schema.global_status WHERE VARIABLE_NAME='Preserve_trx_memory_current_bytes')>@memory_before AS ready_retains_memory,
(SELECT VARIABLE_VALUE+0 FROM performance_schema.global_status WHERE VARIABLE_NAME='Preserve_trx_transfer_receiver_failed_tokens')=@failed_before AS no_failed_token;
no_cleanup_debt_token	no_cleanup_debt_byte	ready_retains_memory	no_failed_token
1	1	1	1
ERROR HY000: Preserve drain is active; this command was not executed
RESET DRAIN;
SELECT (SELECT VARIABLE_VALUE+0 FROM performance_schema.global_status WHERE VARIABLE_NAME='Preserve_trx_reset_drain_wins')=0 AS source_manager_has_no_active_drain,(SELECT VARIABLE_VALUE+0 FROM performance_schema.global_status WHERE VARIABLE_NAME='Preserve_trx_reset_drain_too_late')=0 AS reset_probe_not_too_late_at_baseline;
source_manager_has_no_active_drain	reset_probe_not_too_late_at_baseline
1	1
SELECT (SELECT VARIABLE_VALUE+0 FROM performance_schema.global_status
WHERE VARIABLE_NAME=
'Preserve_trx_transfer_source_handoff_pending_epochs')=0
AS no_handoff_pending_after_source_restart,
(SELECT VARIABLE_VALUE+0 FROM performance_schema.global_status
WHERE VARIABLE_NAME=
'Preserve_trx_transfer_source_commit_unknown_epochs')=0
AS no_commit_unknown_after_source_restart,
(SELECT VARIABLE_VALUE+0 FROM performance_schema.global_status
WHERE VARIABLE_NAME='Preserve_trx_transfer_quarantine_epochs')=0
AS no_quarantine_epoch_after_source_restart,
(SELECT VARIABLE_VALUE+0 FROM performance_schema.global_status
WHERE VARIABLE_NAME='Preserve_trx_transfer_quarantine_tokens')=0
AS no_quarantine_token_after_source_restart;
no_handoff_pending_after_source_restart	no_commit_unknown_after_source_restart	no_quarantine_epoch_after_source_restart	no_quarantine_token_after_source_restart
1	1	1	1
SELECT COUNT(*)=32 AS thirty_two_accounts,
SUM(balance)=32001 AS committed_background_balance,
SUM(version)=1 AS one_committed_background_version,
MAX(CASE WHEN id=32 THEN balance END)=1001 AS background_update_visible,
MAX(CASE WHEN id=3 THEN version END)=0 AS owner_updates_hidden
FROM xfer2_w01_accounts;
thirty_two_accounts	committed_background_balance	one_committed_background_version	background_update_visible	owner_updates_hidden
1	1	1	1	1
SELECT COUNT(*)=0 AS no_committed_audit FROM xfer2_w01_audit;
no_committed_audit
1
SELECT SUM(id IN (4,8,12) AND version<>0)=0
AS first_owner_rows_rolled_back_by_source_restart
FROM xfer2_w01_accounts;
first_owner_rows_rolled_back_by_source_restart
1
SELECT COUNT(*)=0 AS first_owner_audit_rolled_back_by_source_restart
FROM xfer2_w01_audit WHERE account_id=4;
first_owner_audit_rolled_back_by_source_restart
1
no_active_receiver_worker
1
no_receiver_queue
1
SELECT (SELECT VARIABLE_VALUE+0 FROM performance_schema.global_status
WHERE VARIABLE_NAME='Preserve_trx_transfer_receiver_active_epochs')
=@active_before+1 AS receiver_retains_old_epoch,
(SELECT VARIABLE_VALUE+0 FROM performance_schema.global_status
WHERE VARIABLE_NAME='Preserve_trx_transfer_receiver_terminal_cas_wins')
=@terminal_before+1 AS receiver_retains_old_terminal,
(SELECT VARIABLE_VALUE+0 FROM performance_schema.global_status
WHERE VARIABLE_NAME=
'Preserve_trx_transfer_receiver_terminal_status_tombstones')
=@tombstones_before+1 AS receiver_retains_old_tombstone;
receiver_retains_old_epoch	receiver_retains_old_terminal	receiver_retains_old_tombstone
1	1	1
SELECT (SELECT VARIABLE_VALUE+0 FROM performance_schema.global_status
WHERE VARIABLE_NAME='Preserve_trx_transfer_receiver_admitted_frames')
=@admitted_after_first AS source_restart_admitted_no_new_frame,
(SELECT VARIABLE_VALUE+0 FROM performance_schema.global_status
WHERE VARIABLE_NAME='Preserve_trx_transfer_receiver_admitted_bytes')
=@admitted_bytes_after_first AS source_restart_admitted_no_new_byte,
(SELECT VARIABLE_VALUE+0 FROM performance_schema.global_status
WHERE VARIABLE_NAME='Preserve_trx_transfer_receiver_failed_tokens')
=@failed_before AS receiver_keeps_no_failed_token;
source_restart_admitted_no_new_frame	source_restart_admitted_no_new_byte	receiver_keeps_no_failed_token
1	1	1
SELECT (SELECT VARIABLE_VALUE+0 FROM performance_schema.global_status
WHERE VARIABLE_NAME='Preserve_trx_transfer_receiver_auto_prewarm_tokens')
=@classified_after_first AS source_restart_did_not_reclassify,
(SELECT VARIABLE_VALUE+0 FROM performance_schema.global_status
WHERE VARIABLE_NAME=
'Preserve_trx_transfer_receiver_auto_prewarm_ready_tokens')
=@ready_after_first AS receiver_retains_old_ready_token,
(SELECT VARIABLE_VALUE+0 FROM performance_schema.global_status
WHERE VARIABLE_NAME='Preserve_trx_promotion_prepared_registered_tokens')
=@prepared_after_first AS receiver_retains_old_prepared_entry,
(SELECT VARIABLE_VALUE+0 FROM performance_schema.global_status
WHERE VARIABLE_NAME='Preserve_trx_promotion_prepared_ready_tokens')
=@prepared_ready_after_first AS receiver_retains_old_prepared_ready;
source_restart_did_not_reclassify	receiver_retains_old_ready_token	receiver_retains_old_prepared_entry	receiver_retains_old_prepared_ready
1	1	1	1
SELECT (SELECT VARIABLE_VALUE+0 FROM performance_schema.global_status
WHERE VARIABLE_NAME='Preserve_trx_promotion_ready_cache_bytes')
=@ready_cache_after_first AS receiver_retains_old_ready_cache;
receiver_retains_old_ready_cache
1
SELECT COUNT(*)=2 AND SUM(v)=100
AS receiver_native_data_survives_source_restart
FROM xfer2_restart_receiver_native;
receiver_native_data_survives_source_restart
1
SELECT balance=1000 AND version=0 AS owner_rr_initial FROM xfer2_w01_accounts WHERE id=31;
owner_rr_initial
1
SELECT balance=1000 AND version=0 AS owner_rr_repeatable_after_outsider_commit FROM xfer2_w01_accounts WHERE id=31;
owner_rr_repeatable_after_outsider_commit
1
SELECT SUM(balance)=3000 AND SUM(version)=3
AS owner_sees_three_nonadjacent_updates
FROM xfer2_w01_accounts WHERE id IN (3,7,11);
owner_sees_three_nonadjacent_updates
1
SELECT COUNT(*)=1 AND SUM(delta)=0 AS owner_sees_one_audit
FROM xfer2_w01_audit WHERE account_id=3;
owner_sees_one_audit
1
SELECT COUNT(*)=32 AS outsider_row_count,SUM(balance)=32003 AS outsider_sees_committed_only,SUM(version)=2 AS outsider_committed_versions,SUM(id IN (3,7,11) AND version<>0)=0 AS owner_rows_not_dirty FROM xfer2_w01_accounts;
outsider_row_count	outsider_sees_committed_only	outsider_committed_versions	owner_rows_not_dirty
1	1	1	1
SELECT COUNT(*)=0 AS owner_audit_not_dirty FROM xfer2_w01_audit;
owner_audit_not_dirty
1
SELECT COUNT(*)=1 AS waiter_blocked_before_receiver_generation_fault FROM performance_schema.data_lock_waits w JOIN performance_schema.threads t ON t.THREAD_ID=w.REQUESTING_THREAD_ID WHERE t.PROCESSLIST_ID=WAITER_ID;
waiter_blocked_before_receiver_generation_fault
1
SET @failed_drain_started=NOW(6);
DRAIN TRANSACTIONS PRESERVE;
ERROR HY000: Resumable transactions across shutdown do not support this operation
SELECT TIMESTAMPDIFF(MICROSECOND,@failed_drain_started,NOW(6)) BETWEEN 0 AND 15000000
AS stopped_receiver_failure_bounded;
stopped_receiver_failure_bounded
1
SELECT COUNT(*)=1 AS waiter_still_blocked_after_stopped_receiver_failure FROM performance_schema.data_lock_waits w JOIN performance_schema.threads t ON t.THREAD_ID=w.REQUESTING_THREAD_ID WHERE t.PROCESSLIST_ID=WAITER_ID;
waiter_still_blocked_after_stopped_receiver_failure
1
SELECT (SELECT VARIABLE_VALUE+0 FROM performance_schema.global_status WHERE VARIABLE_NAME='Preserve_trx_transfer_phase1_frame_count')=0 AS no_phase1_frame_succeeded_against_stopped_receiver,(SELECT VARIABLE_VALUE+0 FROM performance_schema.global_status WHERE VARIABLE_NAME='Preserve_trx_transfer_phase1_network_send_count')=0 AS no_phase1_send_succeeded_against_stopped_receiver;
no_phase1_frame_succeeded_against_stopped_receiver	no_phase1_send_succeeded_against_stopped_receiver
1	1
SELECT (SELECT VARIABLE_VALUE+0 FROM performance_schema.global_status WHERE VARIABLE_NAME='Preserve_trx_transfer_source_handoff_pending_epochs')=0 AS no_new_handoff_pending,(SELECT VARIABLE_VALUE+0 FROM performance_schema.global_status WHERE VARIABLE_NAME='Preserve_trx_transfer_source_commit_unknown_epochs')=0 AS no_new_commit_unknown;
no_new_handoff_pending	no_new_commit_unknown
1	1
SELECT (SELECT VARIABLE_VALUE+0 FROM performance_schema.global_status WHERE VARIABLE_NAME='Preserve_trx_transfer_quarantine_epochs')=0 AS no_new_quarantine_epoch,(SELECT VARIABLE_VALUE+0 FROM performance_schema.global_status WHERE VARIABLE_NAME='Preserve_trx_transfer_quarantine_tokens')=0 AS no_new_quarantine_token;
no_new_quarantine_epoch	no_new_quarantine_token
1	1
SELECT COUNT(*)=0 AS failed_drain_added_no_preserved_token FROM performance_schema.preserved_transactions;
failed_drain_added_no_preserved_token
1
SELECT CONNECTION_ID() AS same_owner_connection_after_stopped_receiver_failure;
same_owner_connection_after_stopped_receiver_failure
OWNER_ID
SELECT balance=1000 AND version=0 AS owner_rr_survives_stopped_receiver_failure
FROM xfer2_w01_accounts WHERE id=31;
owner_rr_survives_stopped_receiver_failure
1
SELECT SUM(balance)=3000 AND SUM(version)=3
AS owner_writes_survive_stopped_receiver_failure
FROM xfer2_w01_accounts WHERE id IN (3,7,11);
owner_writes_survive_stopped_receiver_failure
1
SELECT COUNT(*)=1 AND SUM(delta)=0 AS owner_audit_survives_failure
FROM xfer2_w01_audit WHERE account_id=3;
owner_audit_survives_failure
1
UPDATE xfer2_w01_accounts
SET pad=CONCAT(pad,'-after-outage') WHERE id=11;
SELECT ROW_COUNT()=1 AS owner_can_continue_dml_after_failure;
owner_can_continue_dml_after_failure
1
SELECT SUM(id IN (3,7,11) AND version<>0)=0
AS failed_owner_changes_remain_isolated
FROM xfer2_w01_accounts;
failed_owner_changes_remain_isolated
1
SELECT COUNT(*)=0 AS failed_owner_audit_remains_isolated
FROM xfer2_w01_audit;
failed_owner_audit_remains_isolated
1
SELECT COUNT(*)=32 AS final_row_count,
SUM(balance)=32009 AS final_balance_exactly_once,
SUM(version)=6 AS final_versions_exactly_once,
SUM(id IN (3,7,11,31,32) AND version>0)=5 AS exact_committed_rows,
MAX(CASE WHEN id=3 THEN balance END)=989 AS waiter_ran_once,
MAX(CASE WHEN id=11 THEN pad END)='account-11-after-outage'
         AS continued_owner_dml_committed,
SUM(id IN (4,8,12) AND version<>0)=0
AS first_success_owner_writes_remain_rolled_back
FROM xfer2_w01_accounts;
final_row_count	final_balance_exactly_once	final_versions_exactly_once	exact_committed_rows	waiter_ran_once	continued_owner_dml_committed	first_success_owner_writes_remain_rolled_back
1	1	1	1	1	1	1
SELECT COUNT(*)=1 AND SUM(account_id=3)=1
AS only_failed_drain_owner_audit_committed
FROM xfer2_w01_audit;
only_failed_drain_owner_audit_committed
1
CHECK TABLE xfer2_w01_accounts,xfer2_w01_audit;
Table	Op	Msg_type	Msg_text
test.xfer2_w01_accounts	check	status	OK
test.xfer2_w01_audit	check	status	OK
SELECT COUNT(*)=32 AS thirty_two_accounts,
SUM(balance)=32001 AS committed_background_balance,
SUM(version)=1 AS one_committed_background_version,
MAX(CASE WHEN id=32 THEN balance END)=1001 AS background_update_visible,
MAX(CASE WHEN id=3 THEN version END)=0 AS owner_updates_hidden
FROM xfer2_w01_accounts;
thirty_two_accounts	committed_background_balance	one_committed_background_version	background_update_visible	owner_updates_hidden
1	1	1	1	1
SELECT COUNT(*)=0 AS no_committed_audit FROM xfer2_w01_audit;
no_committed_audit
1
SELECT (SELECT VARIABLE_VALUE+0 FROM performance_schema.global_status
WHERE VARIABLE_NAME='Preserve_trx_transfer_receiver_active_epochs')=0
AS no_receiver_epoch_after_restart,
(SELECT VARIABLE_VALUE+0 FROM performance_schema.global_status
WHERE VARIABLE_NAME='Preserve_trx_transfer_receiver_inflight_tokens')=0
AS no_inflight_token_after_restart,
(SELECT VARIABLE_VALUE+0 FROM performance_schema.global_status
WHERE VARIABLE_NAME='Preserve_trx_transfer_receiver_inflight_bytes')=0
AS no_inflight_byte_after_restart,
(SELECT VARIABLE_VALUE+0 FROM performance_schema.global_status
WHERE VARIABLE_NAME=
'Preserve_trx_transfer_receiver_staged_memory_bytes')=0
AS no_staged_memory_after_restart,
(SELECT VARIABLE_VALUE+0 FROM performance_schema.global_status
WHERE VARIABLE_NAME='Preserve_trx_promotion_prepared_registered_tokens')=0
AS no_prepared_entry_after_restart,
(SELECT VARIABLE_VALUE+0 FROM performance_schema.global_status
WHERE VARIABLE_NAME=
'Preserve_trx_promotion_prepared_prewarm_pending_tokens')=0
AS no_prewarm_pending_after_restart,
(SELECT VARIABLE_VALUE+0 FROM performance_schema.global_status
WHERE VARIABLE_NAME='Preserve_trx_promotion_prepared_ready_tokens')=0
AS no_prepared_ready_after_restart,
(SELECT VARIABLE_VALUE+0 FROM performance_schema.global_status
WHERE VARIABLE_NAME='Preserve_trx_promotion_ready_cache_bytes')=0
AS no_ready_cache_after_restart,
(SELECT VARIABLE_VALUE+0 FROM performance_schema.global_status
WHERE VARIABLE_NAME='Preserve_trx_memory_current_bytes')=0
AS no_preserve_memory_after_restart,
(SELECT VARIABLE_VALUE+0 FROM performance_schema.global_status
WHERE VARIABLE_NAME='Preserve_trx_transfer_receiver_worker_active')=0
AS no_active_worker_after_restart,
(SELECT VARIABLE_VALUE+0 FROM performance_schema.global_status
WHERE VARIABLE_NAME='Preserve_trx_transfer_receiver_queued_bytes')=0
AS no_queued_byte_after_restart;
no_receiver_epoch_after_restart	no_inflight_token_after_restart	no_inflight_byte_after_restart	no_staged_memory_after_restart	no_prepared_entry_after_restart	no_prewarm_pending_after_restart	no_prepared_ready_after_restart	no_ready_cache_after_restart	no_preserve_memory_after_restart	no_active_worker_after_restart	no_queued_byte_after_restart
1	1	1	1	1	1	1	1	1	1	1
SELECT (SELECT VARIABLE_VALUE+0 FROM performance_schema.global_status
WHERE VARIABLE_NAME='Preserve_trx_transfer_receiver_admitted_frames')=0
AS no_admitted_frame,
(SELECT VARIABLE_VALUE+0 FROM performance_schema.global_status
WHERE VARIABLE_NAME='Preserve_trx_transfer_receiver_admitted_bytes')=0
AS no_admitted_byte,
(SELECT VARIABLE_VALUE+0 FROM performance_schema.global_status
WHERE VARIABLE_NAME='Preserve_trx_transfer_receiver_failed_tokens')=0
AS no_failed_token,
(SELECT VARIABLE_VALUE+0 FROM performance_schema.global_status
WHERE VARIABLE_NAME='Preserve_trx_transfer_receiver_terminal_cas_wins')=0
AS no_terminal_fact,
(SELECT VARIABLE_VALUE+0 FROM performance_schema.global_status
WHERE VARIABLE_NAME=
'Preserve_trx_transfer_receiver_terminal_status_tombstones')=0
AS no_terminal_tombstone,
(SELECT VARIABLE_VALUE+0 FROM performance_schema.global_status
WHERE VARIABLE_NAME=
'Preserve_trx_transfer_receiver_cleanup_debt_tokens')=0
AS no_cleanup_debt,
(SELECT VARIABLE_VALUE+0 FROM performance_schema.global_status
WHERE VARIABLE_NAME='Preserve_trx_transfer_receiver_cleanup_debt_bytes')=0
AS no_cleanup_debt_byte;
no_admitted_frame	no_admitted_byte	no_failed_token	no_terminal_fact	no_terminal_tombstone	no_cleanup_debt	no_cleanup_debt_byte
1	1	1	1	1	1	1
same_receiver_datadir_identity_after_restart
1
SELECT COUNT(*)=2 AND SUM(v)=100 AS receiver_native_data_survives_restart
FROM xfer2_restart_receiver_native;
receiver_native_data_survives_restart
1
START TRANSACTION;
UPDATE xfer2_restart_receiver_native SET v=v+id;
INSERT INTO xfer2_restart_receiver_native VALUES(3,30);
COMMIT;
SELECT COUNT(*)=3 AND SUM(v)=133 AS receiver_native_dml_works_in_new_generation
FROM xfer2_restart_receiver_native;
receiver_native_dml_works_in_new_generation
1
source_ha_control_session
1
SELECT COUNT(*)=32 AS thirty_two_accounts,
SUM(balance)=32001 AS committed_background_balance,
SUM(version)=1 AS one_committed_background_version,
MAX(CASE WHEN id=32 THEN balance END)=1001 AS background_update_visible,
MAX(CASE WHEN id=3 THEN version END)=0 AS owner_updates_hidden
FROM xfer2_w01_accounts;
thirty_two_accounts	committed_background_balance	one_committed_background_version	background_update_visible	owner_updates_hidden
1	1	1	1	1
SELECT COUNT(*)=0 AS no_committed_audit FROM xfer2_w01_audit;
no_committed_audit
1
DROP TABLE xfer2_w01_audit;
DROP TABLE xfer2_w01_accounts;
DROP USER xfer2_w01_app@localhost;
DROP USER preserve_trx_ha_admin@localhost;
DROP USER preserve_trx_ha_admin@localhost;
SELECT (SELECT VARIABLE_VALUE+0 FROM performance_schema.global_status
WHERE VARIABLE_NAME='Preserve_trx_transfer_receiver_active_epochs')=0
AS no_receiver_epoch_after_restart,
(SELECT VARIABLE_VALUE+0 FROM performance_schema.global_status
WHERE VARIABLE_NAME='Preserve_trx_transfer_receiver_inflight_tokens')=0
AS no_inflight_token_after_restart,
(SELECT VARIABLE_VALUE+0 FROM performance_schema.global_status
WHERE VARIABLE_NAME='Preserve_trx_transfer_receiver_inflight_bytes')=0
AS no_inflight_byte_after_restart,
(SELECT VARIABLE_VALUE+0 FROM performance_schema.global_status
WHERE VARIABLE_NAME=
'Preserve_trx_transfer_receiver_staged_memory_bytes')=0
AS no_staged_memory_after_restart,
(SELECT VARIABLE_VALUE+0 FROM performance_schema.global_status
WHERE VARIABLE_NAME='Preserve_trx_promotion_prepared_registered_tokens')=0
AS no_prepared_entry_after_restart,
(SELECT VARIABLE_VALUE+0 FROM performance_schema.global_status
WHERE VARIABLE_NAME=
'Preserve_trx_promotion_prepared_prewarm_pending_tokens')=0
AS no_prewarm_pending_after_restart,
(SELECT VARIABLE_VALUE+0 FROM performance_schema.global_status
WHERE VARIABLE_NAME='Preserve_trx_promotion_prepared_ready_tokens')=0
AS no_prepared_ready_after_restart,
(SELECT VARIABLE_VALUE+0 FROM performance_schema.global_status
WHERE VARIABLE_NAME='Preserve_trx_promotion_ready_cache_bytes')=0
AS no_ready_cache_after_restart,
(SELECT VARIABLE_VALUE+0 FROM performance_schema.global_status
WHERE VARIABLE_NAME='Preserve_trx_memory_current_bytes')=0
AS no_preserve_memory_after_restart,
(SELECT VARIABLE_VALUE+0 FROM performance_schema.global_status
WHERE VARIABLE_NAME='Preserve_trx_transfer_receiver_worker_active')=0
AS no_active_worker_after_restart,
(SELECT VARIABLE_VALUE+0 FROM performance_schema.global_status
WHERE VARIABLE_NAME='Preserve_trx_transfer_receiver_queued_bytes')=0
AS no_queued_byte_after_restart;
no_receiver_epoch_after_restart	no_inflight_token_after_restart	no_inflight_byte_after_restart	no_staged_memory_after_restart	no_prepared_entry_after_restart	no_prewarm_pending_after_restart	no_prepared_ready_after_restart	no_ready_cache_after_restart	no_preserve_memory_after_restart	no_active_worker_after_restart	no_queued_byte_after_restart
1	1	1	1	1	1	1	1	1	1	1
