CALL mtr.add_suppression(
"PRESERVE: rolled back prepared transaction without snapshot during recovery");
SET GLOBAL rds_preserve_trx_enable=ON;
SET GLOBAL rds_preserve_trx_transfer_prewarm_paused=OFF;
SET GLOBAL rds_preserve_trx_token_retention_timeout_ms=120000;
CREATE TABLE xfer1_read_view_accounts(
id INT PRIMARY KEY,
balance INT NOT NULL,
version INT NOT NULL DEFAULT 0,
pad VARCHAR(64) NOT NULL
) ENGINE=InnoDB;
CREATE TABLE xfer1_read_view_audit(
id BIGINT AUTO_INCREMENT PRIMARY KEY,
account_id INT NOT NULL,
delta INT NOT NULL,
KEY(account_id)
) ENGINE=InnoDB;
INSERT INTO xfer1_read_view_accounts
WITH RECURSIVE seq(n) AS (
SELECT 1 UNION ALL SELECT n+1 FROM seq WHERE n<32
)
SELECT n, 1000, 0, CONCAT('account-', n) FROM seq;
SET @horizon_rejects_before=(
SELECT VARIABLE_VALUE+0 FROM performance_schema.global_status
WHERE VARIABLE_NAME=
'Preserve_trx_transfer_receiver_read_view_horizon_rejects');
SET @classified_before=(
SELECT VARIABLE_VALUE+0 FROM performance_schema.global_status
WHERE VARIABLE_NAME=
'Preserve_trx_transfer_receiver_auto_prewarm_tokens');
SET @ready_before=(
SELECT VARIABLE_VALUE+0 FROM performance_schema.global_status
WHERE VARIABLE_NAME=
'Preserve_trx_transfer_receiver_auto_prewarm_ready_tokens');
SET @not_ready_before=(
SELECT VARIABLE_VALUE+0 FROM performance_schema.global_status
WHERE VARIABLE_NAME=
'Preserve_trx_transfer_receiver_auto_prewarm_not_ready_tokens');
SET @bind_attempts_before=(
SELECT VARIABLE_VALUE+0 FROM performance_schema.global_status
WHERE VARIABLE_NAME=
'Preserve_trx_transfer_receiver_epoch_ready_bind_attempts');
SET @registered_before=(
SELECT VARIABLE_VALUE+0 FROM performance_schema.global_status
WHERE VARIABLE_NAME=
'Preserve_trx_promotion_prepared_registered_tokens');
SET @pending_before=(
SELECT VARIABLE_VALUE+0 FROM performance_schema.global_status
WHERE VARIABLE_NAME=
'Preserve_trx_promotion_prepared_prewarm_pending_tokens');
SET @prepared_ready_before=(
SELECT VARIABLE_VALUE+0 FROM performance_schema.global_status
WHERE VARIABLE_NAME='Preserve_trx_promotion_prepared_ready_tokens');
SET @ready_cache_bytes_before=(
SELECT VARIABLE_VALUE+0 FROM performance_schema.global_status
WHERE VARIABLE_NAME='Preserve_trx_promotion_ready_cache_bytes');
SET @active_epochs_before=(
SELECT VARIABLE_VALUE+0 FROM performance_schema.global_status
WHERE VARIABLE_NAME='Preserve_trx_transfer_receiver_active_epochs');
SET @memory_bytes_before=(
SELECT VARIABLE_VALUE+0 FROM performance_schema.global_status
WHERE VARIABLE_NAME='Preserve_trx_memory_current_bytes');
SET @inflight_tokens_before=(
SELECT VARIABLE_VALUE+0 FROM performance_schema.global_status
WHERE VARIABLE_NAME='Preserve_trx_transfer_receiver_inflight_tokens');
SET @inflight_bytes_before=(
SELECT VARIABLE_VALUE+0 FROM performance_schema.global_status
WHERE VARIABLE_NAME='Preserve_trx_transfer_receiver_inflight_bytes');
SET @failed_tokens_before=(
SELECT VARIABLE_VALUE+0 FROM performance_schema.global_status
WHERE VARIABLE_NAME='Preserve_trx_transfer_receiver_failed_tokens');
SET SESSION TRANSACTION ISOLATION LEVEL REPEATABLE READ;
START TRANSACTION;
SELECT balance=1000 AND version=0 AS rr_initial_version
FROM xfer1_read_view_accounts WHERE id=32;
rr_initial_version
1
UPDATE xfer1_read_view_accounts
SET balance=balance+1, version=version+1 WHERE id=32;
SELECT balance=1000 AND version=0 AS rr_keeps_initial_version
FROM xfer1_read_view_accounts WHERE id=32;
rr_keeps_initial_version
1
UPDATE xfer1_read_view_accounts
SET balance=balance-9, version=version+1 WHERE id=7;
SELECT ROW_COUNT()=1 AS debit_applied;
debit_applied
1
UPDATE xfer1_read_view_accounts
SET balance=balance+4, version=version+1 WHERE id=7;
SELECT ROW_COUNT()=1 AS partial_credit_applied;
partial_credit_applied
1
UPDATE xfer1_read_view_accounts
SET balance=balance+5, version=version+1 WHERE id=7;
SELECT ROW_COUNT()=1 AS balancing_credit_applied;
balancing_credit_applied
1
INSERT INTO xfer1_read_view_audit(account_id, delta) VALUES(7, 0);
SELECT balance=1000 AND version=3 AS owner_sees_all_writes
FROM xfer1_read_view_accounts WHERE id=7;
owner_sees_all_writes
1
SELECT COUNT(*)=32 AS thirty_two_accounts,
SUM(balance)=32001 AS only_outsider_change_committed,
MAX(CASE WHEN id=7 THEN version END)=0 AS owner_writes_hidden,
MAX(CASE WHEN id=32 THEN version END)=1 AS outsider_write_visible
FROM xfer1_read_view_accounts;
thirty_two_accounts	only_outsider_change_committed	owner_writes_hidden	outsider_write_visible
1	1	1	1
SELECT COUNT(*)=0 AS owner_audit_hidden FROM xfer1_read_view_audit;
owner_audit_hidden
1
DRAIN TRANSACTIONS PRESERVE;
generation	outcome	source_connection_id	token_role	reason	closing_started_us	closing_deadline_us
GENERATION	SUCCESS	SOURCE_ID	SURVIVOR	NONE	CLOSING_STARTED_US	CLOSING_DEADLINE_US
SELECT (SELECT VARIABLE_VALUE+0 FROM performance_schema.global_status
WHERE VARIABLE_NAME=
'Preserve_trx_transfer_receiver_auto_prewarm_tokens')
= @classified_before+1 AS one_classified_token,
(SELECT VARIABLE_VALUE+0 FROM performance_schema.global_status
WHERE VARIABLE_NAME=
'Preserve_trx_transfer_receiver_auto_prewarm_not_ready_tokens')
= @not_ready_before+1 AS one_not_ready_token,
(SELECT VARIABLE_VALUE+0 FROM performance_schema.global_status
WHERE VARIABLE_NAME='Preserve_trx_transfer_receiver_worker_active')
= 0 AS no_active_worker,
(SELECT VARIABLE_VALUE+0 FROM performance_schema.global_status
WHERE VARIABLE_NAME='Preserve_trx_transfer_receiver_queued_bytes')
= 0 AS no_queued_bytes;
one_classified_token	one_not_ready_token	no_active_worker	no_queued_bytes
1	1	1	1
SELECT (SELECT VARIABLE_VALUE+0 FROM performance_schema.global_status
WHERE VARIABLE_NAME=
'Preserve_trx_transfer_receiver_read_view_horizon_rejects')
= @horizon_rejects_before+1 AS one_horizon_rejection,
(SELECT VARIABLE_VALUE+0 FROM performance_schema.global_status
WHERE VARIABLE_NAME=
'Preserve_trx_transfer_receiver_auto_prewarm_ready_tokens')
= @ready_before AS no_ready_token,
(SELECT VARIABLE_VALUE+0 FROM performance_schema.global_status
WHERE VARIABLE_NAME=
'Preserve_trx_transfer_receiver_epoch_ready_bind_attempts')
= @bind_attempts_before AS no_epoch_ready_bind,
(SELECT VARIABLE_VALUE+0 FROM performance_schema.global_status
WHERE VARIABLE_NAME='Preserve_trx_transfer_receiver_active_epochs')
= @active_epochs_before+1 AS one_classified_epoch;
one_horizon_rejection	no_ready_token	no_epoch_ready_bind	one_classified_epoch
1	1	1	1
SELECT (SELECT VARIABLE_VALUE+0 FROM performance_schema.global_status
WHERE VARIABLE_NAME=
'Preserve_trx_promotion_prepared_registered_tokens')
= @registered_before AS prepared_entry_retired,
(SELECT VARIABLE_VALUE+0 FROM performance_schema.global_status
WHERE VARIABLE_NAME=
'Preserve_trx_promotion_prepared_prewarm_pending_tokens')
= @pending_before AS no_prewarm_pending_token,
(SELECT VARIABLE_VALUE+0 FROM performance_schema.global_status
WHERE VARIABLE_NAME='Preserve_trx_promotion_prepared_ready_tokens')
= @prepared_ready_before AS no_prepared_ready_token,
(SELECT VARIABLE_VALUE+0 FROM performance_schema.global_status
WHERE VARIABLE_NAME='Preserve_trx_promotion_ready_cache_bytes')
= @ready_cache_bytes_before AS ready_cache_retired;
prepared_entry_retired	no_prewarm_pending_token	no_prepared_ready_token	ready_cache_retired
1	1	1	1
SELECT (SELECT VARIABLE_VALUE+0 FROM performance_schema.global_status
WHERE VARIABLE_NAME='Preserve_trx_memory_current_bytes')
= @memory_bytes_before AS preserve_memory_retired,
(SELECT VARIABLE_VALUE+0 FROM performance_schema.global_status
WHERE VARIABLE_NAME='Preserve_trx_transfer_receiver_inflight_tokens')
= @inflight_tokens_before AS no_inflight_token,
(SELECT VARIABLE_VALUE+0 FROM performance_schema.global_status
WHERE VARIABLE_NAME='Preserve_trx_transfer_receiver_inflight_bytes')
= @inflight_bytes_before AS no_inflight_bytes,
(SELECT VARIABLE_VALUE+0 FROM performance_schema.global_status
WHERE VARIABLE_NAME='Preserve_trx_transfer_receiver_failed_tokens')
= @failed_tokens_before+1 AS one_failed_receiver_record;
preserve_memory_retired	no_inflight_token	no_inflight_bytes	one_failed_receiver_record
1	1	1	1
SELECT 1;
ERROR HY000: Preserve drain is active; this command was not executed
SHUTDOWN;
SELECT (SELECT VARIABLE_VALUE+0 FROM performance_schema.global_status
WHERE VARIABLE_NAME='Preserve_trx_transfer_receiver_active_epochs')=0
AS no_receiver_epoch_after_restart,
(SELECT VARIABLE_VALUE+0 FROM performance_schema.global_status
WHERE VARIABLE_NAME='Preserve_trx_transfer_receiver_inflight_tokens')=0
AS no_inflight_token_after_restart,
(SELECT VARIABLE_VALUE+0 FROM performance_schema.global_status
WHERE VARIABLE_NAME='Preserve_trx_transfer_receiver_inflight_bytes')=0
AS no_inflight_byte_after_restart,
(SELECT VARIABLE_VALUE+0 FROM performance_schema.global_status
WHERE VARIABLE_NAME=
'Preserve_trx_transfer_receiver_staged_memory_bytes')=0
AS no_staged_memory_after_restart,
(SELECT VARIABLE_VALUE+0 FROM performance_schema.global_status
WHERE VARIABLE_NAME='Preserve_trx_promotion_prepared_registered_tokens')=0
AS no_prepared_entry_after_restart,
(SELECT VARIABLE_VALUE+0 FROM performance_schema.global_status
WHERE VARIABLE_NAME=
'Preserve_trx_promotion_prepared_prewarm_pending_tokens')=0
AS no_prewarm_pending_after_restart,
(SELECT VARIABLE_VALUE+0 FROM performance_schema.global_status
WHERE VARIABLE_NAME='Preserve_trx_promotion_prepared_ready_tokens')=0
AS no_prepared_ready_after_restart,
(SELECT VARIABLE_VALUE+0 FROM performance_schema.global_status
WHERE VARIABLE_NAME='Preserve_trx_promotion_ready_cache_bytes')=0
AS no_ready_cache_after_restart,
(SELECT VARIABLE_VALUE+0 FROM performance_schema.global_status
WHERE VARIABLE_NAME='Preserve_trx_memory_current_bytes')=0
AS no_preserve_memory_after_restart,
(SELECT VARIABLE_VALUE+0 FROM performance_schema.global_status
WHERE VARIABLE_NAME='Preserve_trx_transfer_receiver_worker_active')=0
AS no_active_worker_after_restart,
(SELECT VARIABLE_VALUE+0 FROM performance_schema.global_status
WHERE VARIABLE_NAME='Preserve_trx_transfer_receiver_queued_bytes')=0
AS no_queued_byte_after_restart;
no_receiver_epoch_after_restart	no_inflight_token_after_restart	no_inflight_byte_after_restart	no_staged_memory_after_restart	no_prepared_entry_after_restart	no_prewarm_pending_after_restart	no_prepared_ready_after_restart	no_ready_cache_after_restart	no_preserve_memory_after_restart	no_active_worker_after_restart	no_queued_byte_after_restart
1	1	1	1	1	1	1	1	1	1	1
SELECT COUNT(*)=32 AS thirty_two_accounts,
SUM(balance)=32001 AS committed_background_balance,
SUM(version)=1 AS one_committed_background_version,
MAX(CASE WHEN id=7 THEN version END)=0 AS owner_updates_rolled_back,
MAX(CASE WHEN id=32 THEN balance END)=1001 AS outsider_update_kept
FROM xfer1_read_view_accounts;
thirty_two_accounts	committed_background_balance	one_committed_background_version	owner_updates_rolled_back	outsider_update_kept
1	1	1	1	1
SELECT COUNT(*)=0 AS owner_audit_rolled_back FROM xfer1_read_view_audit;
owner_audit_rolled_back
1
DROP TABLE xfer1_read_view_audit;
DROP TABLE xfer1_read_view_accounts;
DROP USER xfer1_read_view_app@localhost;
DROP USER preserve_trx_ha_admin@'127.0.0.1';
