CALL mtr.add_suppression(
"PRESERVE: rolled back prepared transaction without snapshot during recovery");
CREATE TABLE xfer2_w01_accounts(
id INT PRIMARY KEY,
balance INT NOT NULL,
version INT NOT NULL DEFAULT 0,
pad VARCHAR(64) NOT NULL
) ENGINE=InnoDB;
CREATE TABLE xfer2_w01_audit(
id BIGINT AUTO_INCREMENT PRIMARY KEY,
account_id INT NOT NULL,
delta INT NOT NULL,
KEY(account_id)
) ENGINE=InnoDB;
INSERT INTO xfer2_w01_accounts
WITH RECURSIVE seq(n) AS (
SELECT 1 UNION ALL SELECT n+1 FROM seq WHERE n<32
)
SELECT n, 1000, 0, CONCAT('account-', n) FROM seq;
CALL mtr.add_suppression(
"PRESERVE: standby transfer client send failed errno=1227");
CALL mtr.add_suppression(
"PRESERVE: standby transfer source entered COMMIT_UNKNOWN");
DROP TABLE IF EXISTS xfer2_revoke_receiver_native;
CREATE TABLE xfer2_revoke_receiver_native(
id INT PRIMARY KEY,
v INT NOT NULL
) ENGINE=InnoDB;
INSERT INTO xfer2_revoke_receiver_native VALUES(1,40),(2,60);
SET @active_before=(SELECT VARIABLE_VALUE+0
FROM performance_schema.global_status WHERE VARIABLE_NAME=
'Preserve_trx_transfer_receiver_active_epochs');
SET @admitted_before=(SELECT VARIABLE_VALUE+0
FROM performance_schema.global_status WHERE VARIABLE_NAME=
'Preserve_trx_transfer_receiver_admitted_frames');
SET @admitted_bytes_before=(SELECT VARIABLE_VALUE+0
FROM performance_schema.global_status WHERE VARIABLE_NAME=
'Preserve_trx_transfer_receiver_admitted_bytes');
SET @inflight_tokens_before=(SELECT VARIABLE_VALUE+0
FROM performance_schema.global_status WHERE VARIABLE_NAME=
'Preserve_trx_transfer_receiver_inflight_tokens');
SET @inflight_bytes_before=(SELECT VARIABLE_VALUE+0
FROM performance_schema.global_status WHERE VARIABLE_NAME=
'Preserve_trx_transfer_receiver_inflight_bytes');
SET @staged_before=(SELECT VARIABLE_VALUE+0
FROM performance_schema.global_status WHERE VARIABLE_NAME=
'Preserve_trx_transfer_receiver_staged_memory_bytes');
SET @cleanup_debt_tokens_before=(SELECT VARIABLE_VALUE+0
FROM performance_schema.global_status WHERE VARIABLE_NAME=
'Preserve_trx_transfer_receiver_cleanup_debt_tokens');
SET @cleanup_debt_bytes_before=(SELECT VARIABLE_VALUE+0
FROM performance_schema.global_status WHERE VARIABLE_NAME=
'Preserve_trx_transfer_receiver_cleanup_debt_bytes');
SET @cleanup_tainted_before=(SELECT VARIABLE_VALUE+0
FROM performance_schema.global_status WHERE VARIABLE_NAME=
'Preserve_trx_transfer_receiver_cleanup_tainted_transitions');
SET @terminal_wins_before=(SELECT VARIABLE_VALUE+0
FROM performance_schema.global_status WHERE VARIABLE_NAME=
'Preserve_trx_transfer_receiver_terminal_cas_wins');
SET @tombstones_before=(SELECT VARIABLE_VALUE+0
FROM performance_schema.global_status WHERE VARIABLE_NAME=
'Preserve_trx_transfer_receiver_terminal_status_tombstones');
SET @saved_before=(SELECT VARIABLE_VALUE+0
FROM performance_schema.global_status WHERE VARIABLE_NAME=
'Preserve_trx_transfer_receiver_saved_online_tokens');
SET @prepared_registered_before=(SELECT VARIABLE_VALUE+0
FROM performance_schema.global_status WHERE VARIABLE_NAME=
'Preserve_trx_promotion_prepared_registered_tokens');
SET @prepared_pending_before=(SELECT VARIABLE_VALUE+0
FROM performance_schema.global_status WHERE VARIABLE_NAME=
'Preserve_trx_promotion_prepared_prewarm_pending_tokens');
SET @prepared_ready_before=(SELECT VARIABLE_VALUE+0
FROM performance_schema.global_status WHERE VARIABLE_NAME=
'Preserve_trx_promotion_prepared_ready_tokens');
SET @ready_cache_before=(SELECT VARIABLE_VALUE+0
FROM performance_schema.global_status WHERE VARIABLE_NAME=
'Preserve_trx_promotion_ready_cache_bytes');
SET @memory_before=(SELECT VARIABLE_VALUE+0
FROM performance_schema.global_status WHERE VARIABLE_NAME=
'Preserve_trx_memory_current_bytes');
SET GLOBAL rds_preserve_trx_drain_phase2_timeout_ms=5000;
SET @reset_wins_before=(SELECT VARIABLE_VALUE+0
FROM performance_schema.global_status WHERE VARIABLE_NAME=
'Preserve_trx_reset_drain_wins');
SET @reset_too_late_before=(SELECT VARIABLE_VALUE+0
FROM performance_schema.global_status WHERE VARIABLE_NAME=
'Preserve_trx_reset_drain_too_late');
SET @quarantine_epochs_before=(SELECT VARIABLE_VALUE+0
FROM performance_schema.global_status WHERE VARIABLE_NAME=
'Preserve_trx_transfer_quarantine_epochs');
SET @quarantine_tokens_before=(SELECT VARIABLE_VALUE+0
FROM performance_schema.global_status WHERE VARIABLE_NAME=
'Preserve_trx_transfer_quarantine_tokens');
SET SESSION TRANSACTION ISOLATION LEVEL REPEATABLE READ;
START TRANSACTION;
SELECT balance=1000 AND version=0 AS owner_rr_initial
FROM xfer2_w01_accounts WHERE id=32;
owner_rr_initial
1
SELECT balance=1000 AND version=0 AS owner_rr_stays_old
FROM xfer2_w01_accounts WHERE id=32;
owner_rr_stays_old
1
SELECT SUM(balance)=3000 AND SUM(version)=3 AS owner_sees_three_writes
FROM xfer2_w01_accounts WHERE id IN (3,7,11);
owner_sees_three_writes
1
SELECT COUNT(*)=1 AND SUM(delta)=0 AS owner_sees_one_audit
FROM xfer2_w01_audit;
owner_sees_one_audit
1
SELECT COUNT(*)=32 AS outsider_row_count,
SUM(balance)=32001 AS outsider_sees_background_only,
SUM(version)=1 AS outsider_hides_owner_versions,
SUM(id IN (3,7,11) AND version<>0)=0 AS owner_rows_not_dirty
FROM xfer2_w01_accounts;
outsider_row_count	outsider_sees_background_only	outsider_hides_owner_versions	owner_rows_not_dirty
1	1	1	1
SELECT COUNT(*)=0 AS owner_audit_not_dirty FROM xfer2_w01_audit;
owner_audit_not_dirty
1
SELECT COUNT(*)=1 AS waiter_blocked_before_drain FROM performance_schema.data_lock_waits w JOIN performance_schema.threads t ON t.THREAD_ID=w.REQUESTING_THREAD_ID WHERE t.PROCESSLIST_ID=WAITER_ID;
waiter_blocked_before_drain
1
SELECT (SELECT VARIABLE_VALUE+0 FROM performance_schema.global_status
WHERE VARIABLE_NAME=
'Preserve_trx_transfer_source_handoff_pending_epochs')=0
AS no_handoff_pending_at_final_metadata_boundary,
(SELECT VARIABLE_VALUE+0 FROM performance_schema.global_status
WHERE VARIABLE_NAME=
'Preserve_trx_transfer_source_commit_unknown_epochs')=0
AS no_commit_unknown_at_final_metadata_boundary;
no_handoff_pending_at_final_metadata_boundary	no_commit_unknown_at_final_metadata_boundary
1	1
SELECT (SELECT VARIABLE_VALUE+0 FROM performance_schema.global_status
WHERE VARIABLE_NAME='Preserve_trx_transfer_receiver_admitted_frames')
>@admitted_before AS phase1_frames_admitted_before_revoke,
(SELECT VARIABLE_VALUE+0 FROM performance_schema.global_status
WHERE VARIABLE_NAME='Preserve_trx_transfer_receiver_inflight_tokens')
>@inflight_tokens_before AS phase1_tokens_accounted_before_revoke,
(SELECT VARIABLE_VALUE+0 FROM performance_schema.global_status
WHERE VARIABLE_NAME='Preserve_trx_transfer_receiver_inflight_bytes')
>@inflight_bytes_before AS phase1_bytes_accounted_before_revoke,
(SELECT VARIABLE_VALUE+0 FROM performance_schema.global_status
WHERE VARIABLE_NAME='Preserve_trx_transfer_receiver_staged_memory_bytes')
>@staged_before AS phase1_payload_staged_before_revoke;
phase1_frames_admitted_before_revoke	phase1_tokens_accounted_before_revoke	phase1_bytes_accounted_before_revoke	phase1_payload_staged_before_revoke
1	1	1	1
SELECT (SELECT VARIABLE_VALUE+0 FROM performance_schema.global_status
WHERE VARIABLE_NAME='Preserve_trx_transfer_receiver_active_epochs')
=@active_before AS no_commit_at_phase_boundary,
(SELECT VARIABLE_VALUE+0 FROM performance_schema.global_status
WHERE VARIABLE_NAME='Preserve_trx_transfer_receiver_terminal_cas_wins')
=@terminal_wins_before AS no_terminal_cas_at_phase_boundary,
(SELECT VARIABLE_VALUE+0 FROM performance_schema.global_status
WHERE VARIABLE_NAME=
'Preserve_trx_transfer_receiver_terminal_status_tombstones')
=@tombstones_before AS no_terminal_tombstone_at_phase_boundary;
no_commit_at_phase_boundary	no_terminal_cas_at_phase_boundary	no_terminal_tombstone_at_phase_boundary
1	1	1
SELECT (SELECT VARIABLE_VALUE+0 FROM performance_schema.global_status
WHERE VARIABLE_NAME='Preserve_trx_promotion_prepared_registered_tokens')
=@prepared_registered_before+1 AS prepared_state_staged_before_revoke,
(SELECT VARIABLE_VALUE+0 FROM performance_schema.global_status
WHERE VARIABLE_NAME=
'Preserve_trx_promotion_prepared_prewarm_pending_tokens')
=@prepared_pending_before+1 AS prewarm_pending_before_revoke,
(SELECT VARIABLE_VALUE+0 FROM performance_schema.global_status
WHERE VARIABLE_NAME='Preserve_trx_promotion_prepared_ready_tokens')
=@prepared_ready_before AS no_ready_token_before_commit,
(SELECT VARIABLE_VALUE+0 FROM performance_schema.global_status
WHERE VARIABLE_NAME='Preserve_trx_promotion_ready_cache_bytes')
>@ready_cache_before AS ready_cache_staged_before_revoke,
(SELECT VARIABLE_VALUE+0 FROM performance_schema.global_status
WHERE VARIABLE_NAME='Preserve_trx_memory_current_bytes')
>@memory_before AS preserve_memory_staged_before_revoke;
prepared_state_staged_before_revoke	prewarm_pending_before_revoke	no_ready_token_before_commit	ready_cache_staged_before_revoke	preserve_memory_staged_before_revoke
1	1	1	1	1
ERROR HY000: Preserve drain is active; this command was not executed
SELECT COUNT(*)=1 AS waiter_blocked_at_phase_boundary FROM performance_schema.data_lock_waits w JOIN performance_schema.threads t ON t.THREAD_ID=w.REQUESTING_THREAD_ID WHERE t.PROCESSLIST_ID=WAITER_ID;
waiter_blocked_at_phase_boundary
1
ERROR HY000: Resumable transactions across shutdown do not support this operation
SELECT (SELECT VARIABLE_VALUE+0 FROM performance_schema.global_status
WHERE VARIABLE_NAME='Preserve_trx_transfer_receiver_admitted_frames')
=@admitted_at_revoke AS no_post_revoke_frame_admitted,
(SELECT VARIABLE_VALUE+0 FROM performance_schema.global_status
WHERE VARIABLE_NAME='Preserve_trx_transfer_receiver_admitted_bytes')
=@admitted_bytes_at_revoke AS no_post_revoke_byte_admitted,
(SELECT VARIABLE_VALUE+0 FROM performance_schema.global_status
WHERE VARIABLE_NAME='Preserve_trx_transfer_receiver_active_epochs')
=@active_before AS no_committed_receiver_epoch,
(SELECT VARIABLE_VALUE+0 FROM performance_schema.global_status
WHERE VARIABLE_NAME='Preserve_trx_transfer_receiver_terminal_cas_wins')
=@terminal_wins_before AS no_terminal_cas,
(SELECT VARIABLE_VALUE+0 FROM performance_schema.global_status
WHERE VARIABLE_NAME=
'Preserve_trx_transfer_receiver_terminal_status_tombstones')
=@tombstones_before AS no_terminal_tombstone;
no_post_revoke_frame_admitted	no_post_revoke_byte_admitted	no_committed_receiver_epoch	no_terminal_cas	no_terminal_tombstone
1	1	1	1	1
SELECT (SELECT VARIABLE_VALUE+0 FROM performance_schema.global_status
WHERE VARIABLE_NAME='Preserve_trx_transfer_receiver_inflight_tokens')
=@inflight_tokens_at_revoke AS precommit_token_ledger_retained,
(SELECT VARIABLE_VALUE+0 FROM performance_schema.global_status
WHERE VARIABLE_NAME='Preserve_trx_transfer_receiver_inflight_bytes')
=@inflight_bytes_at_revoke AS precommit_byte_ledger_retained,
(SELECT VARIABLE_VALUE+0 FROM performance_schema.global_status
WHERE VARIABLE_NAME='Preserve_trx_transfer_receiver_staged_memory_bytes')
=@staged_at_revoke AS staged_payload_retained,
(SELECT VARIABLE_VALUE+0 FROM performance_schema.global_status
WHERE VARIABLE_NAME='Preserve_trx_transfer_receiver_cleanup_debt_tokens')
=@cleanup_debt_tokens_before AS rejected_cleanup_created_no_false_debt,
(SELECT VARIABLE_VALUE+0 FROM performance_schema.global_status
WHERE VARIABLE_NAME='Preserve_trx_transfer_receiver_cleanup_debt_bytes')
=@cleanup_debt_bytes_before AS rejected_cleanup_created_no_false_debt_bytes,
(SELECT VARIABLE_VALUE+0 FROM performance_schema.global_status
WHERE VARIABLE_NAME=
'Preserve_trx_transfer_receiver_cleanup_tainted_transitions')
=@cleanup_tainted_before AS rejected_cleanup_created_no_false_taint;
precommit_token_ledger_retained	precommit_byte_ledger_retained	staged_payload_retained	rejected_cleanup_created_no_false_debt	rejected_cleanup_created_no_false_debt_bytes	rejected_cleanup_created_no_false_taint
1	1	1	1	1	1
SELECT (SELECT VARIABLE_VALUE+0 FROM performance_schema.global_status
WHERE VARIABLE_NAME=
'Preserve_trx_transfer_receiver_saved_online_tokens')
=@saved_before AS no_saved_online_token,
(SELECT VARIABLE_VALUE+0 FROM performance_schema.global_status
WHERE VARIABLE_NAME='Preserve_trx_promotion_prepared_registered_tokens')
=@prepared_registered_at_revoke AS prepared_registration_retained,
(SELECT VARIABLE_VALUE+0 FROM performance_schema.global_status
WHERE VARIABLE_NAME=
'Preserve_trx_promotion_prepared_prewarm_pending_tokens')
=@prepared_pending_at_revoke AS prewarm_pending_retained,
(SELECT VARIABLE_VALUE+0 FROM performance_schema.global_status
WHERE VARIABLE_NAME='Preserve_trx_promotion_prepared_ready_tokens')
=@prepared_ready_at_revoke AS no_ready_publication_after_revoke,
(SELECT VARIABLE_VALUE+0 FROM performance_schema.global_status
WHERE VARIABLE_NAME='Preserve_trx_promotion_ready_cache_bytes')
=@ready_cache_at_revoke AS ready_cache_retained,
(SELECT VARIABLE_VALUE+0 FROM performance_schema.global_status
WHERE VARIABLE_NAME='Preserve_trx_memory_current_bytes')
=@memory_at_revoke AS preserve_memory_retained;
no_saved_online_token	prepared_registration_retained	prewarm_pending_retained	no_ready_publication_after_revoke	ready_cache_retained	preserve_memory_retained
1	1	1	1	1	1
GRANT PRESERVE_TRX_TRANSFER_ADMIN ON *.*
TO preserve_trx_ha_admin@localhost;
START TRANSACTION;
UPDATE xfer2_revoke_receiver_native SET v=v+id;
COMMIT;
SELECT SUM(v)=103 AS receiver_native_dml_works
FROM xfer2_revoke_receiver_native;
receiver_native_dml_works
1
SELECT (SELECT VARIABLE_VALUE+0 FROM performance_schema.global_status
WHERE VARIABLE_NAME=
'Preserve_trx_transfer_source_handoff_pending_epochs')=0
AS no_handoff_pending_after_rejection,
(SELECT VARIABLE_VALUE+0 FROM performance_schema.global_status
WHERE VARIABLE_NAME=
'Preserve_trx_transfer_source_commit_unknown_epochs')=1
AS one_commit_unknown_epoch,
(SELECT VARIABLE_VALUE+0 FROM performance_schema.global_status
WHERE VARIABLE_NAME='Preserve_trx_transfer_quarantine_epochs')
=@quarantine_epochs_before+1 AS one_quarantine_epoch,
(SELECT VARIABLE_VALUE+0 FROM performance_schema.global_status
WHERE VARIABLE_NAME='Preserve_trx_transfer_quarantine_tokens')
=@quarantine_tokens_before+1 AS one_quarantined_token;
no_handoff_pending_after_rejection	one_commit_unknown_epoch	one_quarantine_epoch	one_quarantined_token
1	1	1	1
RESET DRAIN;
ERROR HY000: RESET DRAIN arrived after ownership became irreversible
SELECT (SELECT VARIABLE_VALUE+0 FROM performance_schema.global_status
WHERE VARIABLE_NAME='Preserve_trx_reset_drain_wins')
=@reset_wins_before AS reset_did_not_win,
(SELECT VARIABLE_VALUE+0 FROM performance_schema.global_status
WHERE VARIABLE_NAME='Preserve_trx_reset_drain_too_late')
=@reset_too_late_before+1 AS reset_was_too_late_once;
reset_did_not_win	reset_was_too_late_once
1	1
SELECT COUNT(*)=1 AS waiter_still_blocked_after_rejection FROM performance_schema.data_lock_waits w JOIN performance_schema.threads t ON t.THREAD_ID=w.REQUESTING_THREAD_ID WHERE t.PROCESSLIST_ID=WAITER_ID;
waiter_still_blocked_after_rejection
1
SELECT 1;
ERROR HY000: Preserve drain is active; this command was not executed
UPDATE xfer2_w01_accounts
SET pad=CONCAT(pad,'-after-revoke') WHERE id=11;
ERROR HY000: Preserve drain is active; this command was not executed
ROLLBACK;
ERROR HY000: Preserve drain is active; this command was not executed
SELECT 1;
ERROR HY000: Preserve drain is active; this command was not executed
include/assert_grep.inc [revoked transfer privilege rejected terminal COMMIT before receiver admission]
include/assert_grep.inc [rejected terminal delivery entered explicit source quarantine]
SELECT (SELECT VARIABLE_VALUE+0 FROM performance_schema.global_status
WHERE VARIABLE_NAME='Preserve_trx_transfer_receiver_inflight_tokens')
=@inflight_tokens_at_revoke AS residue_token_until_restart,
(SELECT VARIABLE_VALUE+0 FROM performance_schema.global_status
WHERE VARIABLE_NAME='Preserve_trx_transfer_receiver_inflight_bytes')
=@inflight_bytes_at_revoke AS residue_bytes_until_restart,
(SELECT VARIABLE_VALUE+0 FROM performance_schema.global_status
WHERE VARIABLE_NAME='Preserve_trx_transfer_receiver_staged_memory_bytes')
=@staged_at_revoke AS residue_payload_until_restart,
(SELECT VARIABLE_VALUE+0 FROM performance_schema.global_status
WHERE VARIABLE_NAME='Preserve_trx_promotion_prepared_registered_tokens')
=@prepared_registered_at_revoke AS prepared_state_until_restart,
(SELECT VARIABLE_VALUE+0 FROM performance_schema.global_status
WHERE VARIABLE_NAME=
'Preserve_trx_promotion_prepared_prewarm_pending_tokens')
=@prepared_pending_at_revoke AS prewarm_pending_until_restart,
(SELECT VARIABLE_VALUE+0 FROM performance_schema.global_status
WHERE VARIABLE_NAME='Preserve_trx_promotion_ready_cache_bytes')
=@ready_cache_at_revoke AS ready_cache_until_restart,
(SELECT VARIABLE_VALUE+0 FROM performance_schema.global_status
WHERE VARIABLE_NAME='Preserve_trx_memory_current_bytes')
=@memory_at_revoke AS preserve_memory_until_restart,
(SELECT VARIABLE_VALUE+0 FROM performance_schema.global_status
WHERE VARIABLE_NAME='Preserve_trx_transfer_receiver_worker_active')=0
AS no_worker_before_restart,
(SELECT VARIABLE_VALUE+0 FROM performance_schema.global_status
WHERE VARIABLE_NAME='Preserve_trx_transfer_receiver_queued_bytes')=0
AS no_queue_before_restart;
residue_token_until_restart	residue_bytes_until_restart	residue_payload_until_restart	prepared_state_until_restart	prewarm_pending_until_restart	ready_cache_until_restart	preserve_memory_until_restart	no_worker_before_restart	no_queue_before_restart
1	1	1	1	1	1	1	1	1
SELECT (SELECT VARIABLE_VALUE+0 FROM performance_schema.global_status
WHERE VARIABLE_NAME='Preserve_trx_transfer_receiver_active_epochs')=0
AS no_receiver_epoch_after_restart,
(SELECT VARIABLE_VALUE+0 FROM performance_schema.global_status
WHERE VARIABLE_NAME='Preserve_trx_transfer_receiver_inflight_tokens')=0
AS no_inflight_token_after_restart,
(SELECT VARIABLE_VALUE+0 FROM performance_schema.global_status
WHERE VARIABLE_NAME='Preserve_trx_transfer_receiver_inflight_bytes')=0
AS no_inflight_byte_after_restart,
(SELECT VARIABLE_VALUE+0 FROM performance_schema.global_status
WHERE VARIABLE_NAME=
'Preserve_trx_transfer_receiver_staged_memory_bytes')=0
AS no_staged_memory_after_restart,
(SELECT VARIABLE_VALUE+0 FROM performance_schema.global_status
WHERE VARIABLE_NAME='Preserve_trx_promotion_prepared_registered_tokens')=0
AS no_prepared_entry_after_restart,
(SELECT VARIABLE_VALUE+0 FROM performance_schema.global_status
WHERE VARIABLE_NAME=
'Preserve_trx_promotion_prepared_prewarm_pending_tokens')=0
AS no_prewarm_pending_after_restart,
(SELECT VARIABLE_VALUE+0 FROM performance_schema.global_status
WHERE VARIABLE_NAME='Preserve_trx_promotion_prepared_ready_tokens')=0
AS no_prepared_ready_after_restart,
(SELECT VARIABLE_VALUE+0 FROM performance_schema.global_status
WHERE VARIABLE_NAME='Preserve_trx_promotion_ready_cache_bytes')=0
AS no_ready_cache_after_restart,
(SELECT VARIABLE_VALUE+0 FROM performance_schema.global_status
WHERE VARIABLE_NAME='Preserve_trx_memory_current_bytes')=0
AS no_preserve_memory_after_restart,
(SELECT VARIABLE_VALUE+0 FROM performance_schema.global_status
WHERE VARIABLE_NAME='Preserve_trx_transfer_receiver_worker_active')=0
AS no_active_worker_after_restart,
(SELECT VARIABLE_VALUE+0 FROM performance_schema.global_status
WHERE VARIABLE_NAME='Preserve_trx_transfer_receiver_queued_bytes')=0
AS no_queued_byte_after_restart;
no_receiver_epoch_after_restart	no_inflight_token_after_restart	no_inflight_byte_after_restart	no_staged_memory_after_restart	no_prepared_entry_after_restart	no_prewarm_pending_after_restart	no_prepared_ready_after_restart	no_ready_cache_after_restart	no_preserve_memory_after_restart	no_active_worker_after_restart	no_queued_byte_after_restart
1	1	1	1	1	1	1	1	1	1	1
SELECT VARIABLE_VALUE=0 AS no_saved_online_token_after_restart
FROM performance_schema.global_status
WHERE VARIABLE_NAME='Preserve_trx_transfer_receiver_saved_online_tokens';
no_saved_online_token_after_restart
1
SELECT SUM(v)=103 AS receiver_native_data_survives_restart
FROM xfer2_revoke_receiver_native;
receiver_native_data_survives_restart
1
SELECT (SELECT VARIABLE_VALUE+0 FROM performance_schema.global_status
WHERE VARIABLE_NAME=
'Preserve_trx_transfer_source_commit_unknown_epochs')=1
AS source_stays_commit_unknown_after_receiver_restart,
(SELECT VARIABLE_VALUE+0 FROM performance_schema.global_status
WHERE VARIABLE_NAME='Preserve_trx_transfer_quarantine_epochs')=1
AS source_quarantine_survives_receiver_restart;
source_stays_commit_unknown_after_receiver_restart	source_quarantine_survives_receiver_restart
1	1
SELECT COUNT(*)=1 AS waiter_blocked_until_source_restart FROM performance_schema.data_lock_waits w JOIN performance_schema.threads t ON t.THREAD_ID=w.REQUESTING_THREAD_ID WHERE t.PROCESSLIST_ID=WAITER_ID;
waiter_blocked_until_source_restart
1
Got one of the listed errors
SELECT COUNT(*)=32 AS thirty_two_accounts,
SUM(balance)=32001 AS committed_background_balance,
SUM(version)=1 AS one_committed_background_version,
MAX(CASE WHEN id=32 THEN balance END)=1001 AS background_update_visible,
MAX(CASE WHEN id=3 THEN version END)=0 AS owner_updates_hidden
FROM xfer2_w01_accounts;
thirty_two_accounts	committed_background_balance	one_committed_background_version	background_update_visible	owner_updates_hidden
1	1	1	1	1
SELECT COUNT(*)=0 AS no_committed_audit FROM xfer2_w01_audit;
no_committed_audit
1
CHECK TABLE xfer2_w01_accounts,xfer2_w01_audit;
Table	Op	Msg_type	Msg_text
test.xfer2_w01_accounts	check	status	OK
test.xfer2_w01_audit	check	status	OK
SELECT (SELECT VARIABLE_VALUE+0 FROM performance_schema.global_status
WHERE VARIABLE_NAME=
'Preserve_trx_transfer_source_commit_unknown_epochs')=0
AS no_commit_unknown_after_source_restart,
(SELECT VARIABLE_VALUE+0 FROM performance_schema.global_status
WHERE VARIABLE_NAME='Preserve_trx_transfer_quarantine_epochs')=0
AS no_quarantine_after_source_restart;
no_commit_unknown_after_source_restart	no_quarantine_after_source_restart
1	1
DROP TABLE xfer2_w01_audit;
DROP TABLE xfer2_w01_accounts;
DROP USER xfer2_w01_app@localhost;
DROP USER preserve_trx_ha_admin@localhost;
