CALL mtr.add_suppression(
"PRESERVE: rolled back prepared transaction without snapshot during recovery");
CREATE TABLE xfer2_w01_accounts(
id INT PRIMARY KEY,
balance INT NOT NULL,
version INT NOT NULL DEFAULT 0,
pad VARCHAR(64) NOT NULL
) ENGINE=InnoDB;
CREATE TABLE xfer2_w01_audit(
id BIGINT AUTO_INCREMENT PRIMARY KEY,
account_id INT NOT NULL,
delta INT NOT NULL,
KEY(account_id)
) ENGINE=InnoDB;
INSERT INTO xfer2_w01_accounts
WITH RECURSIVE seq(n) AS (
SELECT 1 UNION ALL SELECT n+1 FROM seq WHERE n<32
)
SELECT n, 1000, 0, CONCAT('account-', n) FROM seq;
CALL mtr.add_suppression(".*Got an error reading communication packets.*");
CALL mtr.add_suppression(
"PRESERVE: standby transfer client send failed errno=");
CALL mtr.add_suppression(
"PRESERVE: standby transfer source epoch abort failed status=9");
DROP TABLE IF EXISTS xfer2_nonce_receiver_native;
CREATE TABLE xfer2_nonce_receiver_native(
id INT PRIMARY KEY,
v INT NOT NULL
) ENGINE=InnoDB;
INSERT INTO xfer2_nonce_receiver_native VALUES(1,40),(2,60);
SET @admitted_before=(SELECT VARIABLE_VALUE+0
FROM performance_schema.global_status WHERE VARIABLE_NAME=
'Preserve_trx_transfer_receiver_admitted_frames');
SET @admitted_bytes_before=(SELECT VARIABLE_VALUE+0
FROM performance_schema.global_status WHERE VARIABLE_NAME=
'Preserve_trx_transfer_receiver_admitted_bytes');
SET @active_before=(SELECT VARIABLE_VALUE+0
FROM performance_schema.global_status WHERE VARIABLE_NAME=
'Preserve_trx_transfer_receiver_active_epochs');
SET @terminal_before=(SELECT VARIABLE_VALUE+0
FROM performance_schema.global_status WHERE VARIABLE_NAME=
'Preserve_trx_transfer_receiver_terminal_cas_wins');
SET @inflight_tokens_before=(SELECT VARIABLE_VALUE+0
FROM performance_schema.global_status WHERE VARIABLE_NAME=
'Preserve_trx_transfer_receiver_inflight_tokens');
SET @inflight_bytes_before=(SELECT VARIABLE_VALUE+0
FROM performance_schema.global_status WHERE VARIABLE_NAME=
'Preserve_trx_transfer_receiver_inflight_bytes');
SET @staged_before=(SELECT VARIABLE_VALUE+0
FROM performance_schema.global_status WHERE VARIABLE_NAME=
'Preserve_trx_transfer_receiver_staged_memory_bytes');
SET @prepared_before=(SELECT VARIABLE_VALUE+0
FROM performance_schema.global_status WHERE VARIABLE_NAME=
'Preserve_trx_promotion_prepared_registered_tokens');
SET @pending_before=(SELECT VARIABLE_VALUE+0
FROM performance_schema.global_status WHERE VARIABLE_NAME=
'Preserve_trx_promotion_prepared_prewarm_pending_tokens');
SET @prepared_ready_before=(SELECT VARIABLE_VALUE+0
FROM performance_schema.global_status WHERE VARIABLE_NAME=
'Preserve_trx_promotion_prepared_ready_tokens');
SET @ready_cache_before=(SELECT VARIABLE_VALUE+0
FROM performance_schema.global_status WHERE VARIABLE_NAME=
'Preserve_trx_promotion_ready_cache_bytes');
SET @debt_tokens_before=(SELECT VARIABLE_VALUE+0
FROM performance_schema.global_status WHERE VARIABLE_NAME=
'Preserve_trx_transfer_receiver_cleanup_debt_tokens');
SET @debt_bytes_before=(SELECT VARIABLE_VALUE+0
FROM performance_schema.global_status WHERE VARIABLE_NAME=
'Preserve_trx_transfer_receiver_cleanup_debt_bytes');
SET @memory_before=(SELECT VARIABLE_VALUE+0
FROM performance_schema.global_status WHERE VARIABLE_NAME=
'Preserve_trx_memory_current_bytes');
SELECT balance=1000 AND version=0 AS owner_rr_initial FROM xfer2_w01_accounts WHERE id=32;
owner_rr_initial
1
SELECT balance=1000 AND version=0 AS owner_rr_repeatable_after_outsider_commit FROM xfer2_w01_accounts WHERE id=32;
owner_rr_repeatable_after_outsider_commit
1
SELECT SUM(balance)=3000 AND SUM(version)=3
AS owner_sees_three_nonadjacent_updates
FROM xfer2_w01_accounts WHERE id IN (3,7,11);
owner_sees_three_nonadjacent_updates
1
SELECT COUNT(*)=1 AND SUM(delta)=0 AS owner_sees_one_audit
FROM xfer2_w01_audit WHERE account_id=3;
owner_sees_one_audit
1
SELECT COUNT(*)=32 AS outsider_row_count,SUM(balance)=32001 AS outsider_sees_committed_only,SUM(version)=1 AS outsider_committed_versions,SUM(id IN (3,7,11) AND version<>0)=0 AS owner_rows_not_dirty FROM xfer2_w01_accounts;
outsider_row_count	outsider_sees_committed_only	outsider_committed_versions	owner_rows_not_dirty
1	1	1	1
SELECT COUNT(*)=0 AS owner_audit_not_dirty FROM xfer2_w01_audit;
owner_audit_not_dirty
1
SELECT COUNT(*)=1 AS waiter_blocked_before_receiver_generation_fault FROM performance_schema.data_lock_waits w JOIN performance_schema.threads t ON t.THREAD_ID=w.REQUESTING_THREAD_ID WHERE t.PROCESSLIST_ID=WAITER_ID;
waiter_blocked_before_receiver_generation_fault
1
SET @nonce_drain_started=NOW(6);
SET DEBUG_SYNC=
'preserve_trx_transfer_after_open_epoch_ack_before_first_frame SIGNAL xfer2_nonce_open_acked WAIT_FOR xfer2_nonce_release';
DRAIN TRANSACTIONS PRESERVE;
SET DEBUG_SYNC='now WAIT_FOR xfer2_nonce_open_acked TIMEOUT 60';
SELECT COUNT(*)>=1 AS authenticated_open_transport_exists
FROM performance_schema.threads
WHERE PROCESSLIST_USER='preserve_trx_ha_admin'
   AND PROCESSLIST_COMMAND='Sleep';
authenticated_open_transport_exists
1
SELECT (SELECT VARIABLE_VALUE+0 FROM performance_schema.global_status
WHERE VARIABLE_NAME='Preserve_trx_transfer_receiver_admitted_frames')
=@admitted_before AS no_post_open_frame_admitted,
(SELECT VARIABLE_VALUE+0 FROM performance_schema.global_status
WHERE VARIABLE_NAME='Preserve_trx_transfer_receiver_admitted_bytes')
=@admitted_bytes_before AS no_post_open_byte_admitted,
(SELECT VARIABLE_VALUE+0 FROM performance_schema.global_status
WHERE VARIABLE_NAME='Preserve_trx_transfer_receiver_active_epochs')
=@active_before AS no_committed_epoch_after_open,
(SELECT VARIABLE_VALUE+0 FROM performance_schema.global_status
WHERE VARIABLE_NAME='Preserve_trx_transfer_receiver_terminal_cas_wins')
=@terminal_before AS no_terminal_cas_after_open;
no_post_open_frame_admitted	no_post_open_byte_admitted	no_committed_epoch_after_open	no_terminal_cas_after_open
1	1	1	1
SELECT (SELECT VARIABLE_VALUE+0 FROM performance_schema.global_status
WHERE VARIABLE_NAME='Preserve_trx_transfer_receiver_inflight_tokens')
=@inflight_tokens_before AS no_inflight_token_after_open,
(SELECT VARIABLE_VALUE+0 FROM performance_schema.global_status
WHERE VARIABLE_NAME='Preserve_trx_transfer_receiver_inflight_bytes')
=@inflight_bytes_before AS no_inflight_byte_after_open,
(SELECT VARIABLE_VALUE+0 FROM performance_schema.global_status
WHERE VARIABLE_NAME='Preserve_trx_transfer_receiver_staged_memory_bytes')
=@staged_before AS no_staged_memory_after_open;
no_inflight_token_after_open	no_inflight_byte_after_open	no_staged_memory_after_open
1	1	1
SELECT (SELECT VARIABLE_VALUE+0 FROM performance_schema.global_status
WHERE VARIABLE_NAME='Preserve_trx_promotion_prepared_registered_tokens')
=@prepared_before AS no_prepared_token_after_open,
(SELECT VARIABLE_VALUE+0 FROM performance_schema.global_status
WHERE VARIABLE_NAME=
'Preserve_trx_promotion_prepared_prewarm_pending_tokens')
=@pending_before AS no_prewarm_pending_after_open,
(SELECT VARIABLE_VALUE+0 FROM performance_schema.global_status
WHERE VARIABLE_NAME='Preserve_trx_promotion_prepared_ready_tokens')
=@prepared_ready_before AS no_prepared_ready_after_open,
(SELECT VARIABLE_VALUE+0 FROM performance_schema.global_status
WHERE VARIABLE_NAME='Preserve_trx_promotion_ready_cache_bytes')
=@ready_cache_before AS no_ready_cache_after_open;
no_prepared_token_after_open	no_prewarm_pending_after_open	no_prepared_ready_after_open	no_ready_cache_after_open
1	1	1	1
SELECT (SELECT VARIABLE_VALUE+0 FROM performance_schema.global_status
WHERE VARIABLE_NAME=
'Preserve_trx_transfer_receiver_cleanup_debt_tokens')
=@debt_tokens_before AS no_cleanup_debt_after_open,
(SELECT VARIABLE_VALUE+0 FROM performance_schema.global_status
WHERE VARIABLE_NAME='Preserve_trx_transfer_receiver_cleanup_debt_bytes')
=@debt_bytes_before AS no_cleanup_debt_bytes_after_open,
(SELECT VARIABLE_VALUE+0 FROM performance_schema.global_status
WHERE VARIABLE_NAME='Preserve_trx_memory_current_bytes')
=@memory_before AS no_preserve_memory_after_open;
no_cleanup_debt_after_open	no_cleanup_debt_bytes_after_open	no_preserve_memory_after_open
1	1	1
no_active_receiver_worker
1
no_receiver_queue
1
SELECT COUNT(*)=1 AND COALESCE(MAX(VARIABLE_VALUE+0),-1)=1
AS exactly_one_open_epoch_before_restart
FROM performance_schema.global_status
WHERE VARIABLE_NAME='Preserve_trx_transfer_receiver_online_epochs';
exactly_one_open_epoch_before_restart
1
SELECT (SELECT VARIABLE_VALUE+0 FROM performance_schema.global_status
WHERE VARIABLE_NAME='Preserve_trx_transfer_receiver_active_epochs')=0
AS no_receiver_epoch_after_restart,
(SELECT VARIABLE_VALUE+0 FROM performance_schema.global_status
WHERE VARIABLE_NAME='Preserve_trx_transfer_receiver_inflight_tokens')=0
AS no_inflight_token_after_restart,
(SELECT VARIABLE_VALUE+0 FROM performance_schema.global_status
WHERE VARIABLE_NAME='Preserve_trx_transfer_receiver_inflight_bytes')=0
AS no_inflight_byte_after_restart,
(SELECT VARIABLE_VALUE+0 FROM performance_schema.global_status
WHERE VARIABLE_NAME=
'Preserve_trx_transfer_receiver_staged_memory_bytes')=0
AS no_staged_memory_after_restart,
(SELECT VARIABLE_VALUE+0 FROM performance_schema.global_status
WHERE VARIABLE_NAME='Preserve_trx_promotion_prepared_registered_tokens')=0
AS no_prepared_entry_after_restart,
(SELECT VARIABLE_VALUE+0 FROM performance_schema.global_status
WHERE VARIABLE_NAME=
'Preserve_trx_promotion_prepared_prewarm_pending_tokens')=0
AS no_prewarm_pending_after_restart,
(SELECT VARIABLE_VALUE+0 FROM performance_schema.global_status
WHERE VARIABLE_NAME='Preserve_trx_promotion_prepared_ready_tokens')=0
AS no_prepared_ready_after_restart,
(SELECT VARIABLE_VALUE+0 FROM performance_schema.global_status
WHERE VARIABLE_NAME='Preserve_trx_promotion_ready_cache_bytes')=0
AS no_ready_cache_after_restart,
(SELECT VARIABLE_VALUE+0 FROM performance_schema.global_status
WHERE VARIABLE_NAME='Preserve_trx_memory_current_bytes')=0
AS no_preserve_memory_after_restart,
(SELECT VARIABLE_VALUE+0 FROM performance_schema.global_status
WHERE VARIABLE_NAME='Preserve_trx_transfer_receiver_worker_active')=0
AS no_active_worker_after_restart,
(SELECT VARIABLE_VALUE+0 FROM performance_schema.global_status
WHERE VARIABLE_NAME='Preserve_trx_transfer_receiver_queued_bytes')=0
AS no_queued_byte_after_restart;
no_receiver_epoch_after_restart	no_inflight_token_after_restart	no_inflight_byte_after_restart	no_staged_memory_after_restart	no_prepared_entry_after_restart	no_prewarm_pending_after_restart	no_prepared_ready_after_restart	no_ready_cache_after_restart	no_preserve_memory_after_restart	no_active_worker_after_restart	no_queued_byte_after_restart
1	1	1	1	1	1	1	1	1	1	1
SELECT (SELECT VARIABLE_VALUE+0 FROM performance_schema.global_status
WHERE VARIABLE_NAME='Preserve_trx_transfer_receiver_admitted_frames')=0
AS no_admitted_frame,
(SELECT VARIABLE_VALUE+0 FROM performance_schema.global_status
WHERE VARIABLE_NAME='Preserve_trx_transfer_receiver_admitted_bytes')=0
AS no_admitted_byte,
(SELECT VARIABLE_VALUE+0 FROM performance_schema.global_status
WHERE VARIABLE_NAME='Preserve_trx_transfer_receiver_failed_tokens')=0
AS no_failed_token,
(SELECT VARIABLE_VALUE+0 FROM performance_schema.global_status
WHERE VARIABLE_NAME='Preserve_trx_transfer_receiver_terminal_cas_wins')=0
AS no_terminal_fact,
(SELECT VARIABLE_VALUE+0 FROM performance_schema.global_status
WHERE VARIABLE_NAME=
'Preserve_trx_transfer_receiver_terminal_status_tombstones')=0
AS no_terminal_tombstone,
(SELECT VARIABLE_VALUE+0 FROM performance_schema.global_status
WHERE VARIABLE_NAME=
'Preserve_trx_transfer_receiver_cleanup_debt_tokens')=0
AS no_cleanup_debt,
(SELECT VARIABLE_VALUE+0 FROM performance_schema.global_status
WHERE VARIABLE_NAME='Preserve_trx_transfer_receiver_cleanup_debt_bytes')=0
AS no_cleanup_debt_byte;
no_admitted_frame	no_admitted_byte	no_failed_token	no_terminal_fact	no_terminal_tombstone	no_cleanup_debt	no_cleanup_debt_byte
1	1	1	1	1	1	1
same_receiver_datadir_new_process
1
SELECT COUNT(*)=2 AND SUM(v)=100 AS receiver_native_data_survives_restart
FROM xfer2_nonce_receiver_native;
receiver_native_data_survives_restart
1
START TRANSACTION;
UPDATE xfer2_nonce_receiver_native SET v=v+id;
INSERT INTO xfer2_nonce_receiver_native VALUES(3,30);
COMMIT;
SELECT COUNT(*)=3 AND SUM(v)=133 AS receiver_native_dml_works_new_generation
FROM xfer2_nonce_receiver_native;
receiver_native_dml_works_new_generation
1
ERROR HY000: Resumable transactions across shutdown do not support this operation
SELECT TIMESTAMPDIFF(MICROSECOND,@nonce_drain_started,NOW(6))
BETWEEN 0 AND 120000000 AS nonce_mismatch_failure_bounded;
nonce_mismatch_failure_bounded
1
no_active_receiver_worker
1
no_receiver_queue
1
no_receiver_epoch_after_restart	no_inflight_token_after_restart	no_inflight_byte_after_restart	no_staged_memory_after_restart	no_prepared_entry_after_restart	no_prewarm_pending_after_restart	no_prepared_ready_after_restart	no_ready_cache_after_restart	no_preserve_memory_after_restart	no_active_worker_after_restart	no_queued_byte_after_restart
1	1	1	1	1	1	1	1	1	1	1
no_admitted_frame	no_admitted_byte	no_failed_token	no_terminal_fact	no_terminal_tombstone	no_cleanup_debt	no_cleanup_debt_byte
1	1	1	1	1	1	1
SELECT COUNT(*)=3 AND SUM(v)=133
AS rejected_old_frame_did_not_damage_receiver_native_data
FROM xfer2_nonce_receiver_native;
rejected_old_frame_did_not_damage_receiver_native_data
1
boot_generation_projected	open_generation_projected	open_ack_bound_to_old_generation	new_generation_projected	receiver_process_generation_changed
1	1	1	1	1
SELECT COUNT(*)=1 AND COALESCE(MAX(VARIABLE_VALUE+0),0)>=1
AS old_nonce_frame_rejected
FROM performance_schema.global_status
WHERE VARIABLE_NAME=
'Preserve_trx_transfer_receiver_nonce_mismatch_rejects';
old_nonce_frame_rejected
1
SELECT COUNT(*)=1 AND MAX(VARIABLE_VALUE)='receiver_process_nonce_mismatch'
         AS exact_identity_reject_reason
FROM performance_schema.global_status
WHERE VARIABLE_NAME=
'Preserve_trx_transfer_receiver_last_identity_reject_reason';
exact_identity_reject_reason
1
SELECT COUNT(*)=1 AND COALESCE(MAX(VARIABLE_VALUE+0),-1)=0
AS new_generation_has_no_old_online_epoch
FROM performance_schema.global_status
WHERE VARIABLE_NAME='Preserve_trx_transfer_receiver_online_epochs';
new_generation_has_no_old_online_epoch
1
SELECT COUNT(*)=1 AS waiter_still_blocked_after_nonce_mismatch FROM performance_schema.data_lock_waits w JOIN performance_schema.threads t ON t.THREAD_ID=w.REQUESTING_THREAD_ID WHERE t.PROCESSLIST_ID=WAITER_ID;
waiter_still_blocked_after_nonce_mismatch
1
SELECT (SELECT VARIABLE_VALUE+0 FROM performance_schema.global_status WHERE VARIABLE_NAME='Preserve_trx_transfer_phase1_frame_count')=0 AS no_old_nonce_phase1_frame_succeeded,(SELECT VARIABLE_VALUE+0 FROM performance_schema.global_status WHERE VARIABLE_NAME='Preserve_trx_transfer_phase1_network_send_count')=0 AS no_old_nonce_phase1_send_succeeded;
no_old_nonce_phase1_frame_succeeded	no_old_nonce_phase1_send_succeeded
1	1
SELECT (SELECT VARIABLE_VALUE+0 FROM performance_schema.global_status WHERE VARIABLE_NAME='Preserve_trx_transfer_source_handoff_pending_epochs')=0 AS no_handoff_pending_before_commit_boundary,(SELECT VARIABLE_VALUE+0 FROM performance_schema.global_status WHERE VARIABLE_NAME='Preserve_trx_transfer_source_commit_unknown_epochs')=0 AS no_commit_unknown_before_commit_boundary;
no_handoff_pending_before_commit_boundary	no_commit_unknown_before_commit_boundary
1	1
SELECT (SELECT VARIABLE_VALUE+0 FROM performance_schema.global_status WHERE VARIABLE_NAME='Preserve_trx_transfer_quarantine_epochs')=0 AS no_quarantine_epoch_before_commit_boundary,(SELECT VARIABLE_VALUE+0 FROM performance_schema.global_status WHERE VARIABLE_NAME='Preserve_trx_transfer_quarantine_tokens')=0 AS no_quarantine_token_before_commit_boundary;
no_quarantine_epoch_before_commit_boundary	no_quarantine_token_before_commit_boundary
1	1
SELECT COUNT(*)=0 AS nonce_mismatch_added_no_preserved_token FROM performance_schema.preserved_transactions;
nonce_mismatch_added_no_preserved_token
1
SELECT CONNECTION_ID() AS same_owner_connection_after_nonce_mismatch;
same_owner_connection_after_nonce_mismatch
OWNER_ID
SELECT balance=1000 AND version=0 AS owner_rr_survives_nonce_mismatch
FROM xfer2_w01_accounts WHERE id=32;
owner_rr_survives_nonce_mismatch
1
SELECT SUM(balance)=3000 AND SUM(version)=3
AS owner_writes_survive_nonce_mismatch
FROM xfer2_w01_accounts WHERE id IN (3,7,11);
owner_writes_survive_nonce_mismatch
1
SELECT COUNT(*)=1 AND SUM(delta)=0 AS owner_audit_survives_nonce_mismatch
FROM xfer2_w01_audit WHERE account_id=3;
owner_audit_survives_nonce_mismatch
1
UPDATE xfer2_w01_accounts
SET pad=CONCAT(pad,'-after-nonce') WHERE id=11;
SELECT ROW_COUNT()=1 AS owner_can_continue_dml_after_nonce_mismatch;
owner_can_continue_dml_after_nonce_mismatch
1
SELECT SUM(id IN (3,7,11) AND version<>0)=0
AS owner_changes_remain_isolated_after_nonce_mismatch
FROM xfer2_w01_accounts;
owner_changes_remain_isolated_after_nonce_mismatch
1
SELECT COUNT(*)=0 AS owner_audit_remains_isolated_after_nonce_mismatch
FROM xfer2_w01_audit;
owner_audit_remains_isolated_after_nonce_mismatch
1
SELECT COUNT(*)=32 AS final_row_count,
SUM(balance)=32007 AS final_balance_exactly_once,
SUM(version)=5 AS final_versions_exactly_once,
SUM(id IN (3,7,11,32) AND version>0)=4 AS exact_committed_rows,
MAX(CASE WHEN id=3 THEN balance END)=989 AS waiter_ran_once,
MAX(CASE WHEN id=11 THEN pad END)='account-11-after-nonce'
         AS continued_owner_dml_committed
FROM xfer2_w01_accounts;
final_row_count	final_balance_exactly_once	final_versions_exactly_once	exact_committed_rows	waiter_ran_once	continued_owner_dml_committed
1	1	1	1	1	1
SELECT COUNT(*)=1 AND SUM(account_id=3)=1 AS one_audit_committed
FROM xfer2_w01_audit;
one_audit_committed
1
CHECK TABLE xfer2_w01_accounts,xfer2_w01_audit;
Table	Op	Msg_type	Msg_text
test.xfer2_w01_accounts	check	status	OK
test.xfer2_w01_audit	check	status	OK
SELECT COUNT(*)=32 AS thirty_two_accounts,
SUM(balance)=32001 AS committed_background_balance,
SUM(version)=1 AS one_committed_background_version,
MAX(CASE WHEN id=32 THEN balance END)=1001 AS background_update_visible,
MAX(CASE WHEN id=3 THEN version END)=0 AS owner_updates_hidden
FROM xfer2_w01_accounts;
thirty_two_accounts	committed_background_balance	one_committed_background_version	background_update_visible	owner_updates_hidden
1	1	1	1	1
SELECT COUNT(*)=0 AS no_committed_audit FROM xfer2_w01_audit;
no_committed_audit
1
source_ha_control_session
1
SELECT COUNT(*)=32 AS thirty_two_accounts,
SUM(balance)=32001 AS committed_background_balance,
SUM(version)=1 AS one_committed_background_version,
MAX(CASE WHEN id=32 THEN balance END)=1001 AS background_update_visible,
MAX(CASE WHEN id=3 THEN version END)=0 AS owner_updates_hidden
FROM xfer2_w01_accounts;
thirty_two_accounts	committed_background_balance	one_committed_background_version	background_update_visible	owner_updates_hidden
1	1	1	1	1
SELECT COUNT(*)=0 AS no_committed_audit FROM xfer2_w01_audit;
no_committed_audit
1
DROP TABLE xfer2_w01_audit;
DROP TABLE xfer2_w01_accounts;
DROP USER xfer2_w01_app@localhost;
DROP USER preserve_trx_ha_admin@localhost;
DROP USER preserve_trx_ha_admin@localhost;
SELECT (SELECT VARIABLE_VALUE+0 FROM performance_schema.global_status
WHERE VARIABLE_NAME='Preserve_trx_transfer_receiver_active_epochs')=0
AS no_receiver_epoch_after_restart,
(SELECT VARIABLE_VALUE+0 FROM performance_schema.global_status
WHERE VARIABLE_NAME='Preserve_trx_transfer_receiver_inflight_tokens')=0
AS no_inflight_token_after_restart,
(SELECT VARIABLE_VALUE+0 FROM performance_schema.global_status
WHERE VARIABLE_NAME='Preserve_trx_transfer_receiver_inflight_bytes')=0
AS no_inflight_byte_after_restart,
(SELECT VARIABLE_VALUE+0 FROM performance_schema.global_status
WHERE VARIABLE_NAME=
'Preserve_trx_transfer_receiver_staged_memory_bytes')=0
AS no_staged_memory_after_restart,
(SELECT VARIABLE_VALUE+0 FROM performance_schema.global_status
WHERE VARIABLE_NAME='Preserve_trx_promotion_prepared_registered_tokens')=0
AS no_prepared_entry_after_restart,
(SELECT VARIABLE_VALUE+0 FROM performance_schema.global_status
WHERE VARIABLE_NAME=
'Preserve_trx_promotion_prepared_prewarm_pending_tokens')=0
AS no_prewarm_pending_after_restart,
(SELECT VARIABLE_VALUE+0 FROM performance_schema.global_status
WHERE VARIABLE_NAME='Preserve_trx_promotion_prepared_ready_tokens')=0
AS no_prepared_ready_after_restart,
(SELECT VARIABLE_VALUE+0 FROM performance_schema.global_status
WHERE VARIABLE_NAME='Preserve_trx_promotion_ready_cache_bytes')=0
AS no_ready_cache_after_restart,
(SELECT VARIABLE_VALUE+0 FROM performance_schema.global_status
WHERE VARIABLE_NAME='Preserve_trx_memory_current_bytes')=0
AS no_preserve_memory_after_restart,
(SELECT VARIABLE_VALUE+0 FROM performance_schema.global_status
WHERE VARIABLE_NAME='Preserve_trx_transfer_receiver_worker_active')=0
AS no_active_worker_after_restart,
(SELECT VARIABLE_VALUE+0 FROM performance_schema.global_status
WHERE VARIABLE_NAME='Preserve_trx_transfer_receiver_queued_bytes')=0
AS no_queued_byte_after_restart;
no_receiver_epoch_after_restart	no_inflight_token_after_restart	no_inflight_byte_after_restart	no_staged_memory_after_restart	no_prepared_entry_after_restart	no_prewarm_pending_after_restart	no_prepared_ready_after_restart	no_ready_cache_after_restart	no_preserve_memory_after_restart	no_active_worker_after_restart	no_queued_byte_after_restart
1	1	1	1	1	1	1	1	1	1	1
