CALL mtr.add_suppression(
"PRESERVE: rolled back prepared transaction without snapshot during recovery");
CREATE TABLE xfer2_w01_accounts(
id INT PRIMARY KEY,
balance INT NOT NULL,
version INT NOT NULL DEFAULT 0,
pad VARCHAR(64) NOT NULL
) ENGINE=InnoDB;
CREATE TABLE xfer2_w01_audit(
id BIGINT AUTO_INCREMENT PRIMARY KEY,
account_id INT NOT NULL,
delta INT NOT NULL,
KEY(account_id)
) ENGINE=InnoDB;
INSERT INTO xfer2_w01_accounts
WITH RECURSIVE seq(n) AS (
SELECT 1 UNION ALL SELECT n+1 FROM seq WHERE n<32
)
SELECT n, 1000, 0, CONCAT('account-', n) FROM seq;
SET GLOBAL rds_preserve_trx_transfer_prewarm_paused=ON;
DROP TABLE IF EXISTS xfer2_x706_receiver_native;
CREATE TABLE xfer2_x706_receiver_native(
id INT PRIMARY KEY,
v INT NOT NULL,
KEY(v)
) ENGINE=InnoDB;
INSERT INTO xfer2_x706_receiver_native VALUES(1,10),(2,20);
SET @online_before=(SELECT VARIABLE_VALUE+0
FROM performance_schema.global_status WHERE VARIABLE_NAME=
'Preserve_trx_transfer_receiver_online_epochs');
SET @active_before=(SELECT VARIABLE_VALUE+0
FROM performance_schema.global_status WHERE VARIABLE_NAME=
'Preserve_trx_transfer_receiver_active_epochs');
SET @admitted_before=(SELECT VARIABLE_VALUE+0
FROM performance_schema.global_status WHERE VARIABLE_NAME=
'Preserve_trx_transfer_receiver_admitted_frames');
SET @admitted_bytes_before=(SELECT VARIABLE_VALUE+0
FROM performance_schema.global_status WHERE VARIABLE_NAME=
'Preserve_trx_transfer_receiver_admitted_bytes');
SET @sequence_replays_before=(SELECT VARIABLE_VALUE+0
FROM performance_schema.global_status WHERE VARIABLE_NAME=
'Preserve_trx_transfer_receiver_sequence_already_applied');
SET @inflight_tokens_before=(SELECT VARIABLE_VALUE+0
FROM performance_schema.global_status WHERE VARIABLE_NAME=
'Preserve_trx_transfer_receiver_inflight_tokens');
SET @inflight_bytes_before=(SELECT VARIABLE_VALUE+0
FROM performance_schema.global_status WHERE VARIABLE_NAME=
'Preserve_trx_transfer_receiver_inflight_bytes');
SET @staged_before=(SELECT VARIABLE_VALUE+0
FROM performance_schema.global_status WHERE VARIABLE_NAME=
'Preserve_trx_transfer_receiver_staged_memory_bytes');
SET @terminal_before=(SELECT VARIABLE_VALUE+0
FROM performance_schema.global_status WHERE VARIABLE_NAME=
'Preserve_trx_transfer_receiver_terminal_cas_wins');
SET @tombstones_before=(SELECT VARIABLE_VALUE+0
FROM performance_schema.global_status WHERE VARIABLE_NAME=
'Preserve_trx_transfer_receiver_terminal_status_tombstones');
SET @cleanup_debt_tokens_before=(SELECT VARIABLE_VALUE+0
FROM performance_schema.global_status WHERE VARIABLE_NAME=
'Preserve_trx_transfer_receiver_cleanup_debt_tokens');
SET @cleanup_debt_bytes_before=(SELECT VARIABLE_VALUE+0
FROM performance_schema.global_status WHERE VARIABLE_NAME=
'Preserve_trx_transfer_receiver_cleanup_debt_bytes');
SET @prepared_before=(SELECT VARIABLE_VALUE+0
FROM performance_schema.global_status WHERE VARIABLE_NAME=
'Preserve_trx_promotion_prepared_registered_tokens');
SET @ready_before=(SELECT VARIABLE_VALUE+0
FROM performance_schema.global_status WHERE VARIABLE_NAME=
'Preserve_trx_promotion_prepared_ready_tokens');
SET @ready_cache_before=(SELECT VARIABLE_VALUE+0
FROM performance_schema.global_status WHERE VARIABLE_NAME=
'Preserve_trx_promotion_ready_cache_bytes');
SET @memory_before=(SELECT VARIABLE_VALUE+0
FROM performance_schema.global_status WHERE VARIABLE_NAME=
'Preserve_trx_memory_current_bytes');
SET @reset_wins_before=(SELECT VARIABLE_VALUE+0
FROM performance_schema.global_status WHERE VARIABLE_NAME=
'Preserve_trx_reset_drain_wins');
SET @reset_too_late_before=(SELECT VARIABLE_VALUE+0
FROM performance_schema.global_status WHERE VARIABLE_NAME=
'Preserve_trx_reset_drain_too_late');
SET @handoff_before=(SELECT VARIABLE_VALUE+0
FROM performance_schema.global_status WHERE VARIABLE_NAME=
'Preserve_trx_transfer_source_handoff_pending_epochs');
SET @unknown_before=(SELECT VARIABLE_VALUE+0
FROM performance_schema.global_status WHERE VARIABLE_NAME=
'Preserve_trx_transfer_source_commit_unknown_epochs');
SET @quarantine_epochs_before=(SELECT VARIABLE_VALUE+0
FROM performance_schema.global_status WHERE VARIABLE_NAME=
'Preserve_trx_transfer_quarantine_epochs');
SET @quarantine_tokens_before=(SELECT VARIABLE_VALUE+0
FROM performance_schema.global_status WHERE VARIABLE_NAME=
'Preserve_trx_transfer_quarantine_tokens');
SET @preserved_before=(SELECT COUNT(*)
FROM performance_schema.preserved_transactions);
SET SESSION TRANSACTION ISOLATION LEVEL REPEATABLE READ;
START TRANSACTION;
SELECT balance=1000 AND version=0 AS owner_rr_initial
FROM xfer2_w01_accounts WHERE id=32;
owner_rr_initial
1
UPDATE xfer2_w01_accounts
SET balance=balance+1,version=version+1 WHERE id=32;
SELECT ROW_COUNT()=1 AS outsider_committed_once;
outsider_committed_once
1
SELECT balance=1000 AND version=0 AS owner_rr_stays_old
FROM xfer2_w01_accounts WHERE id=32;
owner_rr_stays_old
1
UPDATE xfer2_w01_accounts
SET balance=balance-70,version=version+1 WHERE id=11;
UPDATE xfer2_w01_accounts
SET balance=balance+70,version=version+1 WHERE id=12;
INSERT INTO xfer2_w01_audit(account_id,delta)
VALUES(11,-70),(12,70);
SELECT COUNT(*)=2 AND SUM(balance)=2000 AND SUM(version)=2
AS owner_w04_balance_conserved
FROM xfer2_w01_accounts WHERE id IN (11,12);
owner_w04_balance_conserved
1
SELECT MAX(CASE WHEN id=11 THEN balance END)=930
AND MAX(CASE WHEN id=12 THEN balance END)=1070
AS owner_w04_exact_effects
FROM xfer2_w01_accounts WHERE id IN (11,12);
owner_w04_exact_effects
1
SELECT COUNT(*)=2 AND SUM(delta)=0
AND SUM(account_id=11 AND delta=-70)=1
AND SUM(account_id=12 AND delta=70)=1
AS owner_w04_balanced_ledger
FROM xfer2_w01_audit;
owner_w04_balanced_ledger
1
SELECT COUNT(*)=32 AND SUM(balance)=32001 AND SUM(version)=1
AS outsider_hides_owner_changes
FROM xfer2_w01_accounts;
outsider_hides_owner_changes
1
SELECT COUNT(*)=0 AS outsider_hides_owner_ledger
FROM xfer2_w01_audit;
outsider_hides_owner_ledger
1
SET DEBUG_SYNC=
'preserve_trx_transfer_after_phase1_binlog_stream SIGNAL xfer2_x706_phase1 WAIT_FOR xfer2_x706_release';
DRAIN TRANSACTIONS PRESERVE;
SET DEBUG_SYNC='now WAIT_FOR xfer2_x706_phase1 TIMEOUT 60';
SET @admitted_at_pause=(SELECT VARIABLE_VALUE+0
FROM performance_schema.global_status WHERE VARIABLE_NAME=
'Preserve_trx_transfer_receiver_admitted_frames');
SELECT (SELECT VARIABLE_VALUE+0 FROM performance_schema.global_status
WHERE VARIABLE_NAME='Preserve_trx_transfer_receiver_online_epochs')
=@online_before+1 AS one_live_phase1_epoch,
@admitted_at_pause>@admitted_before AS phase1_frames_admitted,
(SELECT VARIABLE_VALUE+0 FROM performance_schema.global_status
WHERE VARIABLE_NAME='Preserve_trx_transfer_receiver_admitted_bytes')
>@admitted_bytes_before AS phase1_bytes_admitted;
one_live_phase1_epoch	phase1_frames_admitted	phase1_bytes_admitted
1	1	1
SELECT (SELECT VARIABLE_VALUE+0 FROM performance_schema.global_status
WHERE VARIABLE_NAME='Preserve_trx_transfer_receiver_inflight_tokens')
>@inflight_tokens_before AS phase1_token_accounted,
(SELECT VARIABLE_VALUE+0 FROM performance_schema.global_status
WHERE VARIABLE_NAME='Preserve_trx_transfer_receiver_inflight_bytes')
>@inflight_bytes_before AS phase1_bytes_accounted,
(SELECT VARIABLE_VALUE+0 FROM performance_schema.global_status
WHERE VARIABLE_NAME='Preserve_trx_transfer_receiver_active_epochs')
=@active_before AS no_terminal_epoch_before_reset;
phase1_token_accounted	phase1_bytes_accounted	no_terminal_epoch_before_reset
1	1	1
SET SESSION innodb_lock_wait_timeout=3600;
START TRANSACTION;
UPDATE xfer2_w01_accounts SET balance=balance+5,version=version+1 WHERE id=11;
SELECT COUNT(*)=1 AS waiter_blocked_before_concurrent_reset FROM performance_schema.data_lock_waits w JOIN performance_schema.threads t ON t.THREAD_ID=w.REQUESTING_THREAD_ID WHERE t.PROCESSLIST_ID=WAITER_ID;
waiter_blocked_before_concurrent_reset
1
START TRANSACTION;
UPDATE xfer2_x706_receiver_native SET v=v+id;
INSERT INTO xfer2_x706_receiver_native VALUES(3,30);
COMMIT;
SELECT COUNT(*)=3 AND SUM(v)=63 AS receiver_native_commit_during_phase1
FROM xfer2_x706_receiver_native;
receiver_native_commit_during_phase1
1
START TRANSACTION;
SAVEPOINT x706_reset_session_guard;
RESET DRAIN;
RESET DRAIN;
SET DEBUG_SYNC='now SIGNAL xfer2_x706_release';
ROLLBACK TO SAVEPOINT x706_reset_session_guard;
ROLLBACK;
ERROR HY000: DRAIN TRANSACTIONS PRESERVE was reset before ownership became irreversible
SET DEBUG_SYNC='RESET';
SELECT (SELECT VARIABLE_VALUE+0 FROM performance_schema.global_status
WHERE VARIABLE_NAME='Preserve_trx_reset_drain_wins')
=@reset_wins_before+1 AS exactly_one_reset_winner,
(SELECT VARIABLE_VALUE+0 FROM performance_schema.global_status
WHERE VARIABLE_NAME='Preserve_trx_reset_drain_too_late')
=@reset_too_late_before AS neither_reset_too_late;
exactly_one_reset_winner	neither_reset_too_late
1	1
SELECT (SELECT VARIABLE_VALUE+0 FROM performance_schema.global_status
WHERE VARIABLE_NAME='Preserve_trx_transfer_source_handoff_pending_epochs')
=@handoff_before AS no_handoff_pending,
(SELECT VARIABLE_VALUE+0 FROM performance_schema.global_status
WHERE VARIABLE_NAME='Preserve_trx_transfer_source_commit_unknown_epochs')
=@unknown_before AS no_commit_unknown,
(SELECT VARIABLE_VALUE+0 FROM performance_schema.global_status
WHERE VARIABLE_NAME='Preserve_trx_transfer_quarantine_epochs')
=@quarantine_epochs_before AS no_quarantine_epoch,
(SELECT VARIABLE_VALUE+0 FROM performance_schema.global_status
WHERE VARIABLE_NAME='Preserve_trx_transfer_quarantine_tokens')
=@quarantine_tokens_before AS no_quarantine_token;
no_handoff_pending	no_commit_unknown	no_quarantine_epoch	no_quarantine_token
1	1	1	1
SELECT COUNT(*)=@preserved_before AS no_detached_source_token
FROM performance_schema.preserved_transactions;
no_detached_source_token
1
SELECT (SELECT VARIABLE_VALUE+0 FROM performance_schema.global_status
WHERE VARIABLE_NAME='Preserve_trx_transfer_receiver_admitted_frames')
>@admitted_at_pause AS reset_cleanup_tail_admitted,
(SELECT VARIABLE_VALUE+0 FROM performance_schema.global_status
WHERE VARIABLE_NAME=
'Preserve_trx_transfer_receiver_sequence_already_applied')
=@sequence_replays_before AS no_duplicate_sequence_replay,
(SELECT VARIABLE_VALUE+0 FROM performance_schema.global_status
WHERE VARIABLE_NAME='Preserve_trx_transfer_receiver_terminal_cas_wins')
=@terminal_before AS no_terminal_cas,
(SELECT VARIABLE_VALUE+0 FROM performance_schema.global_status
WHERE VARIABLE_NAME='Preserve_trx_transfer_receiver_terminal_status_tombstones')
=@tombstones_before AS no_terminal_tombstone;
reset_cleanup_tail_admitted	no_duplicate_sequence_replay	no_terminal_cas	no_terminal_tombstone
1	1	1	1
SELECT (SELECT VARIABLE_VALUE+0 FROM performance_schema.global_status
WHERE VARIABLE_NAME='Preserve_trx_transfer_receiver_inflight_tokens')
=@inflight_tokens_before AS token_accounting_released,
(SELECT VARIABLE_VALUE+0 FROM performance_schema.global_status
WHERE VARIABLE_NAME='Preserve_trx_transfer_receiver_inflight_bytes')
=@inflight_bytes_before AS byte_accounting_released,
(SELECT VARIABLE_VALUE+0 FROM performance_schema.global_status
WHERE VARIABLE_NAME='Preserve_trx_transfer_receiver_staged_memory_bytes')
=@staged_before AS staged_payload_released,
(SELECT VARIABLE_VALUE+0 FROM performance_schema.global_status
WHERE VARIABLE_NAME='Preserve_trx_memory_current_bytes')
=@memory_before AS preserve_memory_released;
token_accounting_released	byte_accounting_released	staged_payload_released	preserve_memory_released
1	1	1	1
SELECT (SELECT VARIABLE_VALUE+0 FROM performance_schema.global_status
WHERE VARIABLE_NAME='Preserve_trx_promotion_prepared_registered_tokens')
=@prepared_before AS no_prepared_registration,
(SELECT VARIABLE_VALUE+0 FROM performance_schema.global_status
WHERE VARIABLE_NAME='Preserve_trx_promotion_prepared_ready_tokens')
=@ready_before AS no_ready_token,
(SELECT VARIABLE_VALUE+0 FROM performance_schema.global_status
WHERE VARIABLE_NAME='Preserve_trx_promotion_ready_cache_bytes')
=@ready_cache_before AS no_ready_cache;
no_prepared_registration	no_ready_token	no_ready_cache
1	1	1
SELECT (SELECT VARIABLE_VALUE+0 FROM performance_schema.global_status
WHERE VARIABLE_NAME='Preserve_trx_transfer_receiver_cleanup_debt_tokens')
=@cleanup_debt_tokens_before AS no_cleanup_debt_token,
(SELECT VARIABLE_VALUE+0 FROM performance_schema.global_status
WHERE VARIABLE_NAME='Preserve_trx_transfer_receiver_cleanup_debt_bytes')
=@cleanup_debt_bytes_before AS no_cleanup_debt_bytes;
no_cleanup_debt_token	no_cleanup_debt_bytes
1	1
SET GLOBAL rds_preserve_trx_transfer_prewarm_paused=OFF;
SELECT VARIABLE_VALUE=0 AS no_active_receiver_worker
FROM performance_schema.global_status
WHERE VARIABLE_NAME='Preserve_trx_transfer_receiver_worker_active';
no_active_receiver_worker
1
SELECT VARIABLE_VALUE=0 AS no_receiver_queue
FROM performance_schema.global_status
WHERE VARIABLE_NAME='Preserve_trx_transfer_receiver_queued_bytes';
no_receiver_queue
1
SELECT COUNT(*)=3 AND SUM(v)=63 AS receiver_native_commit_survives_reset
FROM xfer2_x706_receiver_native;
receiver_native_commit_survives_reset
1
SELECT CONNECTION_ID()=OWNER_ID AS original_owner_connection_restored;
original_owner_connection_restored
1
SELECT balance=1000 AND version=0 AS owner_rr_view_restored
FROM xfer2_w01_accounts WHERE id=32;
owner_rr_view_restored
1
SELECT COUNT(*)=2 AND SUM(balance)=2000 AND SUM(version)=2
AS owner_w04_changes_restored
FROM xfer2_w01_accounts WHERE id IN (11,12);
owner_w04_changes_restored
1
SELECT COUNT(*)=2 AND SUM(delta)=0 AS owner_ledger_restored
FROM xfer2_w01_audit;
owner_ledger_restored
1
UPDATE xfer2_w01_accounts
SET pad=CONCAT(pad,'-after-x706-reset') WHERE id=12;
SELECT ROW_COUNT()=1 AS owner_can_continue_after_joined_reset;
owner_can_continue_after_joined_reset
1
SELECT COUNT(*)=1 AS waiter_still_blocked_after_both_resets FROM performance_schema.data_lock_waits w JOIN performance_schema.threads t ON t.THREAD_ID=w.REQUESTING_THREAD_ID WHERE t.PROCESSLIST_ID=WAITER_ID;
waiter_still_blocked_after_both_resets
1
ROLLBACK;
ROLLBACK;
SELECT COUNT(*)=32 AS thirty_two_accounts,
SUM(balance)=32001 AS committed_background_balance,
SUM(version)=1 AS one_committed_background_version,
MAX(CASE WHEN id=32 THEN balance END)=1001 AS background_update_visible,
MAX(CASE WHEN id=3 THEN version END)=0 AS owner_updates_hidden
FROM xfer2_w01_accounts;
thirty_two_accounts	committed_background_balance	one_committed_background_version	background_update_visible	owner_updates_hidden
1	1	1	1	1
SELECT COUNT(*)=0 AS no_committed_audit FROM xfer2_w01_audit;
no_committed_audit
1
CHECK TABLE xfer2_w01_accounts,xfer2_w01_audit;
Table	Op	Msg_type	Msg_text
test.xfer2_w01_accounts	check	status	OK
test.xfer2_w01_audit	check	status	OK
SELECT COUNT(*)=3 AND SUM(v)=63 AS receiver_native_final
FROM xfer2_x706_receiver_native;
receiver_native_final
1
DROP TABLE xfer2_x706_receiver_native;
source_ha_control_session
1
SELECT COUNT(*)=32 AS thirty_two_accounts,
SUM(balance)=32001 AS committed_background_balance,
SUM(version)=1 AS one_committed_background_version,
MAX(CASE WHEN id=32 THEN balance END)=1001 AS background_update_visible,
MAX(CASE WHEN id=3 THEN version END)=0 AS owner_updates_hidden
FROM xfer2_w01_accounts;
thirty_two_accounts	committed_background_balance	one_committed_background_version	background_update_visible	owner_updates_hidden
1	1	1	1	1
SELECT COUNT(*)=0 AS no_committed_audit FROM xfer2_w01_audit;
no_committed_audit
1
DROP TABLE xfer2_w01_audit;
DROP TABLE xfer2_w01_accounts;
DROP USER xfer2_w01_app@localhost;
DROP USER preserve_trx_ha_admin@localhost;
DROP USER preserve_trx_ha_admin@localhost;
SELECT (SELECT VARIABLE_VALUE+0 FROM performance_schema.global_status
WHERE VARIABLE_NAME='Preserve_trx_transfer_receiver_active_epochs')=0
AS no_receiver_epoch_after_restart,
(SELECT VARIABLE_VALUE+0 FROM performance_schema.global_status
WHERE VARIABLE_NAME='Preserve_trx_transfer_receiver_inflight_tokens')=0
AS no_inflight_token_after_restart,
(SELECT VARIABLE_VALUE+0 FROM performance_schema.global_status
WHERE VARIABLE_NAME='Preserve_trx_transfer_receiver_inflight_bytes')=0
AS no_inflight_byte_after_restart,
(SELECT VARIABLE_VALUE+0 FROM performance_schema.global_status
WHERE VARIABLE_NAME=
'Preserve_trx_transfer_receiver_staged_memory_bytes')=0
AS no_staged_memory_after_restart,
(SELECT VARIABLE_VALUE+0 FROM performance_schema.global_status
WHERE VARIABLE_NAME='Preserve_trx_promotion_prepared_registered_tokens')=0
AS no_prepared_entry_after_restart,
(SELECT VARIABLE_VALUE+0 FROM performance_schema.global_status
WHERE VARIABLE_NAME=
'Preserve_trx_promotion_prepared_prewarm_pending_tokens')=0
AS no_prewarm_pending_after_restart,
(SELECT VARIABLE_VALUE+0 FROM performance_schema.global_status
WHERE VARIABLE_NAME='Preserve_trx_promotion_prepared_ready_tokens')=0
AS no_prepared_ready_after_restart,
(SELECT VARIABLE_VALUE+0 FROM performance_schema.global_status
WHERE VARIABLE_NAME='Preserve_trx_promotion_ready_cache_bytes')=0
AS no_ready_cache_after_restart,
(SELECT VARIABLE_VALUE+0 FROM performance_schema.global_status
WHERE VARIABLE_NAME='Preserve_trx_memory_current_bytes')=0
AS no_preserve_memory_after_restart,
(SELECT VARIABLE_VALUE+0 FROM performance_schema.global_status
WHERE VARIABLE_NAME='Preserve_trx_transfer_receiver_worker_active')=0
AS no_active_worker_after_restart,
(SELECT VARIABLE_VALUE+0 FROM performance_schema.global_status
WHERE VARIABLE_NAME='Preserve_trx_transfer_receiver_queued_bytes')=0
AS no_queued_byte_after_restart;
no_receiver_epoch_after_restart	no_inflight_token_after_restart	no_inflight_byte_after_restart	no_staged_memory_after_restart	no_prepared_entry_after_restart	no_prewarm_pending_after_restart	no_prepared_ready_after_restart	no_ready_cache_after_restart	no_preserve_memory_after_restart	no_active_worker_after_restart	no_queued_byte_after_restart
1	1	1	1	1	1	1	1	1	1	1
