CALL mtr.add_suppression(
"PRESERVE: rolled back prepared transaction without snapshot during recovery");
SET GLOBAL rds_preserve_trx_enable=ON;
SET GLOBAL rds_preserve_trx_transfer_prewarm_paused=OFF;
SET GLOBAL rds_preserve_trx_token_retention_timeout_ms=120000;
CREATE TABLE xfer1_read_view_ready_accounts(
id INT PRIMARY KEY,
balance INT NOT NULL,
version INT NOT NULL DEFAULT 0,
pad VARCHAR(64) NOT NULL
) ENGINE=InnoDB;
CREATE TABLE xfer1_read_view_ready_audit(
id BIGINT AUTO_INCREMENT PRIMARY KEY,
account_id INT NOT NULL,
delta INT NOT NULL,
KEY(account_id)
) ENGINE=InnoDB;
INSERT INTO xfer1_read_view_ready_accounts
WITH RECURSIVE seq(n) AS (
SELECT 1 UNION ALL SELECT n+1 FROM seq WHERE n<32
)
SELECT n, 1000, 0, CONCAT('ready-account-', n) FROM seq;
SET @active_epochs_before=(
SELECT VARIABLE_VALUE+0 FROM performance_schema.global_status
WHERE VARIABLE_NAME='Preserve_trx_transfer_receiver_active_epochs');
SET @classified_before=(
SELECT VARIABLE_VALUE+0 FROM performance_schema.global_status
WHERE VARIABLE_NAME='Preserve_trx_transfer_receiver_auto_prewarm_tokens');
SET @ready_before=(
SELECT VARIABLE_VALUE+0 FROM performance_schema.global_status
WHERE VARIABLE_NAME=
'Preserve_trx_transfer_receiver_auto_prewarm_ready_tokens');
SET @not_ready_before=(
SELECT VARIABLE_VALUE+0 FROM performance_schema.global_status
WHERE VARIABLE_NAME=
'Preserve_trx_transfer_receiver_auto_prewarm_not_ready_tokens');
SET @bind_attempts_before=(
SELECT VARIABLE_VALUE+0 FROM performance_schema.global_status
WHERE VARIABLE_NAME=
'Preserve_trx_transfer_receiver_epoch_ready_bind_attempts');
SET @prepared_ready_before=(
SELECT VARIABLE_VALUE+0 FROM performance_schema.global_status
WHERE VARIABLE_NAME='Preserve_trx_promotion_prepared_ready_tokens');
SET @semantic_bundle_bytes_before=(
SELECT VARIABLE_VALUE+0 FROM performance_schema.global_status
WHERE VARIABLE_NAME='Preserve_trx_promotion_semantic_bundle_bytes');
SET @horizon_rejects_before=(
SELECT VARIABLE_VALUE+0 FROM performance_schema.global_status
WHERE VARIABLE_NAME=
'Preserve_trx_transfer_receiver_read_view_horizon_rejects');
SET SESSION TRANSACTION ISOLATION LEVEL REPEATABLE READ;
START TRANSACTION;
SELECT balance=1000 AND version=0 AS rr_initial_version
FROM xfer1_read_view_ready_accounts WHERE id=31;
rr_initial_version
1
UPDATE xfer1_read_view_ready_accounts
SET balance=balance+2, version=version+1 WHERE id=31;
SELECT balance=1000 AND version=0 AS rr_keeps_initial_version
FROM xfer1_read_view_ready_accounts WHERE id=31;
rr_keeps_initial_version
1
UPDATE xfer1_read_view_ready_accounts
SET balance=balance-13, version=version+1 WHERE id=9;
SELECT ROW_COUNT()=1 AS debit_applied;
debit_applied
1
UPDATE xfer1_read_view_ready_accounts
SET balance=balance+8, version=version+1 WHERE id=10;
SELECT ROW_COUNT()=1 AS first_credit_applied;
first_credit_applied
1
UPDATE xfer1_read_view_ready_accounts
SET balance=balance+5, version=version+1 WHERE id=10;
SELECT ROW_COUNT()=1 AS second_credit_applied;
second_credit_applied
1
INSERT INTO xfer1_read_view_ready_audit(account_id, delta)
VALUES(9, -13), (10, 13);
SELECT balance=987 AND version=1 AS owner_sees_debit
FROM xfer1_read_view_ready_accounts WHERE id=9;
owner_sees_debit
1
SELECT balance=1013 AND version=2 AS owner_sees_both_credits
FROM xfer1_read_view_ready_accounts WHERE id=10;
owner_sees_both_credits
1
SELECT COUNT(*)=32 AS thirty_two_accounts,
SUM(balance)=32002 AS only_outsider_change_committed,
SUM(version)=1 AS only_outsider_version_committed,
MAX(CASE WHEN id=9 THEN version END)=0 AS debit_hidden,
MAX(CASE WHEN id=10 THEN version END)=0 AS credits_hidden
FROM xfer1_read_view_ready_accounts;
thirty_two_accounts	only_outsider_change_committed	only_outsider_version_committed	debit_hidden	credits_hidden
1	1	1	1	1
SELECT COUNT(*)=0 AS owner_audit_hidden
FROM xfer1_read_view_ready_audit;
owner_audit_hidden
1
DRAIN TRANSACTIONS PRESERVE;
generation	outcome	source_connection_id	token_role	reason	closing_started_us	closing_deadline_us
GENERATION	SUCCESS	SOURCE_ID	SURVIVOR	NONE	CLOSING_STARTED_US	CLOSING_DEADLINE_US
SELECT (SELECT VARIABLE_VALUE+0 FROM performance_schema.global_status
WHERE VARIABLE_NAME='Preserve_trx_transfer_receiver_active_epochs')
= @active_epochs_before+1 AS one_ready_epoch,
(SELECT VARIABLE_VALUE+0 FROM performance_schema.global_status
WHERE VARIABLE_NAME='Preserve_trx_transfer_receiver_auto_prewarm_tokens')
= @classified_before+1 AS one_classified_token,
(SELECT VARIABLE_VALUE+0 FROM performance_schema.global_status
WHERE VARIABLE_NAME=
'Preserve_trx_transfer_receiver_auto_prewarm_ready_tokens')
= @ready_before+1 AS one_ready_token,
(SELECT VARIABLE_VALUE+0 FROM performance_schema.global_status
WHERE VARIABLE_NAME=
'Preserve_trx_transfer_receiver_auto_prewarm_not_ready_tokens')
= @not_ready_before AS no_not_ready_token;
one_ready_epoch	one_classified_token	one_ready_token	no_not_ready_token
1	1	1	1
SELECT (SELECT VARIABLE_VALUE+0 FROM performance_schema.global_status
WHERE VARIABLE_NAME=
'Preserve_trx_transfer_receiver_epoch_ready_bind_attempts')
= @bind_attempts_before+1 AS final_fact_bound_once,
(SELECT VARIABLE_VALUE+0 FROM performance_schema.global_status
WHERE VARIABLE_NAME='Preserve_trx_promotion_prepared_ready_tokens')
= @prepared_ready_before+1 AS one_prepared_ready_token,
(SELECT VARIABLE_VALUE+0 FROM performance_schema.global_status
WHERE VARIABLE_NAME='Preserve_trx_promotion_semantic_bundle_bytes')
> @semantic_bundle_bytes_before AS semantic_bundle_is_budgeted,
(SELECT VARIABLE_VALUE+0 FROM performance_schema.global_status
WHERE VARIABLE_NAME=
'Preserve_trx_transfer_receiver_read_view_horizon_rejects')
= @horizon_rejects_before AS no_horizon_rejection,
(SELECT VARIABLE_VALUE+0 FROM performance_schema.global_status
WHERE VARIABLE_NAME='Preserve_trx_transfer_receiver_worker_active')
= 0 AS no_active_worker,
(SELECT VARIABLE_VALUE+0 FROM performance_schema.global_status
WHERE VARIABLE_NAME='Preserve_trx_transfer_receiver_queued_bytes')
= 0 AS no_queued_bytes;
final_fact_bound_once	one_prepared_ready_token	semantic_bundle_is_budgeted	no_horizon_rejection	no_active_worker	no_queued_bytes
1	1	1	1	1	1
SELECT 1;
ERROR HY000: Preserve drain is active; this command was not executed
SHUTDOWN;
SELECT (SELECT VARIABLE_VALUE+0 FROM performance_schema.global_status
WHERE VARIABLE_NAME='Preserve_trx_transfer_receiver_active_epochs')=0
AS no_receiver_epoch_after_restart,
(SELECT VARIABLE_VALUE+0 FROM performance_schema.global_status
WHERE VARIABLE_NAME='Preserve_trx_transfer_receiver_inflight_tokens')=0
AS no_inflight_token_after_restart,
(SELECT VARIABLE_VALUE+0 FROM performance_schema.global_status
WHERE VARIABLE_NAME='Preserve_trx_transfer_receiver_inflight_bytes')=0
AS no_inflight_byte_after_restart,
(SELECT VARIABLE_VALUE+0 FROM performance_schema.global_status
WHERE VARIABLE_NAME=
'Preserve_trx_transfer_receiver_staged_memory_bytes')=0
AS no_staged_memory_after_restart,
(SELECT VARIABLE_VALUE+0 FROM performance_schema.global_status
WHERE VARIABLE_NAME='Preserve_trx_promotion_prepared_registered_tokens')=0
AS no_prepared_entry_after_restart,
(SELECT VARIABLE_VALUE+0 FROM performance_schema.global_status
WHERE VARIABLE_NAME=
'Preserve_trx_promotion_prepared_prewarm_pending_tokens')=0
AS no_prewarm_pending_after_restart,
(SELECT VARIABLE_VALUE+0 FROM performance_schema.global_status
WHERE VARIABLE_NAME='Preserve_trx_promotion_prepared_ready_tokens')=0
AS no_prepared_ready_after_restart,
(SELECT VARIABLE_VALUE+0 FROM performance_schema.global_status
WHERE VARIABLE_NAME='Preserve_trx_promotion_ready_cache_bytes')=0
AS no_ready_cache_after_restart,
(SELECT VARIABLE_VALUE+0 FROM performance_schema.global_status
WHERE VARIABLE_NAME='Preserve_trx_memory_current_bytes')=0
AS no_preserve_memory_after_restart,
(SELECT VARIABLE_VALUE+0 FROM performance_schema.global_status
WHERE VARIABLE_NAME='Preserve_trx_transfer_receiver_worker_active')=0
AS no_active_worker_after_restart,
(SELECT VARIABLE_VALUE+0 FROM performance_schema.global_status
WHERE VARIABLE_NAME='Preserve_trx_transfer_receiver_queued_bytes')=0
AS no_queued_byte_after_restart;
no_receiver_epoch_after_restart	no_inflight_token_after_restart	no_inflight_byte_after_restart	no_staged_memory_after_restart	no_prepared_entry_after_restart	no_prewarm_pending_after_restart	no_prepared_ready_after_restart	no_ready_cache_after_restart	no_preserve_memory_after_restart	no_active_worker_after_restart	no_queued_byte_after_restart
1	1	1	1	1	1	1	1	1	1	1
SELECT COUNT(*)=32 AS thirty_two_accounts,
SUM(balance)=32002 AS committed_background_balance,
SUM(version)=1 AS one_committed_background_version,
MAX(CASE WHEN id=9 THEN version END)=0 AS debit_rolled_back,
MAX(CASE WHEN id=10 THEN version END)=0 AS credits_rolled_back,
MAX(CASE WHEN id=31 THEN balance END)=1002 AS outsider_update_kept
FROM xfer1_read_view_ready_accounts;
thirty_two_accounts	committed_background_balance	one_committed_background_version	debit_rolled_back	credits_rolled_back	outsider_update_kept
1	1	1	1	1	1
SELECT COUNT(*)=0 AS owner_audit_rolled_back
FROM xfer1_read_view_ready_audit;
owner_audit_rolled_back
1
DROP TABLE xfer1_read_view_ready_audit;
DROP TABLE xfer1_read_view_ready_accounts;
DROP USER xfer1_read_view_ready_app@localhost;
DROP USER preserve_trx_ha_admin@'127.0.0.1';
