CALL mtr.add_suppression(
"PRESERVE: rolled back prepared transaction without snapshot during recovery");
CREATE TABLE xfer2_w01_accounts(
id INT PRIMARY KEY,
balance INT NOT NULL,
version INT NOT NULL DEFAULT 0,
pad VARCHAR(64) NOT NULL
) ENGINE=InnoDB;
CREATE TABLE xfer2_w01_audit(
id BIGINT AUTO_INCREMENT PRIMARY KEY,
account_id INT NOT NULL,
delta INT NOT NULL,
KEY(account_id)
) ENGINE=InnoDB;
INSERT INTO xfer2_w01_accounts
WITH RECURSIVE seq(n) AS (
SELECT 1 UNION ALL SELECT n+1 FROM seq WHERE n<32
)
SELECT n, 1000, 0, CONCAT('account-', n) FROM seq;
SET GLOBAL rds_preserve_trx_transfer_prewarm_paused=OFF;
SELECT @@GLOBAL.rds_preserve_trx_transfer_prewarm_paused=0
AS receiver_prewarm_explicitly_running;
receiver_prewarm_explicitly_running
1
SET @active_epochs_before=(
SELECT VARIABLE_VALUE+0 FROM performance_schema.global_status
WHERE VARIABLE_NAME='Preserve_trx_transfer_receiver_active_epochs');
SET @classified_before=(
SELECT VARIABLE_VALUE+0 FROM performance_schema.global_status
WHERE VARIABLE_NAME='Preserve_trx_transfer_receiver_auto_prewarm_tokens');
SET @ready_before=(
SELECT VARIABLE_VALUE+0 FROM performance_schema.global_status
WHERE VARIABLE_NAME=
'Preserve_trx_transfer_receiver_auto_prewarm_ready_tokens');
SET @not_ready_before=(
SELECT VARIABLE_VALUE+0 FROM performance_schema.global_status
WHERE VARIABLE_NAME=
'Preserve_trx_transfer_receiver_auto_prewarm_not_ready_tokens');
SET @bind_attempts_before=(
SELECT VARIABLE_VALUE+0 FROM performance_schema.global_status
WHERE VARIABLE_NAME=
'Preserve_trx_transfer_receiver_epoch_ready_bind_attempts');
SET @prepared_ready_before=(
SELECT VARIABLE_VALUE+0 FROM performance_schema.global_status
WHERE VARIABLE_NAME='Preserve_trx_promotion_prepared_ready_tokens');
SET @horizon_rejects_before=(
SELECT VARIABLE_VALUE+0 FROM performance_schema.global_status
WHERE VARIABLE_NAME=
'Preserve_trx_transfer_receiver_read_view_horizon_rejects');
SET @object_misses_before=(
SELECT VARIABLE_VALUE+0 FROM performance_schema.global_status
WHERE VARIABLE_NAME=
'Preserve_trx_transfer_receiver_object_prewarm_miss_count');
SET @record_prewarm_before=(
SELECT VARIABLE_VALUE+0 FROM performance_schema.global_status
WHERE VARIABLE_NAME=
'Preserve_trx_transfer_receiver_record_object_prewarm_count');
SET @strict_index_reads_before=(
SELECT VARIABLE_VALUE+0 FROM performance_schema.global_status
WHERE VARIABLE_NAME=
'Preserve_trx_transfer_receiver_strict_record_index_page_reads');
SET @strict_ibuf_merges_before=(
SELECT VARIABLE_VALUE+0 FROM performance_schema.global_status
WHERE VARIABLE_NAME='Preserve_trx_transfer_receiver_strict_ibuf_merges');
SET @strict_redo_bytes_before=(
SELECT VARIABLE_VALUE+0 FROM performance_schema.global_status
WHERE VARIABLE_NAME=
'Preserve_trx_transfer_receiver_strict_target_local_redo_bytes');
SET @record_req_residency_before=(
SELECT VARIABLE_VALUE+0 FROM performance_schema.global_status
WHERE VARIABLE_NAME=
'Preserve_trx_transfer_receiver_record_lock_req_residency_bytes');
SET @record_resv_residency_before=(
SELECT VARIABLE_VALUE+0 FROM performance_schema.global_status
WHERE VARIABLE_NAME=
'Preserve_trx_transfer_receiver_record_lock_resv_residency_bytes');
SET @inflight_tokens_before=(
SELECT VARIABLE_VALUE+0 FROM performance_schema.global_status
WHERE VARIABLE_NAME='Preserve_trx_transfer_receiver_inflight_tokens');
SET @inflight_bytes_before=(
SELECT VARIABLE_VALUE+0 FROM performance_schema.global_status
WHERE VARIABLE_NAME='Preserve_trx_transfer_receiver_inflight_bytes');
SET @staged_memory_before=(
SELECT VARIABLE_VALUE+0 FROM performance_schema.global_status
WHERE VARIABLE_NAME=
'Preserve_trx_transfer_receiver_staged_memory_bytes');
SET @failed_records_before=(
SELECT VARIABLE_VALUE+0 FROM performance_schema.global_status
WHERE VARIABLE_NAME='Preserve_trx_transfer_receiver_failed_tokens');
SET @prepared_registered_before=(
SELECT VARIABLE_VALUE+0 FROM performance_schema.global_status
WHERE VARIABLE_NAME='Preserve_trx_promotion_prepared_registered_tokens');
SET @prepared_pending_before=(
SELECT VARIABLE_VALUE+0 FROM performance_schema.global_status
WHERE VARIABLE_NAME=
'Preserve_trx_promotion_prepared_prewarm_pending_tokens');
SET @ready_cache_bytes_before=(
SELECT VARIABLE_VALUE+0 FROM performance_schema.global_status
WHERE VARIABLE_NAME='Preserve_trx_promotion_ready_cache_bytes');
SET @memory_bytes_before=(
SELECT VARIABLE_VALUE+0 FROM performance_schema.global_status
WHERE VARIABLE_NAME='Preserve_trx_memory_current_bytes');
SET SESSION TRANSACTION ISOLATION LEVEL REPEATABLE READ;
START TRANSACTION;
SELECT balance=1000 AND version=0 AS rr_initial_version
FROM xfer2_w01_accounts WHERE id=32;
rr_initial_version
1
UPDATE xfer2_w01_accounts SET balance=balance+1, version=version+1 WHERE id=32;
SELECT balance=1000 AND version=0 AS rr_keeps_initial_version
FROM xfer2_w01_accounts WHERE id=32;
rr_keeps_initial_version
1
UPDATE xfer2_w01_accounts SET balance=balance-7, version=version+1 WHERE id=3;
SELECT ROW_COUNT()=1 AS first_update_applied;
first_update_applied
1
UPDATE xfer2_w01_accounts SET balance=balance+4, version=version+1 WHERE id=3;
SELECT ROW_COUNT()=1 AS second_update_applied;
second_update_applied
1
UPDATE xfer2_w01_accounts SET balance=balance+3, version=version+1 WHERE id=3;
SELECT ROW_COUNT()=1 AS third_update_applied;
third_update_applied
1
SELECT balance=1000 AND version=3 AS owner_sees_own_writes
FROM xfer2_w01_accounts WHERE id=3;
owner_sees_own_writes
1
INSERT INTO xfer2_w01_audit(account_id, delta) VALUES(3, 0);
SELECT ROW_COUNT()=1 AS audit_insert_applied;
audit_insert_applied
1
SELECT COUNT(*)=32 AS thirty_two_accounts,
SUM(balance)=32001 AS committed_background_balance,
SUM(version)=1 AS one_committed_background_version,
MAX(CASE WHEN id=32 THEN balance END)=1001 AS background_update_visible,
MAX(CASE WHEN id=3 THEN version END)=0 AS owner_updates_hidden
FROM xfer2_w01_accounts;
thirty_two_accounts	committed_background_balance	one_committed_background_version	background_update_visible	owner_updates_hidden
1	1	1	1	1
SELECT COUNT(*)=0 AS no_committed_audit FROM xfer2_w01_audit;
no_committed_audit
1
DRAIN TRANSACTIONS PRESERVE;
generation	outcome	source_connection_id	token_role	reason	closing_started_us	closing_deadline_us
GENERATION	SUCCESS	SOURCE_ID	SURVIVOR	NONE	CLOSING_STARTED_US	CLOSING_DEADLINE_US
SELECT (SELECT VARIABLE_VALUE+0 FROM performance_schema.global_status
WHERE VARIABLE_NAME='Preserve_trx_transfer_receiver_active_epochs')
= @active_epochs_before+1 AS one_receiver_epoch,
(SELECT VARIABLE_VALUE+0 FROM performance_schema.global_status
WHERE VARIABLE_NAME='Preserve_trx_transfer_receiver_auto_prewarm_tokens')
= @classified_before+1 AS one_classified_token,
(SELECT VARIABLE_VALUE+0 FROM performance_schema.global_status
WHERE VARIABLE_NAME=
'Preserve_trx_transfer_receiver_auto_prewarm_ready_tokens')
= @ready_before AS no_ready_token,
(SELECT VARIABLE_VALUE+0 FROM performance_schema.global_status
WHERE VARIABLE_NAME=
'Preserve_trx_transfer_receiver_auto_prewarm_not_ready_tokens')
= @not_ready_before+1 AS one_not_ready_token;
one_receiver_epoch	one_classified_token	no_ready_token	one_not_ready_token
1	1	1	1
SELECT (SELECT VARIABLE_VALUE+0 FROM performance_schema.global_status
WHERE VARIABLE_NAME=
'Preserve_trx_transfer_receiver_epoch_ready_bind_attempts')
= @bind_attempts_before AS no_final_fact_bind,
(SELECT VARIABLE_VALUE+0 FROM performance_schema.global_status
WHERE VARIABLE_NAME='Preserve_trx_promotion_prepared_ready_tokens')
= @prepared_ready_before AS no_prepared_ready_token,
(SELECT VARIABLE_VALUE+0 FROM performance_schema.global_status
WHERE VARIABLE_NAME=
'Preserve_trx_transfer_receiver_read_view_horizon_rejects')
= @horizon_rejects_before AS no_read_view_horizon_rejection;
no_final_fact_bind	no_prepared_ready_token	no_read_view_horizon_rejection
1	1	1
SELECT VARIABLE_VALUE='receiver_selection_failed:3'
         AS strict_record_plan_reaches_deadline
FROM performance_schema.global_status
WHERE VARIABLE_NAME='Preserve_trx_transfer_receiver_last_failed_reason';
strict_record_plan_reaches_deadline
1
SELECT (SELECT VARIABLE_VALUE+0 FROM performance_schema.global_status
WHERE VARIABLE_NAME=
'Preserve_trx_transfer_receiver_object_prewarm_miss_count')
> @object_misses_before AS object_prewarm_attempt_missed,
(SELECT VARIABLE_VALUE+0 FROM performance_schema.global_status
WHERE VARIABLE_NAME=
'Preserve_trx_transfer_receiver_record_object_prewarm_count')
= @record_prewarm_before AS no_record_object_prewarm_completed;
object_prewarm_attempt_missed	no_record_object_prewarm_completed
1	1
SELECT (SELECT VARIABLE_VALUE+0 FROM performance_schema.global_status
WHERE VARIABLE_NAME=
'Preserve_trx_transfer_receiver_strict_record_index_page_reads')
= @strict_index_reads_before AS no_strict_index_page_read,
(SELECT VARIABLE_VALUE+0 FROM performance_schema.global_status
WHERE VARIABLE_NAME=
'Preserve_trx_transfer_receiver_strict_ibuf_merges')
= @strict_ibuf_merges_before AS no_strict_ibuf_merge,
(SELECT VARIABLE_VALUE+0 FROM performance_schema.global_status
WHERE VARIABLE_NAME=
'Preserve_trx_transfer_receiver_strict_target_local_redo_bytes')
= @strict_redo_bytes_before AS no_strict_target_local_redo;
no_strict_index_page_read	no_strict_ibuf_merge	no_strict_target_local_redo
1	1	1
SELECT (SELECT VARIABLE_VALUE+0 FROM performance_schema.global_status
WHERE VARIABLE_NAME=
'Preserve_trx_transfer_receiver_record_lock_req_residency_bytes')
= @record_req_residency_before AS no_record_required_residency,
(SELECT VARIABLE_VALUE+0 FROM performance_schema.global_status
WHERE VARIABLE_NAME=
'Preserve_trx_transfer_receiver_record_lock_resv_residency_bytes')
= @record_resv_residency_before AS no_record_reserved_residency;
no_record_required_residency	no_record_reserved_residency
1	1
SELECT 1;
ERROR HY000: Preserve drain is active; this command was not executed
SELECT VARIABLE_VALUE=0 AS no_active_receiver_worker
FROM performance_schema.global_status
WHERE VARIABLE_NAME='Preserve_trx_transfer_receiver_worker_active';
no_active_receiver_worker
1
SELECT VARIABLE_VALUE=0 AS no_receiver_queue
FROM performance_schema.global_status
WHERE VARIABLE_NAME='Preserve_trx_transfer_receiver_queued_bytes';
no_receiver_queue
1
SELECT (SELECT VARIABLE_VALUE+0 FROM performance_schema.global_status
WHERE VARIABLE_NAME='Preserve_trx_transfer_receiver_inflight_tokens')
= @inflight_tokens_before AS no_inflight_token,
(SELECT VARIABLE_VALUE+0 FROM performance_schema.global_status
WHERE VARIABLE_NAME='Preserve_trx_transfer_receiver_inflight_bytes')
= @inflight_bytes_before AS no_inflight_byte,
(SELECT VARIABLE_VALUE+0 FROM performance_schema.global_status
WHERE VARIABLE_NAME=
'Preserve_trx_transfer_receiver_staged_memory_bytes')
= @staged_memory_before AS no_staged_memory,
(SELECT VARIABLE_VALUE+0 FROM performance_schema.global_status
WHERE VARIABLE_NAME='Preserve_trx_promotion_prepared_registered_tokens')
= @prepared_registered_before AS no_prepared_residue,
(SELECT VARIABLE_VALUE+0 FROM performance_schema.global_status
WHERE VARIABLE_NAME=
'Preserve_trx_promotion_prepared_prewarm_pending_tokens')
= @prepared_pending_before AS no_prewarm_pending_residue,
(SELECT VARIABLE_VALUE+0 FROM performance_schema.global_status
WHERE VARIABLE_NAME='Preserve_trx_promotion_ready_cache_bytes')
= @ready_cache_bytes_before AS no_ready_cache_residue,
(SELECT VARIABLE_VALUE+0 FROM performance_schema.global_status
WHERE VARIABLE_NAME='Preserve_trx_memory_current_bytes')
= @memory_bytes_before AS no_preserve_memory_residue,
(SELECT VARIABLE_VALUE+0 FROM performance_schema.global_status
WHERE VARIABLE_NAME='Preserve_trx_transfer_receiver_failed_tokens')
= @failed_records_before+1 AS one_terminal_failed_record;
no_inflight_token	no_inflight_byte	no_staged_memory	no_prepared_residue	no_prewarm_pending_residue	no_ready_cache_residue	no_preserve_memory_residue	one_terminal_failed_record
1	1	1	1	1	1	1	1
source_ha_control_session
1
SELECT COUNT(*)=32 AS thirty_two_accounts,
SUM(balance)=32001 AS committed_background_balance,
SUM(version)=1 AS one_committed_background_version,
MAX(CASE WHEN id=32 THEN balance END)=1001 AS background_update_visible,
MAX(CASE WHEN id=3 THEN version END)=0 AS owner_updates_hidden
FROM xfer2_w01_accounts;
thirty_two_accounts	committed_background_balance	one_committed_background_version	background_update_visible	owner_updates_hidden
1	1	1	1	1
SELECT COUNT(*)=0 AS no_committed_audit FROM xfer2_w01_audit;
no_committed_audit
1
DROP TABLE xfer2_w01_audit;
DROP TABLE xfer2_w01_accounts;
DROP USER xfer2_w01_app@localhost;
DROP USER preserve_trx_ha_admin@localhost;
DROP USER preserve_trx_ha_admin@localhost;
SELECT (SELECT VARIABLE_VALUE+0 FROM performance_schema.global_status
WHERE VARIABLE_NAME='Preserve_trx_transfer_receiver_active_epochs')=0
AS no_receiver_epoch_after_restart,
(SELECT VARIABLE_VALUE+0 FROM performance_schema.global_status
WHERE VARIABLE_NAME='Preserve_trx_transfer_receiver_inflight_tokens')=0
AS no_inflight_token_after_restart,
(SELECT VARIABLE_VALUE+0 FROM performance_schema.global_status
WHERE VARIABLE_NAME='Preserve_trx_transfer_receiver_inflight_bytes')=0
AS no_inflight_byte_after_restart,
(SELECT VARIABLE_VALUE+0 FROM performance_schema.global_status
WHERE VARIABLE_NAME=
'Preserve_trx_transfer_receiver_staged_memory_bytes')=0
AS no_staged_memory_after_restart,
(SELECT VARIABLE_VALUE+0 FROM performance_schema.global_status
WHERE VARIABLE_NAME='Preserve_trx_promotion_prepared_registered_tokens')=0
AS no_prepared_entry_after_restart,
(SELECT VARIABLE_VALUE+0 FROM performance_schema.global_status
WHERE VARIABLE_NAME=
'Preserve_trx_promotion_prepared_prewarm_pending_tokens')=0
AS no_prewarm_pending_after_restart,
(SELECT VARIABLE_VALUE+0 FROM performance_schema.global_status
WHERE VARIABLE_NAME='Preserve_trx_promotion_prepared_ready_tokens')=0
AS no_prepared_ready_after_restart,
(SELECT VARIABLE_VALUE+0 FROM performance_schema.global_status
WHERE VARIABLE_NAME='Preserve_trx_promotion_ready_cache_bytes')=0
AS no_ready_cache_after_restart,
(SELECT VARIABLE_VALUE+0 FROM performance_schema.global_status
WHERE VARIABLE_NAME='Preserve_trx_memory_current_bytes')=0
AS no_preserve_memory_after_restart,
(SELECT VARIABLE_VALUE+0 FROM performance_schema.global_status
WHERE VARIABLE_NAME='Preserve_trx_transfer_receiver_worker_active')=0
AS no_active_worker_after_restart,
(SELECT VARIABLE_VALUE+0 FROM performance_schema.global_status
WHERE VARIABLE_NAME='Preserve_trx_transfer_receiver_queued_bytes')=0
AS no_queued_byte_after_restart;
no_receiver_epoch_after_restart	no_inflight_token_after_restart	no_inflight_byte_after_restart	no_staged_memory_after_restart	no_prepared_entry_after_restart	no_prewarm_pending_after_restart	no_prepared_ready_after_restart	no_ready_cache_after_restart	no_preserve_memory_after_restart	no_active_worker_after_restart	no_queued_byte_after_restart
1	1	1	1	1	1	1	1	1	1	1
