CALL mtr.add_suppression(
"PRESERVE: rolled back prepared transaction without snapshot during recovery");
CREATE TABLE xfer2_w01_accounts(
id INT PRIMARY KEY,
balance INT NOT NULL,
version INT NOT NULL DEFAULT 0,
pad VARCHAR(64) NOT NULL
) ENGINE=InnoDB;
CREATE TABLE xfer2_w01_audit(
id BIGINT AUTO_INCREMENT PRIMARY KEY,
account_id INT NOT NULL,
delta INT NOT NULL,
KEY(account_id)
) ENGINE=InnoDB;
INSERT INTO xfer2_w01_accounts
WITH RECURSIVE seq(n) AS (
SELECT 1 UNION ALL SELECT n+1 FROM seq WHERE n<32
)
SELECT n, 1000, 0, CONCAT('account-', n) FROM seq;
CALL mtr.add_suppression(
"PRESERVE: standby transfer source epoch commit failed status=");
CALL mtr.add_suppression(
"PRESERVE: standby transfer source entered COMMIT_UNKNOWN");
SET GLOBAL rds_preserve_trx_token_retention_timeout_ms=120000;
SET GLOBAL debug='+d,syncpoint_xfer2_prewarm_object_read_gate,syncpoint_xfer2_commit_gate_a,syncpoint_release_xfer2_prewarm_object_read_gate,syncpoint_release_xfer2_commit_gate_a,preserve_trx_receiver_fail_commit_apply_once';
SET @f1c_terminal_before=(SELECT VARIABLE_VALUE+0
FROM performance_schema.global_status WHERE VARIABLE_NAME=
'Preserve_trx_transfer_receiver_terminal_cas_wins');
SET @f1c_tombstones_before=(SELECT VARIABLE_VALUE+0
FROM performance_schema.global_status WHERE VARIABLE_NAME=
'Preserve_trx_transfer_receiver_terminal_status_tombstones');
SET @f1c_debt_tokens_before=(SELECT VARIABLE_VALUE+0
FROM performance_schema.global_status WHERE VARIABLE_NAME=
'Preserve_trx_transfer_receiver_cleanup_debt_tokens');
SET @f1c_debt_bytes_before=(SELECT VARIABLE_VALUE+0
FROM performance_schema.global_status WHERE VARIABLE_NAME=
'Preserve_trx_transfer_receiver_cleanup_debt_bytes');
SET @f1c_retry_done_before=(SELECT VARIABLE_VALUE+0
FROM performance_schema.global_status WHERE VARIABLE_NAME=
'Preserve_trx_transfer_receiver_cleanup_retry_completions');
SET @f1c_inflight_tokens_before=(SELECT VARIABLE_VALUE+0
FROM performance_schema.global_status WHERE VARIABLE_NAME=
'Preserve_trx_transfer_receiver_inflight_tokens');
SET @f1c_staged_before=(SELECT VARIABLE_VALUE+0
FROM performance_schema.global_status WHERE VARIABLE_NAME=
'Preserve_trx_transfer_receiver_staged_memory_bytes');
SET @f1c_classified_before=(SELECT VARIABLE_VALUE+0
FROM performance_schema.global_status WHERE VARIABLE_NAME=
'Preserve_trx_transfer_receiver_auto_prewarm_tokens');
SET @f1c_seal_before=(SELECT VARIABLE_VALUE+0
FROM performance_schema.global_status WHERE VARIABLE_NAME=
'Preserve_trx_transfer_receiver_seal_prewarm_tokens');
UPDATE xfer2_w01_accounts
SET balance=balance+1,version=version+1 WHERE id=32;
SET SESSION TRANSACTION ISOLATION LEVEL REPEATABLE READ;
START TRANSACTION;
UPDATE xfer2_w01_accounts
SET balance=balance-17,version=version+1 WHERE id=1;
UPDATE xfer2_w01_accounts
SET balance=balance+17,version=version+1 WHERE id=2;
INSERT INTO xfer2_w01_audit(account_id,delta)
VALUES(1,-17),(2,17);
SELECT COUNT(*)=2 AND SUM(balance)=2000 AND SUM(version)=2
AS owner1_w04_balance_conserved
FROM xfer2_w01_accounts WHERE id IN (1,2);
owner1_w04_balance_conserved
1
SET SESSION TRANSACTION ISOLATION LEVEL REPEATABLE READ;
START TRANSACTION;
UPDATE xfer2_w01_accounts
SET balance=balance-23,version=version+1 WHERE id=3;
UPDATE xfer2_w01_accounts
SET balance=balance+23,version=version+1 WHERE id=4;
INSERT INTO xfer2_w01_audit(account_id,delta)
VALUES(3,-23),(4,23);
SELECT COUNT(*)=2 AND SUM(balance)=2000 AND SUM(version)=2
AS owner2_w04_balance_conserved
FROM xfer2_w01_accounts WHERE id IN (3,4);
owner2_w04_balance_conserved
1
DRAIN TRANSACTIONS PRESERVE;
SET DEBUG_SYNC='now WAIT_FOR reached_xfer2_prewarm_object_read_gate TIMEOUT 60';
SET DEBUG_SYNC='now WAIT_FOR reached_xfer2_commit_gate_a TIMEOUT 60';
SET DEBUG_SYNC='now SIGNAL continue_xfer2_commit_gate_a';
SELECT (SELECT VARIABLE_VALUE+0 FROM performance_schema.global_status
WHERE VARIABLE_NAME='Preserve_trx_transfer_receiver_worker_active')>0
AS prewarm_worker_still_active_during_cleanup;
prewarm_worker_still_active_during_cleanup
1
SELECT VARIABLE_VALUE='epoch_staging_cleanup_deferred:active_prewarm'
         AS deferred_reason_is_exact
FROM performance_schema.global_status
WHERE VARIABLE_NAME='Preserve_trx_transfer_receiver_last_failed_reason';
deferred_reason_is_exact
1
SET DEBUG_SYNC='now SIGNAL continue_xfer2_prewarm_object_read_gate';
SET GLOBAL debug='-d,syncpoint_xfer2_prewarm_object_read_gate,syncpoint_xfer2_commit_gate_a,syncpoint_release_xfer2_commit_gate_a,syncpoint_release_xfer2_prewarm_object_read_gate,preserve_trx_receiver_fail_commit_apply_once';
SELECT (SELECT VARIABLE_VALUE+0 FROM performance_schema.global_status
WHERE VARIABLE_NAME='Preserve_trx_transfer_receiver_cleanup_debt_tokens')
=@f1c_debt_tokens_before AS deferred_debt_completed,
(SELECT VARIABLE_VALUE+0 FROM performance_schema.global_status
WHERE VARIABLE_NAME='Preserve_trx_transfer_receiver_cleanup_debt_bytes')
=@f1c_debt_bytes_before AS deferred_debt_bytes_released,
(SELECT VARIABLE_VALUE+0 FROM performance_schema.global_status
WHERE VARIABLE_NAME='Preserve_trx_transfer_receiver_inflight_tokens')
=@f1c_inflight_tokens_before AS inflight_tokens_released,
(SELECT VARIABLE_VALUE+0 FROM performance_schema.global_status
WHERE VARIABLE_NAME='Preserve_trx_transfer_receiver_staged_memory_bytes')
=@f1c_staged_before AS staging_memory_released;
deferred_debt_completed	deferred_debt_bytes_released	inflight_tokens_released	staging_memory_released
1	1	1	1
SELECT (SELECT VARIABLE_VALUE+0 FROM performance_schema.global_status
WHERE VARIABLE_NAME='Preserve_trx_transfer_receiver_auto_prewarm_tokens')
=@f1c_classified_before AS no_classification_for_corrupt_epoch,
(SELECT VARIABLE_VALUE+0 FROM performance_schema.global_status
WHERE VARIABLE_NAME='Preserve_trx_transfer_receiver_seal_prewarm_tokens')
=@f1c_seal_before AS parked_worker_never_loaded_staging;
no_classification_for_corrupt_epoch	parked_worker_never_loaded_staging
1	1
SELECT (SELECT VARIABLE_VALUE+0 FROM performance_schema.global_status
WHERE VARIABLE_NAME='Preserve_trx_transfer_receiver_terminal_status_tombstones')
=@f1c_tombstones_before+1 AS bounded_corrupt_tombstone;
bounded_corrupt_tombstone
1
ERROR HY000: Resumable transactions across shutdown do not support this operation
SELECT (SELECT VARIABLE_VALUE+0 FROM performance_schema.global_status
WHERE VARIABLE_NAME='Preserve_trx_transfer_source_commit_unknown_epochs')
=1 AS source_entered_commit_unknown,
(SELECT VARIABLE_VALUE+0 FROM performance_schema.global_status
WHERE VARIABLE_NAME='Preserve_trx_transfer_quarantine_tokens')
=2 AS both_tokens_quarantined;
source_entered_commit_unknown	both_tokens_quarantined
1	1
SELECT 1;
ERROR HY000: Preserve drain is active; this command was not executed
SELECT 1;
ERROR HY000: Preserve drain is active; this command was not executed
SELECT VARIABLE_VALUE=0 AS no_active_receiver_worker
FROM performance_schema.global_status
WHERE VARIABLE_NAME='Preserve_trx_transfer_receiver_worker_active';
no_active_receiver_worker
1
SELECT VARIABLE_VALUE=0 AS no_receiver_queue
FROM performance_schema.global_status
WHERE VARIABLE_NAME='Preserve_trx_transfer_receiver_queued_bytes';
no_receiver_queue
1
source_ha_control_session
1
SELECT COUNT(*)=32 AS thirty_two_accounts,
SUM(balance)=32001 AS committed_background_balance,
SUM(version)=1 AS one_committed_background_version,
MAX(CASE WHEN id=32 THEN balance END)=1001 AS background_update_visible,
MAX(CASE WHEN id=3 THEN version END)=0 AS owner_updates_hidden
FROM xfer2_w01_accounts;
thirty_two_accounts	committed_background_balance	one_committed_background_version	background_update_visible	owner_updates_hidden
1	1	1	1	1
SELECT COUNT(*)=0 AS no_committed_audit FROM xfer2_w01_audit;
no_committed_audit
1
DROP TABLE xfer2_w01_audit;
DROP TABLE xfer2_w01_accounts;
DROP USER xfer2_w01_app@localhost;
DROP USER preserve_trx_ha_admin@localhost;
DROP USER preserve_trx_ha_admin@localhost;
SELECT (SELECT VARIABLE_VALUE+0 FROM performance_schema.global_status
WHERE VARIABLE_NAME='Preserve_trx_transfer_receiver_active_epochs')=0
AS no_receiver_epoch_after_restart,
(SELECT VARIABLE_VALUE+0 FROM performance_schema.global_status
WHERE VARIABLE_NAME='Preserve_trx_transfer_receiver_inflight_tokens')=0
AS no_inflight_token_after_restart,
(SELECT VARIABLE_VALUE+0 FROM performance_schema.global_status
WHERE VARIABLE_NAME='Preserve_trx_transfer_receiver_inflight_bytes')=0
AS no_inflight_byte_after_restart,
(SELECT VARIABLE_VALUE+0 FROM performance_schema.global_status
WHERE VARIABLE_NAME=
'Preserve_trx_transfer_receiver_staged_memory_bytes')=0
AS no_staged_memory_after_restart,
(SELECT VARIABLE_VALUE+0 FROM performance_schema.global_status
WHERE VARIABLE_NAME='Preserve_trx_promotion_prepared_registered_tokens')=0
AS no_prepared_entry_after_restart,
(SELECT VARIABLE_VALUE+0 FROM performance_schema.global_status
WHERE VARIABLE_NAME=
'Preserve_trx_promotion_prepared_prewarm_pending_tokens')=0
AS no_prewarm_pending_after_restart,
(SELECT VARIABLE_VALUE+0 FROM performance_schema.global_status
WHERE VARIABLE_NAME='Preserve_trx_promotion_prepared_ready_tokens')=0
AS no_prepared_ready_after_restart,
(SELECT VARIABLE_VALUE+0 FROM performance_schema.global_status
WHERE VARIABLE_NAME='Preserve_trx_promotion_ready_cache_bytes')=0
AS no_ready_cache_after_restart,
(SELECT VARIABLE_VALUE+0 FROM performance_schema.global_status
WHERE VARIABLE_NAME='Preserve_trx_memory_current_bytes')=0
AS no_preserve_memory_after_restart,
(SELECT VARIABLE_VALUE+0 FROM performance_schema.global_status
WHERE VARIABLE_NAME='Preserve_trx_transfer_receiver_worker_active')=0
AS no_active_worker_after_restart,
(SELECT VARIABLE_VALUE+0 FROM performance_schema.global_status
WHERE VARIABLE_NAME='Preserve_trx_transfer_receiver_queued_bytes')=0
AS no_queued_byte_after_restart;
no_receiver_epoch_after_restart	no_inflight_token_after_restart	no_inflight_byte_after_restart	no_staged_memory_after_restart	no_prepared_entry_after_restart	no_prewarm_pending_after_restart	no_prepared_ready_after_restart	no_ready_cache_after_restart	no_preserve_memory_after_restart	no_active_worker_after_restart	no_queued_byte_after_restart
1	1	1	1	1	1	1	1	1	1	1
