CALL mtr.add_suppression(
"PRESERVE: rolled back prepared transaction without snapshot during recovery");
SET GLOBAL rds_preserve_trx_enable=ON;
SET GLOBAL rds_preserve_trx_transfer_prewarm_paused=OFF;
SET GLOBAL rds_preserve_trx_transfer_runtime_profile=PROMOTION_PREPARE;
SET GLOBAL rds_preserve_trx_token_retention_timeout_ms=120000;
CREATE TABLE xfer1_partial_deadline_accounts(
id INT PRIMARY KEY,
balance INT NOT NULL,
version INT NOT NULL DEFAULT 0,
pad VARCHAR(64) NOT NULL
) ENGINE=InnoDB;
CREATE TABLE xfer1_partial_deadline_audit(
id BIGINT AUTO_INCREMENT PRIMARY KEY,
owner_no INT NOT NULL,
debit_id INT NOT NULL,
credit_id INT NOT NULL,
amount INT NOT NULL,
KEY(owner_no)
) ENGINE=InnoDB;
INSERT INTO xfer1_partial_deadline_accounts
WITH RECURSIVE seq(n) AS (
SELECT 1 UNION ALL SELECT n+1 FROM seq WHERE n<32
)
SELECT n, 1000, 0, CONCAT('deadline-account-', n) FROM seq;
SET @active_epochs_before=(
SELECT VARIABLE_VALUE+0 FROM performance_schema.global_status
WHERE VARIABLE_NAME='Preserve_trx_transfer_receiver_active_epochs');
SET @classified_before=(
SELECT VARIABLE_VALUE+0 FROM performance_schema.global_status
WHERE VARIABLE_NAME='Preserve_trx_transfer_receiver_auto_prewarm_tokens');
SET @ready_before=(
SELECT VARIABLE_VALUE+0 FROM performance_schema.global_status
WHERE VARIABLE_NAME=
'Preserve_trx_transfer_receiver_auto_prewarm_ready_tokens');
SET @not_ready_before=(
SELECT VARIABLE_VALUE+0 FROM performance_schema.global_status
WHERE VARIABLE_NAME=
'Preserve_trx_transfer_receiver_auto_prewarm_not_ready_tokens');
SET @prepared_registered_before=(
SELECT VARIABLE_VALUE+0 FROM performance_schema.global_status
WHERE VARIABLE_NAME='Preserve_trx_promotion_prepared_registered_tokens');
SET @prepared_ready_before=(
SELECT VARIABLE_VALUE+0 FROM performance_schema.global_status
WHERE VARIABLE_NAME='Preserve_trx_promotion_prepared_ready_tokens');
SET @failed_records_before=(
SELECT VARIABLE_VALUE+0 FROM performance_schema.global_status
WHERE VARIABLE_NAME='Preserve_trx_transfer_receiver_failed_tokens');
SET @inflight_bytes_before=(
SELECT VARIABLE_VALUE+0 FROM performance_schema.global_status
WHERE VARIABLE_NAME='Preserve_trx_transfer_receiver_inflight_bytes');
SET @inflight_tokens_before=(
SELECT VARIABLE_VALUE+0 FROM performance_schema.global_status
WHERE VARIABLE_NAME='Preserve_trx_transfer_receiver_inflight_tokens');
SET @staged_memory_before=(
SELECT VARIABLE_VALUE+0 FROM performance_schema.global_status
WHERE VARIABLE_NAME=
'Preserve_trx_transfer_receiver_staged_memory_bytes');
SET @cleanup_retries_before=(
SELECT VARIABLE_VALUE+0 FROM performance_schema.global_status
WHERE VARIABLE_NAME=
'Preserve_trx_transfer_receiver_cleanup_retry_completions');
SET GLOBAL debug=
'+d,preserve_trx_receiver_delay_one_token_past_deadline,preserve_trx_receiver_fail_one_selection_cleanup';
SET SESSION TRANSACTION ISOLATION LEVEL REPEATABLE READ;
START TRANSACTION;
SELECT balance=1000 AS owner1_snapshot
FROM xfer1_partial_deadline_accounts WHERE id=29;
owner1_snapshot
1
UPDATE xfer1_partial_deadline_accounts
SET balance=balance-11, version=version+1 WHERE id=1;
UPDATE xfer1_partial_deadline_accounts
SET balance=balance+11, version=version+1 WHERE id=2;
INSERT INTO xfer1_partial_deadline_audit(owner_no,debit_id,credit_id,amount)
VALUES(1,1,2,11);
SET SESSION TRANSACTION ISOLATION LEVEL REPEATABLE READ;
START TRANSACTION;
SELECT balance=1000 AS owner2_snapshot
FROM xfer1_partial_deadline_accounts WHERE id=30;
owner2_snapshot
1
UPDATE xfer1_partial_deadline_accounts
SET balance=balance-13, version=version+1 WHERE id=3;
UPDATE xfer1_partial_deadline_accounts
SET balance=balance+13, version=version+1 WHERE id=4;
INSERT INTO xfer1_partial_deadline_audit(owner_no,debit_id,credit_id,amount)
VALUES(2,3,4,13);
SET SESSION TRANSACTION ISOLATION LEVEL REPEATABLE READ;
START TRANSACTION;
SELECT balance=1000 AS owner3_snapshot
FROM xfer1_partial_deadline_accounts WHERE id=31;
owner3_snapshot
1
UPDATE xfer1_partial_deadline_accounts
SET balance=balance-17, version=version+1 WHERE id=5;
UPDATE xfer1_partial_deadline_accounts
SET balance=balance+17, version=version+1 WHERE id=6;
INSERT INTO xfer1_partial_deadline_audit(owner_no,debit_id,credit_id,amount)
VALUES(3,5,6,17);
UPDATE xfer1_partial_deadline_accounts
SET balance=balance+3, version=version+1 WHERE id=32;
SELECT COUNT(*)=32 AS thirty_two_accounts,
SUM(balance)=32003 AS only_outsider_change_committed,
SUM(version)=1 AS owner_versions_hidden,
MAX(CASE WHEN id IN (1,2,3,4,5,6) THEN version END)=0
AS all_owner_updates_hidden
FROM xfer1_partial_deadline_accounts;
thirty_two_accounts	only_outsider_change_committed	owner_versions_hidden	all_owner_updates_hidden
1	1	1	1
SELECT COUNT(*)=0 AS all_owner_audit_hidden
FROM xfer1_partial_deadline_audit;
all_owner_audit_hidden
1
DRAIN TRANSACTIONS PRESERVE;
generation	outcome	source_connection_id	token_role	reason	closing_started_us	closing_deadline_us
GENERATION	SUCCESS	OWNER1_ID	SURVIVOR	NONE	CLOSING_STARTED_US	CLOSING_DEADLINE_US
GENERATION	SUCCESS	OWNER2_ID	SURVIVOR	NONE	CLOSING_STARTED_US	CLOSING_DEADLINE_US
GENERATION	SUCCESS	OWNER3_ID	SURVIVOR	NONE	CLOSING_STARTED_US	CLOSING_DEADLINE_US
SET GLOBAL debug=
'-d,preserve_trx_receiver_delay_one_token_past_deadline,preserve_trx_receiver_fail_one_selection_cleanup';
SELECT (SELECT VARIABLE_VALUE+0 FROM performance_schema.global_status
WHERE VARIABLE_NAME='Preserve_trx_transfer_receiver_active_epochs')
= @active_epochs_before+1 AS one_classified_epoch,
(SELECT VARIABLE_VALUE+0 FROM performance_schema.global_status
WHERE VARIABLE_NAME='Preserve_trx_transfer_receiver_auto_prewarm_tokens')
= @classified_before+3 AS three_classified_tokens,
(SELECT VARIABLE_VALUE+0 FROM performance_schema.global_status
WHERE VARIABLE_NAME=
'Preserve_trx_transfer_receiver_auto_prewarm_ready_tokens')
= @ready_before+2 AS two_ready_tokens,
(SELECT VARIABLE_VALUE+0 FROM performance_schema.global_status
WHERE VARIABLE_NAME=
'Preserve_trx_transfer_receiver_auto_prewarm_not_ready_tokens')
= @not_ready_before+1 AS one_deadline_token;
one_classified_epoch	three_classified_tokens	two_ready_tokens	one_deadline_token
1	1	1	1
SELECT (SELECT VARIABLE_VALUE+0 FROM performance_schema.global_status
WHERE VARIABLE_NAME='Preserve_trx_promotion_prepared_registered_tokens')
= @prepared_registered_before+2 AS only_ready_subset_registered,
(SELECT VARIABLE_VALUE+0 FROM performance_schema.global_status
WHERE VARIABLE_NAME='Preserve_trx_promotion_prepared_ready_tokens')
= @prepared_ready_before+2 AS ready_subset_survives_old_cutoff,
(SELECT VARIABLE_VALUE+0 FROM performance_schema.global_status
WHERE VARIABLE_NAME='Preserve_trx_transfer_receiver_failed_tokens')
= @failed_records_before+1 AS deadline_token_terminal,
(SELECT VARIABLE_VALUE+0 FROM performance_schema.global_status
WHERE VARIABLE_NAME='Preserve_trx_transfer_receiver_inflight_bytes')
= @inflight_bytes_before AS staging_bytes_released,
(SELECT VARIABLE_VALUE+0 FROM performance_schema.global_status
WHERE VARIABLE_NAME='Preserve_trx_transfer_receiver_inflight_tokens')
= @inflight_tokens_before AS no_inflight_token,
(SELECT VARIABLE_VALUE+0 FROM performance_schema.global_status
WHERE VARIABLE_NAME=
'Preserve_trx_transfer_receiver_staged_memory_bytes')
= @staged_memory_before AS staged_memory_released,
(SELECT VARIABLE_VALUE+0 FROM performance_schema.global_status
WHERE VARIABLE_NAME=
'Preserve_trx_transfer_receiver_cleanup_retry_completions')
= @cleanup_retries_before+1 AS cleanup_retry_completed;
only_ready_subset_registered	ready_subset_survives_old_cutoff	deadline_token_terminal	staging_bytes_released	no_inflight_token	staged_memory_released	cleanup_retry_completed
1	1	1	1	1	1	1
SELECT VARIABLE_VALUE='receiver_selection_failed:3'
         AS deadline_cleanup_reason_is_exact
FROM performance_schema.global_status
WHERE VARIABLE_NAME='Preserve_trx_transfer_receiver_last_failed_reason';
deadline_cleanup_reason_is_exact
1
SELECT 1;
ERROR HY000: Preserve drain is active; this command was not executed
SELECT 1;
ERROR HY000: Preserve drain is active; this command was not executed
SELECT 1;
ERROR HY000: Preserve drain is active; this command was not executed
SET GLOBAL rds_preserve_trx_transfer_runtime_profile=BUSINESS_FIRST;
SHUTDOWN;
SELECT (SELECT VARIABLE_VALUE+0 FROM performance_schema.global_status
WHERE VARIABLE_NAME='Preserve_trx_transfer_receiver_active_epochs')=0
AS no_receiver_epoch_after_restart,
(SELECT VARIABLE_VALUE+0 FROM performance_schema.global_status
WHERE VARIABLE_NAME='Preserve_trx_transfer_receiver_inflight_tokens')=0
AS no_inflight_token_after_restart,
(SELECT VARIABLE_VALUE+0 FROM performance_schema.global_status
WHERE VARIABLE_NAME='Preserve_trx_transfer_receiver_inflight_bytes')=0
AS no_inflight_byte_after_restart,
(SELECT VARIABLE_VALUE+0 FROM performance_schema.global_status
WHERE VARIABLE_NAME=
'Preserve_trx_transfer_receiver_staged_memory_bytes')=0
AS no_staged_memory_after_restart,
(SELECT VARIABLE_VALUE+0 FROM performance_schema.global_status
WHERE VARIABLE_NAME='Preserve_trx_promotion_prepared_registered_tokens')=0
AS no_prepared_entry_after_restart,
(SELECT VARIABLE_VALUE+0 FROM performance_schema.global_status
WHERE VARIABLE_NAME=
'Preserve_trx_promotion_prepared_prewarm_pending_tokens')=0
AS no_prewarm_pending_after_restart,
(SELECT VARIABLE_VALUE+0 FROM performance_schema.global_status
WHERE VARIABLE_NAME='Preserve_trx_promotion_prepared_ready_tokens')=0
AS no_prepared_ready_after_restart,
(SELECT VARIABLE_VALUE+0 FROM performance_schema.global_status
WHERE VARIABLE_NAME='Preserve_trx_promotion_ready_cache_bytes')=0
AS no_ready_cache_after_restart,
(SELECT VARIABLE_VALUE+0 FROM performance_schema.global_status
WHERE VARIABLE_NAME='Preserve_trx_memory_current_bytes')=0
AS no_preserve_memory_after_restart,
(SELECT VARIABLE_VALUE+0 FROM performance_schema.global_status
WHERE VARIABLE_NAME='Preserve_trx_transfer_receiver_worker_active')=0
AS no_active_worker_after_restart,
(SELECT VARIABLE_VALUE+0 FROM performance_schema.global_status
WHERE VARIABLE_NAME='Preserve_trx_transfer_receiver_queued_bytes')=0
AS no_queued_byte_after_restart;
no_receiver_epoch_after_restart	no_inflight_token_after_restart	no_inflight_byte_after_restart	no_staged_memory_after_restart	no_prepared_entry_after_restart	no_prewarm_pending_after_restart	no_prepared_ready_after_restart	no_ready_cache_after_restart	no_preserve_memory_after_restart	no_active_worker_after_restart	no_queued_byte_after_restart
1	1	1	1	1	1	1	1	1	1	1
SELECT COUNT(*)=32 AS thirty_two_accounts,
SUM(balance)=32003 AS outsider_change_durable,
SUM(version)=1 AS every_owner_update_rolled_back,
MAX(CASE WHEN id=32 THEN balance END)=1003 AS outsider_row_kept
FROM xfer1_partial_deadline_accounts;
thirty_two_accounts	outsider_change_durable	every_owner_update_rolled_back	outsider_row_kept
1	1	1	1
SELECT COUNT(*)=0 AS every_owner_audit_rolled_back
FROM xfer1_partial_deadline_audit;
every_owner_audit_rolled_back
1
DROP TABLE xfer1_partial_deadline_audit;
DROP TABLE xfer1_partial_deadline_accounts;
DROP USER xfer1_partial_deadline_app@localhost;
DROP USER preserve_trx_ha_admin@'127.0.0.1';
