DROP TABLE IF EXISTS t_warmcopy_parameter_matrix;
SET GLOBAL rds_preserve_trx_enable=ON;
SET GLOBAL rds_preserve_trx_transfer_runtime_profile=PROMOTION_PREPARE;
SET GLOBAL rds_preserve_trx_drain_phase2_timeout_ms=5000;
CREATE TABLE t_warmcopy_parameter_matrix(
id INT PRIMARY KEY,
v INT,
pad VARBINARY(64)
) ENGINE=InnoDB;
INSERT INTO t_warmcopy_parameter_matrix VALUES
(1,10,REPEAT('a',32)),
(2,20,REPEAT('b',32)),
(3,30,REPEAT('c',32));
START TRANSACTION;
UPDATE t_warmcopy_parameter_matrix
SET v=11, pad=REPEAT('x',32)
WHERE id=1;
SET DEBUG_SYNC =
'preserve_trx_warmcopy_after_closing_state_before_targets SIGNAL warmcopy_matrix_binlog_closing WAIT_FOR warmcopy_matrix_binlog_continue';
DRAIN TRANSACTIONS PRESERVE;
SET DEBUG_SYNC = 'now WAIT_FOR warmcopy_matrix_binlog_closing TIMEOUT 10';
SELECT 'binlog_only_two_phase_observed' AS matrix_case;
matrix_case
binlog_only_two_phase_observed
SET DEBUG_SYNC = 'now SIGNAL warmcopy_matrix_binlog_continue';
SELECT COUNT(*) AS preserved_count
FROM performance_schema.preserved_transactions;
preserved_count
1
RESUME PRESERVED TRANSACTION 'TOKEN';
COMMIT;
SELECT COUNT(*) AS preserved_count_after_resume
FROM performance_schema.preserved_transactions;
preserved_count_after_resume
0
START TRANSACTION;
UPDATE t_warmcopy_parameter_matrix
SET v=22, pad=REPEAT('y',32)
WHERE id=2;
SET DEBUG_SYNC =
'preserve_trx_warmcopy_after_closing_state_before_targets SIGNAL warmcopy_matrix_lock_closing WAIT_FOR warmcopy_matrix_lock_continue';
DRAIN TRANSACTIONS PRESERVE;
SET DEBUG_SYNC = 'now WAIT_FOR warmcopy_matrix_lock_closing TIMEOUT 10';
SELECT 'lock_only_two_phase_observed' AS matrix_case;
matrix_case
lock_only_two_phase_observed
SET DEBUG_SYNC = 'now SIGNAL warmcopy_matrix_lock_continue';
SELECT COUNT(*) AS preserved_count
FROM performance_schema.preserved_transactions;
preserved_count
1
RESUME PRESERVED TRANSACTION 'TOKEN';
COMMIT;
SELECT COUNT(*) AS preserved_count_after_resume
FROM performance_schema.preserved_transactions;
preserved_count_after_resume
0
START TRANSACTION;
UPDATE t_warmcopy_parameter_matrix
SET v=33, pad=REPEAT('z',32)
WHERE id=3;
SET DEBUG_SYNC =
'preserve_trx_warmcopy_after_closing_state_before_targets SIGNAL warmcopy_matrix_both_closing WAIT_FOR warmcopy_matrix_both_continue';
DRAIN TRANSACTIONS PRESERVE;
SET DEBUG_SYNC = 'now WAIT_FOR warmcopy_matrix_both_closing TIMEOUT 10';
SELECT 'both_warmcopy_two_phase_observed' AS matrix_case;
matrix_case
both_warmcopy_two_phase_observed
SET DEBUG_SYNC = 'now SIGNAL warmcopy_matrix_both_continue';
SELECT COUNT(*) AS preserved_count
FROM performance_schema.preserved_transactions;
preserved_count
1
RESUME PRESERVED TRANSACTION 'TOKEN';
COMMIT;
SELECT COUNT(*) AS preserved_count_after_resume
FROM performance_schema.preserved_transactions;
preserved_count_after_resume
0
SELECT id, v, pad IN (REPEAT('x',32), REPEAT('y',32), REPEAT('z',32)) AS pad_ok
FROM t_warmcopy_parameter_matrix
ORDER BY id;
id	v	pad_ok
1	11	1
2	22	1
3	33	1
DROP TABLE t_warmcopy_parameter_matrix;
SET DEBUG_SYNC = 'RESET';
