DROP TABLE IF EXISTS t_lock_warmcopy_conversion_fence;
SET GLOBAL rds_preserve_trx_enable=ON;
CREATE TABLE t_lock_warmcopy_conversion_fence(
id INT PRIMARY KEY,
v INT
) ENGINE=InnoDB;
INSERT INTO t_lock_warmcopy_conversion_fence VALUES(1,10),(2,20);
START TRANSACTION;
UPDATE t_lock_warmcopy_conversion_fence SET v=11 WHERE id=1;
SET SESSION debug="+d,preserve_trx_lock_warmcopy_simulate_conversion_after_freeze";
SET SESSION debug="+d,preserve_trx_lock_warmcopy_simulate_conversion_after_freeze";
DRAIN TRANSACTIONS PRESERVE;
include/assert_grep.inc [lock warmcopy fence mismatch is logged]
include/assert_grep.inc [lock warmcopy fence mismatch falls back to live export]
SELECT COUNT(*) AS preserved_count_after_conversion_fallback
FROM performance_schema.preserved_transactions;
preserved_count_after_conversion_fallback
1
RESUME PRESERVED TRANSACTION 'TOKEN';
UPDATE t_lock_warmcopy_conversion_fence SET v=21 WHERE id=2;
COMMIT;
SELECT id, v FROM t_lock_warmcopy_conversion_fence ORDER BY id;
id	v
1	11
2	21
START TRANSACTION;
UPDATE t_lock_warmcopy_conversion_fence SET v=31 WHERE id=1;
SET SESSION debug="+d,preserve_trx_lock_warmcopy_simulate_conversion_after_snapshot_write";
SET SESSION debug="+d,preserve_trx_lock_warmcopy_simulate_conversion_after_snapshot_write";
DRAIN TRANSACTIONS PRESERVE;
ERROR HY000: Resumable transactions across shutdown do not support this operation
SET SESSION debug="-d,preserve_trx_lock_warmcopy_simulate_conversion_after_snapshot_write";
SELECT COUNT(*) AS preserved_count_after_snapshot_fence_reject
FROM performance_schema.preserved_transactions;
preserved_count_after_snapshot_fence_reject
0
SET SESSION debug="-d,preserve_trx_lock_warmcopy_simulate_conversion_after_snapshot_write";
UPDATE t_lock_warmcopy_conversion_fence SET v=32 WHERE id=2;
COMMIT;
SELECT id, v FROM t_lock_warmcopy_conversion_fence ORDER BY id;
id	v
1	31
2	32
DROP TABLE t_lock_warmcopy_conversion_fence;
