DROP TABLE IF EXISTS t_lock_warmcopy_conversion_fence;
SET GLOBAL preserve_trx_enable=ON;
SET GLOBAL preserve_trx_warmcopy_enable=OFF;
SET GLOBAL preserve_trx_lock_warmcopy_enable=ON;
SET GLOBAL preserve_trx_lock_warmcopy_fallback_to_live_export=OFF;
SET GLOBAL preserve_trx_recovery_max_count=10;
CREATE TABLE t_lock_warmcopy_conversion_fence(
id INT PRIMARY KEY,
v INT
) ENGINE=InnoDB;
INSERT INTO t_lock_warmcopy_conversion_fence VALUES(1,10),(2,20);
START TRANSACTION;
UPDATE t_lock_warmcopy_conversion_fence SET v=11 WHERE id=1;
SET SESSION debug="+d,preserve_trx_lock_warmcopy_simulate_conversion_after_freeze";
SET SESSION debug="+d,preserve_trx_lock_warmcopy_simulate_conversion_after_freeze";
DRAIN TRANSACTIONS PRESERVE WITH TIMEOUT 300;
ERROR HY000: Resumable transactions across shutdown do not support this operation
include/assert_grep.inc [lock warmcopy fence mismatch is logged]
SET SESSION debug="-d,preserve_trx_lock_warmcopy_simulate_conversion_after_freeze";
SELECT COUNT(*) AS preserved_count_after_conversion_fence_reject
FROM performance_schema.preserved_transactions;
preserved_count_after_conversion_fence_reject
0
SET SESSION debug="-d,preserve_trx_lock_warmcopy_simulate_conversion_after_freeze";
UPDATE t_lock_warmcopy_conversion_fence SET v=21 WHERE id=2;
COMMIT;
SELECT id, v FROM t_lock_warmcopy_conversion_fence ORDER BY id;
id	v
1	11
2	21
START TRANSACTION;
UPDATE t_lock_warmcopy_conversion_fence SET v=31 WHERE id=1;
SET SESSION debug="+d,preserve_trx_lock_warmcopy_simulate_conversion_after_snapshot_write";
SET SESSION debug="+d,preserve_trx_lock_warmcopy_simulate_conversion_after_snapshot_write";
DRAIN TRANSACTIONS PRESERVE WITH TIMEOUT 300;
ERROR HY000: Resumable transactions across shutdown do not support this operation
SET SESSION debug="-d,preserve_trx_lock_warmcopy_simulate_conversion_after_snapshot_write";
SELECT COUNT(*) AS preserved_count_after_snapshot_fence_reject
FROM performance_schema.preserved_transactions;
preserved_count_after_snapshot_fence_reject
0
SET SESSION debug="-d,preserve_trx_lock_warmcopy_simulate_conversion_after_snapshot_write";
UPDATE t_lock_warmcopy_conversion_fence SET v=32 WHERE id=2;
COMMIT;
SELECT id, v FROM t_lock_warmcopy_conversion_fence ORDER BY id;
id	v
1	31
2	32
DROP TABLE t_lock_warmcopy_conversion_fence;
