DROP TABLE IF EXISTS t_lock_warmcopy_interrupt;
SET GLOBAL preserve_trx_enable=ON;
SET GLOBAL preserve_trx_warmcopy_enable=OFF;
SET GLOBAL preserve_trx_lock_warmcopy_enable=ON;
SET GLOBAL preserve_trx_lock_warmcopy_fallback_to_live_export=OFF;
SET GLOBAL preserve_trx_recovery_max_count=10;
CREATE TABLE t_lock_warmcopy_interrupt(
id INT PRIMARY KEY,
v INT
) ENGINE=InnoDB;
INSERT INTO t_lock_warmcopy_interrupt VALUES(1,10),(2,20);
START TRANSACTION;
UPDATE t_lock_warmcopy_interrupt SET v=11 WHERE id=1;
SET DEBUG_SYNC =
'preserve_trx_warmcopy_after_closing_state_before_targets SIGNAL lock_wc_interrupt_closing WAIT_FOR lock_wc_interrupt_continue';
DRAIN TRANSACTIONS PRESERVE WITH TIMEOUT 300;
SET DEBUG_SYNC = 'now WAIT_FOR lock_wc_interrupt_closing TIMEOUT 10';
KILL QUERY DRAIN_CONN_ID;
SET DEBUG_SYNC = 'now SIGNAL lock_wc_interrupt_continue';
ERROR HY000: Resumable transactions across shutdown do not support this operation
SELECT COUNT(*) AS preserved_count_after_kill_query
FROM performance_schema.preserved_transactions;
preserved_count_after_kill_query
0
ROLLBACK;
SELECT id, v FROM t_lock_warmcopy_interrupt ORDER BY id;
id	v
1	10
2	20
UPDATE t_lock_warmcopy_interrupt SET v=21 WHERE id=2;
SELECT id, v FROM t_lock_warmcopy_interrupt ORDER BY id;
id	v
1	10
2	21
START TRANSACTION;
UPDATE t_lock_warmcopy_interrupt SET v=12 WHERE id=1;
SET DEBUG_SYNC =
'preserve_trx_warmcopy_after_closing_state_before_targets SIGNAL lock_wc_interrupt_conn_closing WAIT_FOR lock_wc_interrupt_conn_continue';
DRAIN TRANSACTIONS PRESERVE WITH TIMEOUT 300;
SET DEBUG_SYNC = 'now WAIT_FOR lock_wc_interrupt_conn_closing TIMEOUT 10';
KILL CONNECTION DRAIN_CONN_ID;
SET DEBUG_SYNC = 'now SIGNAL lock_wc_interrupt_conn_continue';
ERROR HY000: Lost connection to MySQL server during query
SELECT COUNT(*) AS preserved_count_after_kill_connection
FROM performance_schema.preserved_transactions;
preserved_count_after_kill_connection
0
ROLLBACK;
SELECT id, v FROM t_lock_warmcopy_interrupt ORDER BY id;
id	v
1	10
2	21
START TRANSACTION;
UPDATE t_lock_warmcopy_interrupt SET v=13 WHERE id=1;
SET DEBUG_SYNC =
'preserve_trx_warmcopy_after_closing_state_before_targets SIGNAL lock_wc_interrupt_target_closing WAIT_FOR lock_wc_interrupt_target_continue';
DRAIN TRANSACTIONS PRESERVE WITH TIMEOUT 300;
SET DEBUG_SYNC = 'now WAIT_FOR lock_wc_interrupt_target_closing TIMEOUT 10';
KILL CONNECTION TARGET_CONN_ID;
SET DEBUG_SYNC = 'now SIGNAL lock_wc_interrupt_target_continue';
SELECT 1;
ERROR HY000: MySQL server has gone away
SELECT COUNT(*) AS preserved_count_after_target_disconnect
FROM performance_schema.preserved_transactions;
preserved_count_after_target_disconnect
0
SELECT id, v FROM t_lock_warmcopy_interrupt ORDER BY id;
id	v
1	10
2	21
UPDATE t_lock_warmcopy_interrupt SET v=22 WHERE id=2;
SELECT id, v FROM t_lock_warmcopy_interrupt ORDER BY id;
id	v
1	10
2	22
START TRANSACTION;
UPDATE t_lock_warmcopy_interrupt SET v=14 WHERE id=1;
SET DEBUG_SYNC =
'preserve_trx_warmcopy_after_closing_state_before_targets SIGNAL lock_wc_interrupt_sigterm_closing WAIT_FOR lock_wc_interrupt_sigterm_continue';
DRAIN TRANSACTIONS PRESERVE WITH TIMEOUT 300;
SET DEBUG_SYNC = 'now WAIT_FOR lock_wc_interrupt_sigterm_closing TIMEOUT 10';
SELECT 1 AS server_alive_after_lock_warmcopy_sigterm;
Got one of the listed errors
SELECT COUNT(*) AS preserved_count_after_sigterm
FROM performance_schema.preserved_transactions;
preserved_count_after_sigterm
0
SELECT id, v FROM t_lock_warmcopy_interrupt ORDER BY id;
id	v
1	10
2	22
UPDATE t_lock_warmcopy_interrupt SET v=23 WHERE id=2;
SELECT id, v FROM t_lock_warmcopy_interrupt ORDER BY id;
id	v
1	10
2	23
START TRANSACTION;
UPDATE t_lock_warmcopy_interrupt SET v=15 WHERE id=1;
SET DEBUG_SYNC = 'lock_wait_will_wait SIGNAL lock_wc_interrupt_waiting';
UPDATE t_lock_warmcopy_interrupt SET v=16 WHERE id=1;
SET DEBUG_SYNC = 'now WAIT_FOR lock_wc_interrupt_waiting TIMEOUT 10';
SET DEBUG_SYNC =
'preserve_trx_warmcopy_after_closing_state_before_targets SIGNAL lock_wc_interrupt_wait_closing WAIT_FOR lock_wc_interrupt_wait_continue';
DRAIN TRANSACTIONS PRESERVE WITH TIMEOUT 300;
SET DEBUG_SYNC = 'now WAIT_FOR lock_wc_interrupt_wait_closing TIMEOUT 10';
KILL QUERY WAIT_CONN_ID;
ERROR 70100: Query execution was interrupted
KILL QUERY DRAIN_CONN_ID;
SET DEBUG_SYNC = 'now SIGNAL lock_wc_interrupt_wait_continue';
ERROR HY000: Resumable transactions across shutdown do not support this operation
ROLLBACK;
SELECT COUNT(*) AS preserved_count_after_lock_wait_interrupt
FROM performance_schema.preserved_transactions;
preserved_count_after_lock_wait_interrupt
0
ROLLBACK;
SELECT id, v FROM t_lock_warmcopy_interrupt ORDER BY id;
id	v
1	10
2	23
UPDATE t_lock_warmcopy_interrupt SET v=24 WHERE id=2;
SELECT id, v FROM t_lock_warmcopy_interrupt ORDER BY id;
id	v
1	10
2	24
DROP TABLE t_lock_warmcopy_interrupt;
SET DEBUG_SYNC = 'RESET';
