DROP TABLE IF EXISTS t_lock_warmcopy_crash_prepare;
SET GLOBAL rds_preserve_trx_enable=ON;
CREATE TABLE t_lock_warmcopy_crash_prepare(
id INT PRIMARY KEY,
v INT
) ENGINE=InnoDB;
INSERT INTO t_lock_warmcopy_crash_prepare VALUES(1,10),(2,20);
START TRANSACTION;
UPDATE t_lock_warmcopy_crash_prepare SET v=11 WHERE id=1;
SET SESSION debug="+d,preserve_trx_crash_after_undo_prepared_before_snapshot";
DRAIN TRANSACTIONS PRESERVE;
ERROR HY000: Lost connection to MySQL server during query
SELECT COUNT(*) AS preserved_count_after_crash_before_snapshot
FROM performance_schema.preserved_transactions;
preserved_count_after_crash_before_snapshot
0
SELECT id, v FROM t_lock_warmcopy_crash_prepare ORDER BY id;
id	v
1	10
2	20
UPDATE t_lock_warmcopy_crash_prepare SET v=21 WHERE id=2;
SELECT id, v FROM t_lock_warmcopy_crash_prepare ORDER BY id;
id	v
1	10
2	21
DROP TABLE t_lock_warmcopy_crash_prepare;
