DROP TABLE IF EXISTS t_lock_warmcopy_explicit_to_implicit;
SET GLOBAL preserve_trx_enable=ON;
SET GLOBAL preserve_trx_warmcopy_enable=OFF;
SET GLOBAL preserve_trx_lock_warmcopy_enable=ON;
SET GLOBAL preserve_trx_lock_warmcopy_fallback_to_live_export=OFF;
SET GLOBAL preserve_trx_recovery_max_count=10;
CREATE TABLE t_lock_warmcopy_explicit_to_implicit(
id INT PRIMARY KEY,
v INT,
pad VARBINARY(64)
) ENGINE=InnoDB;
INSERT INTO t_lock_warmcopy_explicit_to_implicit VALUES
(1,10,REPEAT('a',32)),
(3,30,REPEAT('c',32));
START TRANSACTION;
UPDATE t_lock_warmcopy_explicit_to_implicit
SET v=11, pad=REPEAT('x',32)
WHERE id=1;
SAVEPOINT keep_one;
INSERT INTO t_lock_warmcopy_explicit_to_implicit
VALUES(2,20,REPEAT('b',32));
SET innodb_lock_wait_timeout=1;
SELECT id FROM t_lock_warmcopy_explicit_to_implicit
WHERE id=2
FOR UPDATE;
ERROR HY000: Lock wait timeout exceeded; try restarting transaction
SELECT COUNT(*) > 0 AS explicit_insert_lock_materialized
FROM performance_schema.data_locks
WHERE OBJECT_SCHEMA='test'
    AND OBJECT_NAME='t_lock_warmcopy_explicit_to_implicit'
    AND INDEX_NAME='PRIMARY'
    AND LOCK_TYPE='RECORD'
    AND LOCK_STATUS='GRANTED';
explicit_insert_lock_materialized
1
SET DEBUG_SYNC =
'preserve_trx_warmcopy_after_phase1_open SIGNAL lock_wc_explicit_to_implicit_open WAIT_FOR lock_wc_explicit_to_implicit_continue';
DRAIN TRANSACTIONS PRESERVE;
SET DEBUG_SYNC = 'now WAIT_FOR lock_wc_explicit_to_implicit_open TIMEOUT 10';
ROLLBACK TO SAVEPOINT keep_one;
SET DEBUG_SYNC = 'now SIGNAL lock_wc_explicit_to_implicit_continue';
include/assert_grep.inc [lock warmcopy succeeds after explicit record release]
SELECT COUNT(*) AS preserved_count_after_explicit_to_implicit
FROM performance_schema.preserved_transactions;
preserved_count_after_explicit_to_implicit
1
SET innodb_lock_wait_timeout=1;
INSERT INTO t_lock_warmcopy_explicit_to_implicit
VALUES(2,220,REPEAT('z',32));
ERROR HY000: Lock wait timeout exceeded; try restarting transaction
UPDATE t_lock_warmcopy_explicit_to_implicit
SET v=110, pad=REPEAT('q',32)
WHERE id=1;
ERROR HY000: Lock wait timeout exceeded; try restarting transaction
RESUME PRESERVED TRANSACTION 'TOKEN';
COMMIT;
SELECT COUNT(*) AS preserved_count_after_explicit_to_implicit_resume
FROM performance_schema.preserved_transactions;
preserved_count_after_explicit_to_implicit_resume
0
INSERT INTO t_lock_warmcopy_explicit_to_implicit
VALUES(2,220,REPEAT('z',32));
SELECT id, v, pad IN (REPEAT('x',32), REPEAT('z',32), REPEAT('c',32)) AS pad_ok
FROM t_lock_warmcopy_explicit_to_implicit
ORDER BY id;
id	v	pad_ok
1	11	1
2	220	1
3	30	1
DROP TABLE t_lock_warmcopy_explicit_to_implicit;
SET DEBUG_SYNC = 'RESET';
