DROP TABLE IF EXISTS t_lock_warmcopy_spill_fault;
SET GLOBAL preserve_trx_enable=ON;
SET GLOBAL preserve_trx_warmcopy_enable=OFF;
SET GLOBAL preserve_trx_lock_warmcopy_enable=ON;
SET GLOBAL preserve_trx_lock_warmcopy_fallback_to_live_export=OFF;
SET GLOBAL preserve_trx_lock_warmcopy_max_memory_bytes=1;
SET GLOBAL preserve_trx_recovery_max_count=10;
CREATE TABLE t_lock_warmcopy_spill_fault(
id INT PRIMARY KEY,
v INT,
pad VARBINARY(128)
) ENGINE=InnoDB;
INSERT INTO t_lock_warmcopy_spill_fault VALUES(1,10,REPEAT('a',64));
START TRANSACTION;
UPDATE t_lock_warmcopy_spill_fault SET v=11, pad=REPEAT('b',64)
WHERE id=1;
SET SESSION debug='+d,preserve_trx_lock_warmcopy_force_spill_failure';
DRAIN TRANSACTIONS PRESERVE WITH TIMEOUT 300;
ERROR HY000: Resumable transactions across shutdown do not support this operation
include/assert_grep.inc [lock warmcopy spill failure is logged]
SELECT VARIABLE_NAME, CAST(VARIABLE_VALUE AS UNSIGNED) > 0 AS positive
FROM performance_schema.global_status
WHERE VARIABLE_NAME IN (
'Preserve_trx_lock_warmcopy_attempts',
'Preserve_trx_lock_warmcopy_resource_limit',
'Preserve_trx_lock_warmcopy_sealed_invalid',
'Preserve_trx_lock_warmcopy_spill_failures',
'Preserve_trx_lock_warmcopy_strict_reject')
ORDER BY VARIABLE_NAME;
VARIABLE_NAME	positive
Preserve_trx_lock_warmcopy_attempts	1
Preserve_trx_lock_warmcopy_resource_limit	1
Preserve_trx_lock_warmcopy_sealed_invalid	1
Preserve_trx_lock_warmcopy_spill_failures	1
Preserve_trx_lock_warmcopy_strict_reject	1
SET SESSION debug='-d,preserve_trx_lock_warmcopy_force_spill_failure';
ROLLBACK;
START TRANSACTION;
UPDATE t_lock_warmcopy_spill_fault SET v=15, pad=REPEAT('f',64)
WHERE id=1;
SET SESSION debug='+d,preserve_trx_lock_warmcopy_spill_after_tmp_short_write';
DRAIN TRANSACTIONS PRESERVE WITH TIMEOUT 300;
ERROR HY000: Resumable transactions across shutdown do not support this operation
SET SESSION debug='-d,preserve_trx_lock_warmcopy_spill_after_tmp_short_write';
ROLLBACK;
START TRANSACTION;
UPDATE t_lock_warmcopy_spill_fault SET v=16, pad=REPEAT('g',64)
WHERE id=1;
SET SESSION debug='+d,preserve_trx_lock_warmcopy_spill_segment_fsync_failure';
DRAIN TRANSACTIONS PRESERVE WITH TIMEOUT 300;
ERROR HY000: Resumable transactions across shutdown do not support this operation
SET SESSION debug='-d,preserve_trx_lock_warmcopy_spill_segment_fsync_failure';
ROLLBACK;
START TRANSACTION;
UPDATE t_lock_warmcopy_spill_fault SET v=17, pad=REPEAT('h',64)
WHERE id=1;
SET SESSION debug='+d,preserve_trx_lock_warmcopy_spill_after_tmp_write_before_rename';
DRAIN TRANSACTIONS PRESERVE WITH TIMEOUT 300;
ERROR HY000: Resumable transactions across shutdown do not support this operation
SET SESSION debug='-d,preserve_trx_lock_warmcopy_spill_after_tmp_write_before_rename';
ROLLBACK;
START TRANSACTION;
UPDATE t_lock_warmcopy_spill_fault SET v=18, pad=REPEAT('i',64)
WHERE id=1;
SET SESSION debug='+d,preserve_trx_lock_warmcopy_spill_parent_dir_fsync_failure';
DRAIN TRANSACTIONS PRESERVE WITH TIMEOUT 300;
ERROR HY000: Resumable transactions across shutdown do not support this operation
SET SESSION debug='-d,preserve_trx_lock_warmcopy_spill_parent_dir_fsync_failure';
ROLLBACK;
START TRANSACTION;
UPDATE t_lock_warmcopy_spill_fault SET v=13, pad=REPEAT('d',64)
WHERE id=1;
SET SESSION debug='+d,preserve_trx_lock_warmcopy_spill_manifest_short_write';
DRAIN TRANSACTIONS PRESERVE WITH TIMEOUT 300;
ERROR HY000: Resumable transactions across shutdown do not support this operation
SELECT VARIABLE_NAME, CAST(VARIABLE_VALUE AS UNSIGNED) > 0 AS positive
FROM performance_schema.global_status
WHERE VARIABLE_NAME IN (
'Preserve_trx_lock_warmcopy_resource_limit',
'Preserve_trx_lock_warmcopy_sealed_invalid',
'Preserve_trx_lock_warmcopy_spill_failures',
'Preserve_trx_lock_warmcopy_strict_reject')
ORDER BY VARIABLE_NAME;
VARIABLE_NAME	positive
Preserve_trx_lock_warmcopy_resource_limit	1
Preserve_trx_lock_warmcopy_sealed_invalid	1
Preserve_trx_lock_warmcopy_spill_failures	1
Preserve_trx_lock_warmcopy_strict_reject	1
SET SESSION debug='-d,preserve_trx_lock_warmcopy_spill_manifest_short_write';
ROLLBACK;
START TRANSACTION;
UPDATE t_lock_warmcopy_spill_fault SET v=19, pad=REPEAT('j',64)
WHERE id=1;
SET SESSION debug='+d,preserve_trx_lock_warmcopy_spill_manifest_fsync_failure';
DRAIN TRANSACTIONS PRESERVE WITH TIMEOUT 300;
ERROR HY000: Resumable transactions across shutdown do not support this operation
SET SESSION debug='-d,preserve_trx_lock_warmcopy_spill_manifest_fsync_failure';
ROLLBACK;
START TRANSACTION;
UPDATE t_lock_warmcopy_spill_fault SET v=20, pad=REPEAT('k',64)
WHERE id=1;
SET SESSION debug='+d,preserve_trx_lock_warmcopy_spill_manifest_before_rename';
DRAIN TRANSACTIONS PRESERVE WITH TIMEOUT 300;
ERROR HY000: Resumable transactions across shutdown do not support this operation
SET SESSION debug='-d,preserve_trx_lock_warmcopy_spill_manifest_before_rename';
ROLLBACK;
START TRANSACTION;
UPDATE t_lock_warmcopy_spill_fault SET v=21, pad=REPEAT('l',64)
WHERE id=1;
SET SESSION debug='+d,preserve_trx_lock_warmcopy_spill_manifest_parent_dir_fsync_failure';
DRAIN TRANSACTIONS PRESERVE WITH TIMEOUT 300;
ERROR HY000: Resumable transactions across shutdown do not support this operation
SET SESSION debug='-d,preserve_trx_lock_warmcopy_spill_manifest_parent_dir_fsync_failure';
ROLLBACK;
START TRANSACTION;
UPDATE t_lock_warmcopy_spill_fault SET v=14, pad=REPEAT('e',64)
WHERE id=1;
SET SESSION debug='+d,preserve_trx_lock_warmcopy_spill_orphan_cleanup_failure';
DRAIN TRANSACTIONS PRESERVE WITH TIMEOUT 300;
ERROR HY000: Resumable transactions across shutdown do not support this operation
SET SESSION debug='-d,preserve_trx_lock_warmcopy_spill_orphan_cleanup_failure';
ROLLBACK;
SET GLOBAL preserve_trx_lock_warmcopy_fallback_to_live_export=ON;
START TRANSACTION;
UPDATE t_lock_warmcopy_spill_fault SET v=12, pad=REPEAT('c',64)
WHERE id=1;
SET SESSION debug='+d,preserve_trx_lock_warmcopy_spill_manifest_short_write';
DRAIN TRANSACTIONS PRESERVE WITH TIMEOUT 300;
SELECT COUNT(*) AS preserved_count_after_spill_fault_fallback
FROM performance_schema.preserved_transactions;
preserved_count_after_spill_fault_fallback
1
RESUME PRESERVED TRANSACTION 'TOKEN';
COMMIT;
SELECT COUNT(*) AS preserved_count_after_spill_fault_resume
FROM performance_schema.preserved_transactions;
preserved_count_after_spill_fault_resume
0
SELECT id, v, pad=REPEAT('c',64) AS pad_ok
FROM t_lock_warmcopy_spill_fault
ORDER BY id;
id	v	pad_ok
1	12	1
DROP TABLE t_lock_warmcopy_spill_fault;
