DROP TABLE IF EXISTS t_global_off;
SET GLOBAL preserve_trx_enable=ON;
CREATE TABLE t_global_off(a INT PRIMARY KEY, b INT) ENGINE=InnoDB;
INSERT INTO t_global_off VALUES(1,10);
START TRANSACTION;
SELECT * FROM t_global_off WHERE a=1 FOR UPDATE;
a	b
1	10
UPDATE t_global_off SET b=11 WHERE a=1;
DRAIN TRANSACTIONS PRESERVE;
SELECT @@global.log_bin AS log_bin_after_restart;
log_bin_after_restart
0
SELECT TOKEN, BINLOG_STATE, WROTE_TO_CACHE, BINLOG_CACHE_SIZE, GLOBAL_LOG_BIN
FROM performance_schema.preserved_transactions;
TOKEN	BINLOG_STATE	WROTE_TO_CACHE	BINLOG_CACHE_SIZE	GLOBAL_LOG_BIN
TOKEN	GLOBAL_OFF_NO_CACHE	NO	0	OFF
SELECT * FROM t_global_off WHERE a=1;
a	b
1	10
SELECT * FROM t_global_off WHERE a=1;
a	b
1	10
RESUME PRESERVED TRANSACTION 'TOKEN';
SELECT * FROM t_global_off WHERE a=1;
a	b
1	11
UPDATE t_global_off SET b=12 WHERE a=1;
COMMIT;
SELECT * FROM t_global_off WHERE a=1;
a	b
1	12
DROP TABLE t_global_off;
SET GLOBAL preserve_trx_enable=ON;
