DROP TABLE IF EXISTS t_binlog_cache_size_limit;
SET GLOBAL preserve_trx_enable=ON;
SET @saved_preserve_trx_max_binlog_cache_bytes=@@GLOBAL.preserve_trx_max_binlog_cache_bytes;
SET GLOBAL preserve_trx_max_binlog_cache_bytes=1;
CREATE TABLE t_binlog_cache_size_limit(a INT PRIMARY KEY, b INT) ENGINE=InnoDB;
INSERT INTO t_binlog_cache_size_limit VALUES(1,10);
RESET MASTER;
START TRANSACTION;
UPDATE t_binlog_cache_size_limit SET b=11 WHERE a=1;
DRAIN TRANSACTIONS PRESERVE WITH TIMEOUT 300;
ERROR HY000: Resumable transactions across shutdown do not support this operation
SELECT COUNT(*) AS preserved_count
FROM performance_schema.preserved_transactions;
preserved_count
0
SELECT * FROM t_binlog_cache_size_limit ORDER BY a;
a	b
1	11
ROLLBACK;
SELECT * FROM t_binlog_cache_size_limit ORDER BY a;
a	b
1	10
START TRANSACTION;
UPDATE t_binlog_cache_size_limit SET b=12 WHERE a=1;
COMMIT;
SELECT * FROM t_binlog_cache_size_limit ORDER BY a;
a	b
1	12
include/assert_grep.inc [Rolled back over-limit preserved transaction is discarded from binlog cache]
include/assert_grep.inc [Later committed transaction remains in binlog after over-limit preserve failure]
DROP TABLE t_binlog_cache_size_limit;
SET GLOBAL preserve_trx_max_binlog_cache_bytes=@saved_preserve_trx_max_binlog_cache_bytes;
SET GLOBAL preserve_trx_enable=ON;
