DROP TABLE IF EXISTS t_global_off_to_on;
SET GLOBAL preserve_trx_enable=ON;
CREATE TABLE t_global_off_to_on(a INT PRIMARY KEY, b INT) ENGINE=InnoDB;
INSERT INTO t_global_off_to_on VALUES(1,10);
START TRANSACTION;
SELECT * FROM t_global_off_to_on WHERE a=1 FOR UPDATE;
a	b
1	10
UPDATE t_global_off_to_on SET b=11 WHERE a=1;
DRAIN TRANSACTIONS PRESERVE;
# restart: --preserve-trx-enable=ON --log-bin=MYSQLTEST_VARDIR/log/preserve_trx_on-bin
include/wait_for_pattern_in_file.inc [Preserved transaction .* rejected because snapshot binlog_state=GLOBAL_OFF_NO_CACHE requires log_bin=OFF]
SELECT * FROM t_global_off_to_on WHERE a=1;
a	b
1	10
# restart: --preserve-trx-enable=ON --skip-log-bin
DROP TABLE t_global_off_to_on;
SET GLOBAL preserve_trx_enable=ON;
