DROP TABLE IF EXISTS t_preserve_fault_binlog_cache;
SET GLOBAL preserve_trx_enable=ON;
SET @saved_preserve_trx_warmcopy_enable=@@GLOBAL.preserve_trx_warmcopy_enable;
SET GLOBAL preserve_trx_warmcopy_enable=OFF;
CREATE TABLE t_preserve_fault_binlog_cache(a INT PRIMARY KEY, b INT)
ENGINE=InnoDB;
INSERT INTO t_preserve_fault_binlog_cache VALUES(1,10);
RESET MASTER;
SET SESSION debug="+d,preserve_trx_fail_before_binlog_cache_payload_rename,preserve_trx_assert_original_binlog_cache_clean_after_detach";
START TRANSACTION;
UPDATE t_preserve_fault_binlog_cache SET b=11 WHERE a=1;
DRAIN TRANSACTIONS PRESERVE;
ERROR HY000: Resumable transactions across shutdown do not support this operation
SET SESSION debug="-d,preserve_trx_fail_before_binlog_cache_payload_rename,preserve_trx_assert_original_binlog_cache_clean_after_detach";
SELECT * FROM t_preserve_fault_binlog_cache WHERE a=1;
a	b
1	11
ROLLBACK;
SELECT * FROM t_preserve_fault_binlog_cache WHERE a=1;
a	b
1	10
START TRANSACTION;
UPDATE t_preserve_fault_binlog_cache SET b=12 WHERE a=1;
COMMIT;
SELECT COUNT(*) AS preserved_count
FROM performance_schema.preserved_transactions;
preserved_count
0
SELECT * FROM t_preserve_fault_binlog_cache WHERE a=1;
a	b
1	12
include/assert_grep.inc [New transaction remains in binlog after detach failure cleanup]
include/assert_grep.inc [Rolled back detached transaction is discarded from binlog cache]
SET SESSION debug="+d,preserve_trx_fail_binlog_cache_directory_fsync,preserve_trx_assert_original_binlog_cache_clean_after_detach";
START TRANSACTION;
UPDATE t_preserve_fault_binlog_cache SET b=13 WHERE a=1;
DRAIN TRANSACTIONS PRESERVE;
ERROR HY000: Resumable transactions across shutdown do not support this operation
SET SESSION debug="-d,preserve_trx_fail_binlog_cache_directory_fsync,preserve_trx_assert_original_binlog_cache_clean_after_detach";
SELECT * FROM t_preserve_fault_binlog_cache WHERE a=1;
a	b
1	13
ROLLBACK;
SELECT * FROM t_preserve_fault_binlog_cache WHERE a=1;
a	b
1	12
START TRANSACTION;
UPDATE t_preserve_fault_binlog_cache SET b=14 WHERE a=1;
COMMIT;
SELECT COUNT(*) AS preserved_count
FROM performance_schema.preserved_transactions;
preserved_count
0
SELECT * FROM t_preserve_fault_binlog_cache WHERE a=1;
a	b
1	14
include/assert_grep.inc [New transaction remains in binlog after binlog cache directory fsync failure cleanup]
include/assert_grep.inc [Rolled back detached transaction is discarded after binlog cache directory fsync failure]
DROP TABLE t_preserve_fault_binlog_cache;
SET GLOBAL preserve_trx_warmcopy_enable=@saved_preserve_trx_warmcopy_enable;
SET GLOBAL preserve_trx_enable=ON;
