DROP TABLE IF EXISTS t_gtid_mode_flip;
SET GLOBAL rds_preserve_trx_enable=ON;
SET SESSION sql_log_bin=0;
CREATE TABLE t_gtid_mode_flip(a INT PRIMARY KEY, b INT) ENGINE=InnoDB;
INSERT INTO t_gtid_mode_flip VALUES(1,10);
SET SESSION sql_log_bin=1;
RESET MASTER;
SELECT @@GLOBAL.GTID_MODE AS gtid_mode_before;
gtid_mode_before
ON
START TRANSACTION;
UPDATE t_gtid_mode_flip SET b=11 WHERE a=1;
DRAIN TRANSACTIONS PRESERVE;
# restart: --rds-preserve-trx-enable=ON --gtid-mode=OFF --enforce-gtid-consistency=OFF
SELECT @@GLOBAL.GTID_MODE AS gtid_mode_after_restart;
gtid_mode_after_restart
OFF
SELECT COUNT(*) AS preserved_count
FROM performance_schema.preserved_transactions;
preserved_count
0
SELECT * FROM t_gtid_mode_flip WHERE a=1;
a	b
1	10
SET SESSION lock_wait_timeout=1;
SET SESSION sql_log_bin=0;
DROP TABLE t_gtid_mode_flip;
SET SESSION sql_log_bin=1;
RESET MASTER;
# restart: --rds-preserve-trx-enable=ON --gtid-mode=ON --enforce-gtid-consistency
SET GLOBAL rds_preserve_trx_enable=ON;
