DROP TABLE IF EXISTS t_preserve_scan_limit;
DROP TABLE IF EXISTS t_preserve_lock_limit;
DROP TABLE IF EXISTS t_preserve_explicit_update_limit;
DROP TABLE IF EXISTS t_preserve_export_lock_limit;
DROP TABLE IF EXISTS t_preserve_timeout_limit;
DROP TABLE IF EXISTS t_preserve_table_limit_a;
DROP TABLE IF EXISTS t_preserve_table_limit_b;
DROP TABLE IF EXISTS t_preserve_shared_lock_budget;
DROP TABLE IF EXISTS t_preserve_sec_scan_budget;
SET GLOBAL preserve_trx_enable=ON;
SET @saved_preserve_trx_max_scan_pages=@@GLOBAL.preserve_trx_max_scan_pages;
SET @saved_preserve_trx_max_lock_count=@@GLOBAL.preserve_trx_max_lock_count;
SET @saved_preserve_trx_materialize_timeout_ms=@@GLOBAL.preserve_trx_materialize_timeout_ms;
SET @saved_preserve_trx_max_modified_tables=@@GLOBAL.preserve_trx_max_modified_tables;
CREATE TABLE t_preserve_scan_limit(id INT PRIMARY KEY, v INT) ENGINE=InnoDB;
SET GLOBAL preserve_trx_max_scan_pages=0;
START TRANSACTION;
INSERT INTO t_preserve_scan_limit VALUES(1,10);
PREPARE SHUTDOWN PRESERVE TRANSACTION WITH TIMEOUT 300;
ERROR HY000: Resumable transactions across shutdown do not support this operation
SELECT COUNT(*) AS visible_before_rollback FROM t_preserve_scan_limit;
visible_before_rollback
1
ROLLBACK;
SELECT COUNT(*) AS visible_after_rollback FROM t_preserve_scan_limit;
visible_after_rollback
0
SET GLOBAL preserve_trx_max_scan_pages=@saved_preserve_trx_max_scan_pages;
CREATE TABLE t_preserve_lock_limit(id INT PRIMARY KEY, v INT) ENGINE=InnoDB;
SET GLOBAL preserve_trx_max_lock_count=1;
START TRANSACTION;
INSERT INTO t_preserve_lock_limit VALUES(1,10),(2,20);
PREPARE SHUTDOWN PRESERVE TRANSACTION WITH TIMEOUT 300;
ERROR HY000: Resumable transactions across shutdown do not support this operation
SHOW WARNINGS;
Level	Code	Message
Warning	####	PRESERVE materialized implicit record locks before rejecting the transaction; the transaction remains active with equivalent or stronger InnoDB record locks
Error	####	Resumable transactions across shutdown do not support this operation
SELECT COUNT(*) AS visible_before_rollback FROM t_preserve_lock_limit;
visible_before_rollback
2
ROLLBACK;
SELECT COUNT(*) AS visible_after_rollback FROM t_preserve_lock_limit;
visible_after_rollback
0
SET GLOBAL preserve_trx_max_lock_count=@saved_preserve_trx_max_lock_count;
CREATE TABLE t_preserve_explicit_update_limit(id INT PRIMARY KEY, v INT)
ENGINE=InnoDB;
INSERT INTO t_preserve_explicit_update_limit VALUES(1,10),(2,20);
SET GLOBAL preserve_trx_max_lock_count=1;
START TRANSACTION;
UPDATE t_preserve_explicit_update_limit SET v=v+100;
PREPARE SHUTDOWN PRESERVE TRANSACTION WITH TIMEOUT 300;
ERROR HY000: Resumable transactions across shutdown do not support this operation
SHOW WARNINGS;
Level	Code	Message
Error	####	Resumable transactions across shutdown do not support this operation
SET innodb_lock_wait_timeout=1;
UPDATE t_preserve_explicit_update_limit SET v=11 WHERE id=1;
ERROR HY000: Lock wait timeout exceeded; try restarting transaction
SELECT * FROM t_preserve_explicit_update_limit ORDER BY id;
id	v
1	110
2	120
ROLLBACK;
SELECT * FROM t_preserve_explicit_update_limit ORDER BY id;
id	v
1	10
2	20
SET GLOBAL preserve_trx_max_lock_count=@saved_preserve_trx_max_lock_count;
CREATE TABLE t_preserve_export_lock_limit(id INT PRIMARY KEY, v INT) ENGINE=InnoDB;
INSERT INTO t_preserve_export_lock_limit VALUES(1,10),(2,20);
SET GLOBAL preserve_trx_max_lock_count=1;
START TRANSACTION;
UPDATE t_preserve_export_lock_limit SET v=11 WHERE id=1;
SELECT id FROM t_preserve_export_lock_limit WHERE id=2 FOR UPDATE;
id
2
PREPARE SHUTDOWN PRESERVE TRANSACTION WITH TIMEOUT 300;
ERROR HY000: Resumable transactions across shutdown do not support this operation
SET innodb_lock_wait_timeout=1;
UPDATE t_preserve_export_lock_limit SET v=21 WHERE id=2;
ERROR HY000: Lock wait timeout exceeded; try restarting transaction
SELECT * FROM t_preserve_export_lock_limit ORDER BY id;
id	v
1	11
2	20
ROLLBACK;
SELECT * FROM t_preserve_export_lock_limit ORDER BY id;
id	v
1	10
2	20
SET GLOBAL preserve_trx_max_lock_count=@saved_preserve_trx_max_lock_count;
CREATE TABLE t_preserve_timeout_limit(id INT PRIMARY KEY, v INT) ENGINE=InnoDB;
SET GLOBAL preserve_trx_materialize_timeout_ms=0;
START TRANSACTION;
INSERT INTO t_preserve_timeout_limit VALUES(1,10);
PREPARE SHUTDOWN PRESERVE TRANSACTION WITH TIMEOUT 300;
ERROR HY000: Resumable transactions across shutdown do not support this operation
SELECT COUNT(*) AS visible_before_rollback FROM t_preserve_timeout_limit;
visible_before_rollback
1
ROLLBACK;
SELECT COUNT(*) AS visible_after_rollback FROM t_preserve_timeout_limit;
visible_after_rollback
0
SET GLOBAL preserve_trx_materialize_timeout_ms=@saved_preserve_trx_materialize_timeout_ms;
CREATE TABLE t_preserve_table_limit_a(id INT PRIMARY KEY, v INT) ENGINE=InnoDB;
CREATE TABLE t_preserve_table_limit_b(id INT PRIMARY KEY, v INT) ENGINE=InnoDB;
SET GLOBAL preserve_trx_max_modified_tables=1;
START TRANSACTION;
INSERT INTO t_preserve_table_limit_a VALUES(1,10);
INSERT INTO t_preserve_table_limit_b VALUES(1,20);
PREPARE SHUTDOWN PRESERVE TRANSACTION WITH TIMEOUT 300;
ERROR HY000: Resumable transactions across shutdown do not support this operation
SELECT COUNT(*) AS visible_before_rollback FROM t_preserve_table_limit_a;
visible_before_rollback
1
SELECT COUNT(*) AS visible_before_rollback FROM t_preserve_table_limit_b;
visible_before_rollback
1
ROLLBACK;
SELECT COUNT(*) AS visible_after_rollback FROM t_preserve_table_limit_a;
visible_after_rollback
0
SELECT COUNT(*) AS visible_after_rollback FROM t_preserve_table_limit_b;
visible_after_rollback
0
SET GLOBAL preserve_trx_max_modified_tables=@saved_preserve_trx_max_modified_tables;
CREATE TABLE t_preserve_shared_lock_budget(
id INT PRIMARY KEY,
v INT
) ENGINE=InnoDB;
INSERT INTO t_preserve_shared_lock_budget VALUES(1,10),(2,20);
SET GLOBAL preserve_trx_max_lock_count=2;
START TRANSACTION;
UPDATE t_preserve_shared_lock_budget SET v=v+1 WHERE id IN (1,2);
PREPARE SHUTDOWN PRESERVE TRANSACTION WITH TIMEOUT 300;
ERROR HY000: Resumable transactions across shutdown do not support this operation
SELECT SUM(v) AS visible_before_rollback FROM t_preserve_shared_lock_budget;
visible_before_rollback
32
ROLLBACK;
SELECT SUM(v) AS visible_after_rollback FROM t_preserve_shared_lock_budget;
visible_after_rollback
30
SET GLOBAL preserve_trx_max_lock_count=@saved_preserve_trx_max_lock_count;
DROP TABLE t_preserve_shared_lock_budget;
CREATE TABLE t_preserve_sec_scan_budget(
id INT PRIMARY KEY,
k INT,
v INT,
KEY k_idx(k)
) ENGINE=InnoDB;
SET GLOBAL preserve_trx_max_scan_pages=1;
START TRANSACTION;
INSERT INTO t_preserve_sec_scan_budget VALUES(1,100,10);
PREPARE SHUTDOWN PRESERVE TRANSACTION WITH TIMEOUT 300;
ERROR HY000: Resumable transactions across shutdown do not support this operation
SELECT COUNT(*) AS visible_before_rollback FROM t_preserve_sec_scan_budget;
visible_before_rollback
1
ROLLBACK;
SELECT COUNT(*) AS visible_after_rollback FROM t_preserve_sec_scan_budget;
visible_after_rollback
0
SET GLOBAL preserve_trx_max_scan_pages=@saved_preserve_trx_max_scan_pages;
DROP TABLE t_preserve_sec_scan_budget;
DROP TABLE t_preserve_table_limit_b;
DROP TABLE t_preserve_table_limit_a;
DROP TABLE t_preserve_timeout_limit;
DROP TABLE t_preserve_export_lock_limit;
DROP TABLE t_preserve_explicit_update_limit;
DROP TABLE t_preserve_lock_limit;
DROP TABLE t_preserve_scan_limit;
SET GLOBAL preserve_trx_enable=ON;
