DROP TABLE IF EXISTS t_implicit_lock_count_cap;
SET GLOBAL preserve_trx_enable=ON;
CREATE TABLE t_implicit_lock_count_cap(
id INT PRIMARY KEY,
v INT
) ENGINE=InnoDB;
INSERT INTO t_implicit_lock_count_cap VALUES(1,0),(2,0);
SET GLOBAL preserve_trx_max_lock_count=2;
START TRANSACTION;
UPDATE t_implicit_lock_count_cap SET v=v+10 WHERE id=1;
DRAIN TRANSACTIONS PRESERVE;
SELECT LOCKS_COUNT AS preserved_locks_count
FROM performance_schema.preserved_transactions;
preserved_locks_count
2
RESUME PRESERVED TRANSACTION 'TOKEN';
ROLLBACK;
START TRANSACTION;
UPDATE t_implicit_lock_count_cap SET v=v+10;
DRAIN TRANSACTIONS PRESERVE;
ERROR HY000: Resumable transactions across shutdown do not support this operation
SELECT SUM(v) AS visible_before_rollback
FROM t_implicit_lock_count_cap;
visible_before_rollback
20
ROLLBACK;
SELECT SUM(v) AS visible_after_rollback
FROM t_implicit_lock_count_cap;
visible_after_rollback
0
SET GLOBAL preserve_trx_max_lock_count=2000;
DROP TABLE t_implicit_lock_count_cap;
SET GLOBAL preserve_trx_enable=ON;
