DROP TABLE IF EXISTS t_kernel_preflight;
SET GLOBAL preserve_trx_enable=ON;
CREATE TABLE t_kernel_preflight(id INT PRIMARY KEY, v INT) ENGINE=InnoDB;
INSERT INTO t_kernel_preflight VALUES (1, 10);
START TRANSACTION;
SELECT v FROM t_kernel_preflight WHERE id = 1;
v
10
UPDATE t_kernel_preflight SET v = v + 1 WHERE id = 1;
SET SESSION debug='+d,preserve_trx_debug_kernel_preflight_observable';
PREPARE SHUTDOWN PRESERVE TRANSACTION;
ERROR HY000: Resumable transactions across shutdown do not support this operation
SET SESSION debug='-d,preserve_trx_debug_kernel_preflight_observable';
SELECT TOKEN, STATE, MOD_TABLES_COUNT, HAS_READ_VIEW, LAST_ERROR
FROM performance_schema.preserved_transactions
WHERE TOKEN='debug-kernel-preflight-token';
TOKEN	STATE	MOD_TABLES_COUNT	HAS_READ_VIEW	LAST_ERROR
debug-kernel-preflight-token	FAILED	1	YES	kernel preflight: read_view=1 no_redo_undo=0 no_redo_state_ok=1 no_redo_present=0 top_undo_no=0 autoinc_locks=0 modified_tables_ok=1 modified_tables=1 first_table=test/t_kernel_preflight
ROLLBACK;
SET SESSION debug='+d,preserve_trx_clear_debug_observable_records';
SELECT COUNT(*) AS after_clear
FROM performance_schema.preserved_transactions
WHERE TOKEN='debug-kernel-preflight-token';
after_clear
0
SET SESSION debug='-d,preserve_trx_clear_debug_observable_records';
DROP TABLE t_kernel_preflight;
SET GLOBAL preserve_trx_enable=OFF;
