DROP TABLE IF EXISTS t_preserve_kill_after_undo_binlog;
SET GLOBAL preserve_trx_enable=ON;
CREATE TABLE t_preserve_kill_after_undo_binlog(a INT PRIMARY KEY, b INT)
ENGINE=InnoDB;
INSERT INTO t_preserve_kill_after_undo_binlog VALUES(1,10);
RESET MASTER;
SET DEBUG_SYNC =
'preserve_trx_after_undo_prepared_before_kill_check SIGNAL after_undo_prepared WAIT_FOR continue_after_undo_prepared';
START TRANSACTION;
UPDATE t_preserve_kill_after_undo_binlog SET b=11 WHERE a=1;
DRAIN TRANSACTIONS PRESERVE WITH TIMEOUT 300;
SET DEBUG_SYNC = 'now WAIT_FOR after_undo_prepared TIMEOUT 10';
KILL CONNECTION CONN_ID;
SET DEBUG_SYNC = 'now SIGNAL continue_after_undo_prepared';
SELECT 1;
ERROR HY000: MySQL server has gone away
ERROR HY000: Resumable transactions across shutdown do not support this operation
SELECT * FROM t_preserve_kill_after_undo_binlog WHERE a=1;
a	b
1	10
SELECT COUNT(*) AS preserved_count
FROM performance_schema.preserved_transactions;
preserved_count
0
START TRANSACTION;
UPDATE t_preserve_kill_after_undo_binlog SET b=12 WHERE a=1;
COMMIT;
SELECT * FROM t_preserve_kill_after_undo_binlog WHERE a=1;
a	b
1	12
include/assert_grep.inc [New transaction remains in binlog after post-prepare kill cleanup]
include/assert_grep.inc [Killed post-prepare preserve transaction is discarded from binlog cache]
DROP TABLE t_preserve_kill_after_undo_binlog;
SET GLOBAL preserve_trx_enable=ON;
