DROP TABLE IF EXISTS t_preserve_kill_connection;
SET GLOBAL preserve_trx_enable=ON;
CREATE TABLE t_preserve_kill_connection(a INT PRIMARY KEY, b INT)
ENGINE=InnoDB;
INSERT INTO t_preserve_kill_connection VALUES(1,10);
SET DEBUG_SYNC =
'preserve_trx_after_lock_materialization SIGNAL before_durable_conn WAIT_FOR continue_preserve_conn';
START TRANSACTION;
UPDATE t_preserve_kill_connection SET b=11 WHERE a=1;
PREPARE SHUTDOWN PRESERVE TRANSACTION WITH TIMEOUT 300;
SET DEBUG_SYNC = 'now WAIT_FOR before_durable_conn TIMEOUT 10';
KILL CONNECTION CONN_ID;
SET DEBUG_SYNC = 'now SIGNAL continue_preserve_conn';
ERROR HY000: Lost connection to MySQL server during query
SELECT * FROM t_preserve_kill_connection WHERE a=1;
a	b
1	10
SELECT COUNT(*) AS preserved_count
FROM performance_schema.preserved_transactions;
preserved_count
0
SET SESSION debug="+d,preserve_trx_fail_delete_snapshot_files";
SET DEBUG_SYNC =
'preserve_trx_before_token_delivery SIGNAL before_token_delivery WAIT_FOR continue_token_delivery';
START TRANSACTION;
UPDATE t_preserve_kill_connection SET b=12 WHERE a=1;
PREPARE SHUTDOWN PRESERVE TRANSACTION WITH TIMEOUT 300;
SET DEBUG_SYNC = 'now WAIT_FOR before_token_delivery TIMEOUT 10';
KILL CONNECTION CONN_ID;
SET DEBUG_SYNC = 'now SIGNAL continue_token_delivery';
ERROR HY000: Lost connection to MySQL server during query
SELECT * FROM t_preserve_kill_connection WHERE a=1;
a	b
1	10
SELECT COUNT(*) AS preserved_count
FROM performance_schema.preserved_transactions;
preserved_count
0
Occurrences of 'token delivery cleanup failed' in the input file: 1
Occurrences of 'recovery cleanup failed: failed to delete snapshot files' in the input file: 1
DROP TABLE t_preserve_kill_connection;
SET GLOBAL preserve_trx_enable=ON;
