DROP TABLE IF EXISTS t_lock_only_modified;
DROP TABLE IF EXISTS t_lock_only_locked;
SET GLOBAL preserve_trx_enable=ON;
CREATE TABLE t_lock_only_modified(
id INT PRIMARY KEY,
v INT
) ENGINE=InnoDB;
CREATE TABLE t_lock_only_locked(
id INT PRIMARY KEY,
v INT
) ENGINE=InnoDB;
INSERT INTO t_lock_only_modified VALUES(1,10),(2,20);
INSERT INTO t_lock_only_locked VALUES(1,100),(2,200);
SET SESSION TRANSACTION ISOLATION LEVEL REPEATABLE READ;
START TRANSACTION;
UPDATE t_lock_only_modified SET v=11 WHERE id=1;
SELECT * FROM t_lock_only_locked WHERE id=1 FOR UPDATE;
id	v
1	100
DRAIN TRANSACTIONS PRESERVE;
SELECT LOCKS_COUNT >= 2 AS restored_modified_and_lock_only_table_locks
FROM performance_schema.preserved_transactions;
restored_modified_and_lock_only_table_locks
1
SET SESSION innodb_lock_wait_timeout=1;
UPDATE t_lock_only_locked SET v=101 WHERE id=1;
ERROR HY000: Lock wait timeout exceeded; try restarting transaction
RESUME PRESERVED TRANSACTION 'TOKEN';
COMMIT;
UPDATE t_lock_only_locked SET v=101 WHERE id=1;
SELECT * FROM t_lock_only_modified ORDER BY id;
id	v
1	11
2	20
SELECT * FROM t_lock_only_locked ORDER BY id;
id	v
1	101
2	200
DROP TABLE t_lock_only_modified;
DROP TABLE t_lock_only_locked;
SET GLOBAL preserve_trx_enable=ON;
