DROP TABLE IF EXISTS t_preserve_read_error_distinct;
SET GLOBAL rds_preserve_trx_enable=ON;
CREATE TABLE t_preserve_read_error_distinct(
a INT PRIMARY KEY,
b INT
) ENGINE=InnoDB;
INSERT INTO t_preserve_read_error_distinct VALUES(1,10),(2,20);
START TRANSACTION;
UPDATE t_preserve_read_error_distinct SET b=11 WHERE a=1;
DRAIN TRANSACTIONS PRESERVE;
# restart: --rds-preserve-trx-enable=ON --skip-log-bin
include/wait_for_pattern_in_file.inc [Preserved transaction .* recovery forced rollback: preserved transaction snapshot tainted: startup snapshot is unreadable or mismatched]
SELECT COUNT(*) AS preserved_count_after_corrupt_read
FROM performance_schema.preserved_transactions;
preserved_count_after_corrupt_read
0
SELECT * FROM t_preserve_read_error_distinct WHERE a=1;
a	b
1	10
START TRANSACTION;
UPDATE t_preserve_read_error_distinct SET b=21 WHERE a=2;
DRAIN TRANSACTIONS PRESERVE;
# restart_abort: --rds-preserve-trx-enable=ON --skip-log-bin --debug=d,preserve_trx_fail_snapshot_read_io
include/wait_for_pattern_in_file.inc [Preserved transaction .* recovery failed: I/O error reading durable transaction snapshot]
include/wait_for_expected_crash.inc [safe_process]
SELECT COUNT(*) AS preserved_count_after_io_read
FROM performance_schema.preserved_transactions;
preserved_count_after_io_read
0
SELECT * FROM t_preserve_read_error_distinct ORDER BY a;
a	b
1	10
2	20
DROP TABLE t_preserve_read_error_distinct;
SET GLOBAL rds_preserve_trx_enable=ON;
