DROP TABLE IF EXISTS t_preserve_tx_read_only;
SET GLOBAL preserve_trx_enable=ON;
CREATE TABLE t_preserve_tx_read_only(a INT PRIMARY KEY, b INT) ENGINE=InnoDB;
INSERT INTO t_preserve_tx_read_only VALUES(1,10);
SET SESSION transaction_read_only=ON;
START TRANSACTION READ WRITE;
UPDATE t_preserve_tx_read_only SET b=11 WHERE a=1;
DRAIN TRANSACTIONS PRESERVE WITH TIMEOUT 300;
SET SESSION transaction_read_only=OFF;
SELECT @@session.transaction_read_only AS session_read_only_before_resume;
session_read_only_before_resume
0
RESUME PRESERVED TRANSACTION 'TOKEN';
SELECT @@session.transaction_read_only AS session_read_only_after_resume;
session_read_only_after_resume
1
UPDATE t_preserve_tx_read_only SET b=12 WHERE a=1;
COMMIT;
SELECT @@session.transaction_read_only AS session_read_only_after_commit;
session_read_only_after_commit
1
START TRANSACTION;
UPDATE t_preserve_tx_read_only SET b=13 WHERE a=1;
ERROR 25006: Cannot execute statement in a READ ONLY transaction.
ROLLBACK;
SET SESSION transaction_read_only=OFF;
SELECT * FROM t_preserve_tx_read_only ORDER BY a;
a	b
1	12
DROP TABLE t_preserve_tx_read_only;
SET GLOBAL preserve_trx_enable=ON;
