SELECT @@global.rds_preserve_trx_enable AS preserve_enable_default_on;
preserve_enable_default_on
1
SELECT @@global.rds_preserve_trx_temp_table_enable AS temp_table_enable_default_on;
temp_table_enable_default_on
1
DROP TABLE IF EXISTS t_preserve_default_on;
CREATE TABLE t_preserve_default_on(
id INT PRIMARY KEY,
v INT
) ENGINE=InnoDB;
INSERT INTO t_preserve_default_on VALUES(1, 10);
START TRANSACTION;
UPDATE t_preserve_default_on SET v = 11 WHERE id = 1;
DRAIN TRANSACTIONS PRESERVE;
SELECT @@global.rds_preserve_trx_enable AS preserve_enable_after_restart;
preserve_enable_after_restart
1
SELECT @@global.rds_preserve_trx_temp_table_enable AS temp_table_enable_after_restart;
temp_table_enable_after_restart
1
RESUME PRESERVED TRANSACTION 'TOKEN';
COMMIT;
SELECT * FROM t_preserve_default_on ORDER BY id;
id	v
1	11
DROP TABLE t_preserve_default_on;
