DROP TABLE IF EXISTS t_read_view_rc;
SET GLOBAL rds_preserve_trx_enable=ON;
CREATE TABLE t_read_view_rc(a INT PRIMARY KEY, b INT) ENGINE=InnoDB;
INSERT INTO t_read_view_rc VALUES(1,10),(2,200);
SET SESSION TRANSACTION ISOLATION LEVEL READ COMMITTED;
START TRANSACTION;
SELECT * FROM t_read_view_rc WHERE a=1;
a	b
1	10
UPDATE t_read_view_rc SET b=20 WHERE a=1;
SELECT * FROM t_read_view_rc WHERE a=1;
a	b
1	20
UPDATE t_read_view_rc SET b=201 WHERE a=2;
DRAIN TRANSACTIONS PRESERVE;
UPDATE t_read_view_rc SET b=30 WHERE a=1;
RESUME PRESERVED TRANSACTION 'TOKEN';
SELECT * FROM t_read_view_rc WHERE a=1;
a	b
1	30
SELECT * FROM t_read_view_rc WHERE a=2;
a	b
2	201
UPDATE t_read_view_rc SET b=40 WHERE a=1;
SELECT * FROM t_read_view_rc WHERE a=1;
a	b
1	40
SELECT * FROM t_read_view_rc WHERE a=2;
a	b
2	201
SELECT COUNT(*) AS remaining_preserved
FROM performance_schema.preserved_transactions;
remaining_preserved
0
COMMIT;
SELECT * FROM t_read_view_rc ORDER BY a;
a	b
1	40
2	201
DROP TABLE t_read_view_rc;
SET GLOBAL rds_preserve_trx_enable=ON;
