DROP TABLE IF EXISTS t_read_uncommitted_after_resume;
SET GLOBAL preserve_trx_enable=ON;
CREATE TABLE t_read_uncommitted_after_resume(
id INT PRIMARY KEY,
v INT
) ENGINE=InnoDB;
INSERT INTO t_read_uncommitted_after_resume VALUES(1,10),(2,20);
SET SESSION TRANSACTION ISOLATION LEVEL READ UNCOMMITTED;
START TRANSACTION;
UPDATE t_read_uncommitted_after_resume SET v=21 WHERE id=2;
DRAIN TRANSACTIONS PRESERVE WITH TIMEOUT 300;
SELECT ISOLATION, HAS_READ_VIEW, RV_LOW_LIMIT_NO
FROM performance_schema.preserved_transactions;
ISOLATION	HAS_READ_VIEW	RV_LOW_LIMIT_NO
READ-UNCOMMITTED	NO	0
START TRANSACTION;
UPDATE t_read_uncommitted_after_resume SET v=99 WHERE id=1;
RESUME PRESERVED TRANSACTION 'TOKEN';
SELECT v AS dirty_value_seen
FROM t_read_uncommitted_after_resume
WHERE id=1;
dirty_value_seen
99
SELECT v AS own_write_seen
FROM t_read_uncommitted_after_resume
WHERE id=2;
own_write_seen
21
ROLLBACK;
ROLLBACK;
SELECT * FROM t_read_uncommitted_after_resume ORDER BY id;
id	v
1	10
2	20
DROP TABLE t_read_uncommitted_after_resume;
SET GLOBAL preserve_trx_enable=ON;
