DROP TABLE IF EXISTS t_read_view_export_fail;
SET GLOBAL preserve_trx_enable=ON;
CREATE TABLE t_read_view_export_fail(a INT PRIMARY KEY, b INT) ENGINE=InnoDB;
INSERT INTO t_read_view_export_fail VALUES(1,10),(2,20);
SET SESSION TRANSACTION ISOLATION LEVEL REPEATABLE READ;
START TRANSACTION;
SELECT * FROM t_read_view_export_fail WHERE a=1;
a	b
1	10
UPDATE t_read_view_export_fail SET b=11 WHERE a=1;
SET SESSION debug="+d,preserve_trx_fail_export_read_view";
DRAIN TRANSACTIONS PRESERVE WITH TIMEOUT 300;
ERROR HY000: Resumable transactions across shutdown do not support this operation
SET SESSION debug="-d,preserve_trx_fail_export_read_view";
SELECT * FROM t_read_view_export_fail WHERE a=1;
a	b
1	11
ROLLBACK;
SELECT * FROM t_read_view_export_fail ORDER BY a;
a	b
1	10
2	20
SELECT COUNT(*) AS preserved_count
FROM performance_schema.preserved_transactions;
preserved_count
0
DROP TABLE t_read_view_export_fail;
SET GLOBAL preserve_trx_enable=ON;
