DROP TABLE IF EXISTS t_recovered_count_rewrite_failclosed;
SET GLOBAL preserve_trx_enable=ON;
CREATE TABLE t_recovered_count_rewrite_failclosed(
a INT PRIMARY KEY,
b INT
) ENGINE=InnoDB;
INSERT INTO t_recovered_count_rewrite_failclosed VALUES(1,10);
START TRANSACTION;
SELECT * FROM t_recovered_count_rewrite_failclosed WHERE a=1 FOR UPDATE;
a	b
1	10
UPDATE t_recovered_count_rewrite_failclosed SET b=11 WHERE a=1;
PREPARE SHUTDOWN PRESERVE TRANSACTION WITH TIMEOUT 300;
# restart: --preserve-trx-enable=ON --debug=d,preserve_trx_fail_recovered_count_rewrite
SELECT COUNT(*) AS preserved_count_after_legacy_rewrite_debug
FROM performance_schema.preserved_transactions;
preserved_count_after_legacy_rewrite_debug
1
SELECT TOKEN, RECOVERED_COUNT AS recovered_count_after_legacy_rewrite_debug
FROM performance_schema.preserved_transactions;
TOKEN	recovered_count_after_legacy_rewrite_debug
TOKEN	1
# restart: --preserve-trx-enable=ON --debug=d,preserve_trx_fail_recovered_count_rewrite
SELECT COUNT(*) AS preserved_count_after_second_restart
FROM performance_schema.preserved_transactions;
preserved_count_after_second_restart
1
SELECT TOKEN, RECOVERED_COUNT AS recovered_count_after_second_restart
FROM performance_schema.preserved_transactions;
TOKEN	recovered_count_after_second_restart
TOKEN	2
RESUME PRESERVED TRANSACTION 'TOKEN';
COMMIT;
SELECT * FROM t_recovered_count_rewrite_failclosed ORDER BY a;
a	b
1	11
DROP TABLE t_recovered_count_rewrite_failclosed;
SET GLOBAL preserve_trx_enable=ON;
