DROP TABLE IF EXISTS t_recover_lock_page_prefetch_off;
SET GLOBAL preserve_trx_enable=ON;
CREATE TABLE t_recover_lock_page_prefetch_off(a INT PRIMARY KEY, b INT)
ENGINE=InnoDB;
INSERT INTO t_recover_lock_page_prefetch_off VALUES(1,10);
START TRANSACTION;
SELECT * FROM t_recover_lock_page_prefetch_off WHERE a=1 FOR UPDATE;
a	b
1	10
UPDATE t_recover_lock_page_prefetch_off SET b=11 WHERE a=1;
DRAIN TRANSACTIONS PRESERVE WITH TIMEOUT 300;
SELECT @@global.preserve_trx_recover_lock_page_prefetch AS prefetch_enabled;
prefetch_enabled
0
RESUME PRESERVED TRANSACTION 'TOKEN';
COMMIT;
SELECT * FROM t_recover_lock_page_prefetch_off ORDER BY a;
a	b
1	11
DROP TABLE t_recover_lock_page_prefetch_off;
