DROP TABLE IF EXISTS t_recover_record_lock_page_n_heap_diag;
SET GLOBAL preserve_trx_enable=ON;
CREATE TABLE t_recover_record_lock_page_n_heap_diag(
a INT PRIMARY KEY,
b INT
) ENGINE=InnoDB;
INSERT INTO t_recover_record_lock_page_n_heap_diag VALUES(1,10),(2,20);
SET SESSION TRANSACTION ISOLATION LEVEL REPEATABLE READ;
START TRANSACTION;
UPDATE t_recover_record_lock_page_n_heap_diag SET b=21 WHERE a=2;
SELECT * FROM t_recover_record_lock_page_n_heap_diag WHERE a=1 FOR SHARE;
a	b
1	10
PREPARE SHUTDOWN PRESERVE TRANSACTION WITH TIMEOUT 300;
# restart: --preserve-trx-enable=ON --debug=d,preserve_trx_corrupt_import_record_lock_page_n_heap
SELECT COUNT(*) AS preserved_count_after_page_n_heap_diag
FROM performance_schema.preserved_transactions;
preserved_count_after_page_n_heap_diag
1
SET SESSION innodb_lock_wait_timeout=1;
UPDATE t_recover_record_lock_page_n_heap_diag SET b=100 WHERE a=1;
ERROR HY000: Lock wait timeout exceeded; try restarting transaction
RESUME PRESERVED TRANSACTION 'TOKEN';
COMMIT;
SELECT * FROM t_recover_record_lock_page_n_heap_diag ORDER BY a;
a	b
1	10
2	21
SELECT COUNT(*) AS remaining_preserved
FROM performance_schema.preserved_transactions;
remaining_preserved
0
DROP TABLE t_recover_record_lock_page_n_heap_diag;
SET GLOBAL preserve_trx_enable=ON;
