DROP TABLE IF EXISTS t_recover_scan_failure;
SET GLOBAL preserve_trx_enable=ON;
CREATE TABLE t_recover_scan_failure(a INT PRIMARY KEY, b INT) ENGINE=InnoDB;
INSERT INTO t_recover_scan_failure VALUES(1,10);
START TRANSACTION;
SELECT * FROM t_recover_scan_failure WHERE a=1 FOR UPDATE;
a	b
1	10
UPDATE t_recover_scan_failure SET b=11 WHERE a=1;
PREPARE SHUTDOWN PRESERVE TRANSACTION WITH TIMEOUT 300;
# restart_abort: --preserve-trx-enable=ON --debug=d,preserve_trx_fail_recover_scan
include/wait_for_pattern_in_file.inc [Failed to scan preserved transaction directory .* during recovery]
include/wait_for_pattern_in_file.inc [safe_process\[[0-9]+\]: Child process: [0-9]+, (exit: 1|killed by signal: 6)]
RESUME PRESERVED TRANSACTION 'TOKEN';
COMMIT;
SELECT * FROM t_recover_scan_failure ORDER BY a;
a	b
1	11
DROP TABLE t_recover_scan_failure;
SET GLOBAL preserve_trx_enable=ON;
