DROP TABLE IF EXISTS t_retired_token_replay;
CALL mtr.add_suppression("Found 1 prepared XA transactions");
SET GLOBAL rds_preserve_trx_enable=ON;
CREATE TABLE t_retired_token_replay(id INT PRIMARY KEY, v INT) ENGINE=InnoDB;
INSERT INTO t_retired_token_replay VALUES(1, 10);
START TRANSACTION;
UPDATE t_retired_token_replay SET v=20 WHERE id=1;
DRAIN TRANSACTIONS PRESERVE;
ROLLBACK;
SELECT COUNT(*) AS preserved_after_retire
FROM performance_schema.preserved_transactions;
preserved_after_retire
0
# restart: --rds-preserve-trx-enable=OFF --skip-log-bin
UPDATE t_retired_token_replay SET v=30 WHERE id=1;
# restart: --rds-preserve-trx-enable=ON --skip-log-bin
XA RECOVER CONVERT XID;
formatID	gtrid_length	bqual_length	data
1836281843	8	32	DATA
SELECT * FROM t_retired_token_replay ORDER BY id;
id	v
1	10
DROP TABLE t_retired_token_replay;
