DROP TABLE IF EXISTS t_recover_record_lock_offset_change;
SET GLOBAL preserve_trx_enable=ON;
CREATE TABLE t_recover_record_lock_offset_change(a INT PRIMARY KEY, b INT) ENGINE=InnoDB;
INSERT INTO t_recover_record_lock_offset_change VALUES(1,10),(2,20);
SET SESSION TRANSACTION ISOLATION LEVEL REPEATABLE READ;
START TRANSACTION;
UPDATE t_recover_record_lock_offset_change SET b=21 WHERE a=2;
SELECT * FROM t_recover_record_lock_offset_change WHERE a=1 FOR SHARE;
a	b
1	10
DRAIN TRANSACTIONS PRESERVE WITH TIMEOUT 300;
# restart: --preserve-trx-enable=ON --debug=d,preserve_trx_corrupt_import_record_lock_offsets
SELECT COUNT(*) AS preserved_count_after_offset_change
FROM performance_schema.preserved_transactions;
preserved_count_after_offset_change
1
RESUME PRESERVED TRANSACTION 'TOKEN';
UPDATE t_recover_record_lock_offset_change SET b=b+100 WHERE a=2;
COMMIT;
SELECT * FROM t_recover_record_lock_offset_change ORDER BY a;
a	b
1	10
2	121
SELECT COUNT(*) AS remaining_preserved
FROM performance_schema.preserved_transactions;
remaining_preserved
0
DROP TABLE t_recover_record_lock_offset_change;
SET GLOBAL preserve_trx_enable=ON;
