DROP TABLE IF EXISTS t_recovered_count_stale_tmp;
SET GLOBAL preserve_trx_enable=ON;
CREATE TABLE t_recovered_count_stale_tmp(a INT PRIMARY KEY, b INT)
ENGINE=InnoDB;
INSERT INTO t_recovered_count_stale_tmp VALUES(1,10);
START TRANSACTION;
SELECT * FROM t_recovered_count_stale_tmp WHERE a=1 FOR UPDATE;
a	b
1	10
UPDATE t_recovered_count_stale_tmp SET b=11 WHERE a=1;
PREPARE SHUTDOWN PRESERVE TRANSACTION WITH TIMEOUT 300;
SELECT TOKEN, RECOVERED_COUNT AS recovered_count_after_first_restart
FROM performance_schema.preserved_transactions;
TOKEN	recovered_count_after_first_restart
TOKEN	1
# restart
SELECT TOKEN, RECOVERED_COUNT AS recovered_count_after_second_restart
FROM performance_schema.preserved_transactions;
TOKEN	recovered_count_after_second_restart
TOKEN	2
RESUME PRESERVED TRANSACTION 'TOKEN';
COMMIT;
SELECT * FROM t_recovered_count_stale_tmp ORDER BY a;
a	b
1	11
DROP TABLE t_recovered_count_stale_tmp;
SET GLOBAL preserve_trx_enable=ON;
