DROP TABLE IF EXISTS t_resume_failure;
SET GLOBAL preserve_trx_enable=ON;
CREATE TABLE t_resume_failure(a INT PRIMARY KEY, b INT) ENGINE=InnoDB;
INSERT INTO t_resume_failure VALUES(1,10);
START TRANSACTION;
SELECT * FROM t_resume_failure WHERE a=1 FOR UPDATE;
a	b
1	10
UPDATE t_resume_failure SET b=11 WHERE a=1;
DRAIN TRANSACTIONS PRESERVE;
SET SESSION sql_log_bin=0;
SET @@session.last_insert_id=987;
SELECT @@session.sql_log_bin AS sql_log_bin_before_failed_resume;
sql_log_bin_before_failed_resume
0
SELECT LAST_INSERT_ID() AS last_insert_id_before_failed_resume;
last_insert_id_before_failed_resume
987
SET SESSION debug="+d,preserve_trx_fail_resume_before_attach";
RESUME PRESERVED TRANSACTION 'TOKEN';
ERROR HY000: Resumable transactions across shutdown do not support this operation
SET SESSION debug="-d,preserve_trx_fail_resume_before_attach";
SELECT @@session.sql_log_bin AS sql_log_bin_after_failed_resume;
sql_log_bin_after_failed_resume
0
SELECT LAST_INSERT_ID() AS last_insert_id_after_failed_resume;
last_insert_id_after_failed_resume
987
SELECT COUNT(*) AS remaining_preserved
FROM performance_schema.preserved_transactions;
remaining_preserved
1
SET SESSION sql_log_bin=1;
RESUME PRESERVED TRANSACTION 'TOKEN';
COMMIT;
SELECT * FROM t_resume_failure ORDER BY a;
a	b
1	11
DROP TABLE t_resume_failure;
SET GLOBAL preserve_trx_enable=ON;
