CALL mtr.add_suppression("Preserved transaction '.*' snapshot cleanup failed after resume; transaction remains attached");
DROP TABLE IF EXISTS t_resume_delete_after_unlink;
SET GLOBAL rds_preserve_trx_enable=ON;
CREATE TABLE t_resume_delete_after_unlink(a INT PRIMARY KEY, b INT) ENGINE=InnoDB;
INSERT INTO t_resume_delete_after_unlink VALUES(1,10);
START TRANSACTION;
SELECT * FROM t_resume_delete_after_unlink WHERE a=1 FOR UPDATE;
a	b
1	10
UPDATE t_resume_delete_after_unlink SET b=11 WHERE a=1;
DRAIN TRANSACTIONS PRESERVE;
SET SESSION debug="+d,preserve_trx_fail_delete_snapshot_after_unlink";
RESUME PRESERVED TRANSACTION 'TOKEN';
SET SESSION debug="-d,preserve_trx_fail_delete_snapshot_after_unlink";
SELECT COUNT(*) AS remaining_preserved
FROM performance_schema.preserved_transactions;
remaining_preserved
0
COMMIT;
SELECT * FROM t_resume_delete_after_unlink ORDER BY a;
a	b
1	11
DROP TABLE t_resume_delete_after_unlink;
SET GLOBAL rds_preserve_trx_enable=ON;
