DROP TABLE IF EXISTS t_resume_activation_failure;
SET GLOBAL preserve_trx_enable=ON;
CREATE TABLE t_resume_activation_failure(a INT PRIMARY KEY, b INT)
ENGINE=InnoDB;
INSERT INTO t_resume_activation_failure VALUES(1,10);
START TRANSACTION;
SELECT * FROM t_resume_activation_failure WHERE a=1 FOR UPDATE;
a	b
1	10
UPDATE t_resume_activation_failure SET b=11 WHERE a=1;
DRAIN TRANSACTIONS PRESERVE WITH TIMEOUT 300;
SET SESSION TRANSACTION ISOLATION LEVEL READ COMMITTED;
SET SESSION debug="+d,preserve_trx_fail_activate_resumed";
RESUME PRESERVED TRANSACTION 'TOKEN';
ERROR HY000: Resumable transactions across shutdown do not support this operation
SELECT @@transaction_isolation AS isolation_after_failed_resume;
isolation_after_failed_resume
READ-COMMITTED
SET SESSION debug="-d,preserve_trx_fail_activate_resumed";
SELECT TOKEN, STATE, LAST_ERROR IS NOT NULL AS has_last_error
FROM performance_schema.preserved_transactions;
TOKEN	STATE	has_last_error
TOKEN	PRESERVED	1
RESUME PRESERVED TRANSACTION 'TOKEN';
COMMIT;
SELECT * FROM t_resume_activation_failure ORDER BY a;
a	b
1	11
DROP TABLE t_resume_activation_failure;
SET GLOBAL preserve_trx_enable=ON;
