DROP TABLE IF EXISTS t_session_off_future_dml;
SET GLOBAL preserve_trx_enable=ON;
SET SESSION sql_log_bin=0;
CREATE TABLE t_session_off_future_dml(a INT PRIMARY KEY, b INT)
ENGINE=InnoDB;
INSERT INTO t_session_off_future_dml VALUES(1,10);
START TRANSACTION;
SELECT * FROM t_session_off_future_dml WHERE a=1 FOR UPDATE;
a	b
1	10
UPDATE t_session_off_future_dml SET b=11 WHERE a=1;
DRAIN TRANSACTIONS PRESERVE;
SELECT BINLOG_STATE, SESSION_SQL_LOG_BIN, WROTE_TO_CACHE, BINLOG_CACHE_SIZE
FROM performance_schema.preserved_transactions;
BINLOG_STATE	SESSION_SQL_LOG_BIN	WROTE_TO_CACHE	BINLOG_CACHE_SIZE
SESSION_OFF_NO_CACHE	OFF	NO	0
RESUME PRESERVED TRANSACTION 'TOKEN';
SELECT @@session.sql_log_bin AS session_sql_log_bin_after_resume;
session_sql_log_bin_after_resume
0
UPDATE t_session_off_future_dml SET b=12 WHERE a=1;
COMMIT;
SELECT * FROM t_session_off_future_dml WHERE a=1;
a	b
1	12
include/assert_grep.inc [resumed session-off transaction remains absent from binlog]
DROP TABLE t_session_off_future_dml;
SET GLOBAL preserve_trx_enable=ON;
