DROP TABLE IF EXISTS t_single_prepare_cleanup;
SET GLOBAL preserve_trx_enable=ON;
CREATE TABLE t_single_prepare_cleanup(
id INT PRIMARY KEY,
v INT
) ENGINE=InnoDB;
INSERT INTO t_single_prepare_cleanup VALUES(1,10);
START TRANSACTION;
UPDATE t_single_prepare_cleanup SET v=11 WHERE id=1;
SET SESSION debug="+d,pfx_prepare_low";
PREPARE SHUTDOWN PRESERVE TRANSACTION WITH TIMEOUT 300;
ERROR HY000: Resumable transactions across shutdown do not support this operation
SET SESSION debug="-d,pfx_prepare_low";
SELECT * FROM t_single_prepare_cleanup WHERE id=1;
id	v
1	11
COMMIT;
SELECT * FROM t_single_prepare_cleanup WHERE id=1;
id	v
1	11
SELECT COUNT(*) AS preserved_count_after_ha_prepare_failure
FROM performance_schema.preserved_transactions;
preserved_count_after_ha_prepare_failure
0
START TRANSACTION;
UPDATE t_single_prepare_cleanup SET v=12 WHERE id=1;
SET SESSION debug="+d,pfx_temp_prepare";
PREPARE SHUTDOWN PRESERVE TRANSACTION WITH TIMEOUT 300;
ERROR HY000: Resumable transactions across shutdown do not support this operation
SET SESSION debug="-d,pfx_temp_prepare";
SELECT * FROM t_single_prepare_cleanup WHERE id=1;
id	v
1	12
COMMIT;
SELECT * FROM t_single_prepare_cleanup WHERE id=1;
id	v
1	12
SELECT COUNT(*) AS preserved_count_after_temp_prepare_failure
FROM performance_schema.preserved_transactions;
preserved_count_after_temp_prepare_failure
0
DROP TABLE t_single_prepare_cleanup;
SET GLOBAL preserve_trx_enable=ON;
