SET GLOBAL preserve_trx_enable=ON;
SET GLOBAL preserve_trx_temp_table_enable=ON;
CREATE TABLE t_temp_no_redo_create_anchor(
id INT PRIMARY KEY,
v INT
) ENGINE=InnoDB;
INSERT INTO t_temp_no_redo_create_anchor VALUES(1, 10);
START TRANSACTION;
UPDATE t_temp_no_redo_create_anchor SET v=11 WHERE id=1;
CREATE TEMPORARY TABLE tmp_temp_no_redo_create_only(
id INT PRIMARY KEY,
v INT
) ENGINE=InnoDB;
DRAIN TRANSACTIONS PRESERVE;
ERROR HY000: Resumable transactions across shutdown do not support this operation
SELECT COUNT(*) AS preserved_count
FROM performance_schema.preserved_transactions;
preserved_count
0
UPDATE t_temp_no_redo_create_anchor SET v=12 WHERE id=1;
COMMIT;
SELECT * FROM t_temp_no_redo_create_anchor ORDER BY id;
id	v
1	12
DROP TEMPORARY TABLE tmp_temp_no_redo_create_only;
DROP TABLE t_temp_no_redo_create_anchor;
SET GLOBAL preserve_trx_temp_table_enable=ON;
SET GLOBAL preserve_trx_enable=ON;
